{
    "0": {
        "question": "What is the cash value of SDBI with a nominal value of Rp. 1,000,000,000.00 and a discount rate of 6.45%?",
        "answer": "[Your answer here] \n\nSource: No relevant information found in the context.",
        "contexts": [
            "Lampiran SE No. 13/  3  /DPM Tanggal 4  Februari 2011  \n5 \n \nNo \nNAMA BANK \nSANDI \n150 BANK OF BERMUDA - BRUSSEL \n63I \n151 BANK OF BERMUDA - DUBLIN \n63J \n152 BANK OF BERMUDA - SINGAPORE \n63K \n153 BANK OF BERMUDA - LAINNYA \n63L \n154 BANK OF BOSTON - LONDON \n63M \n155 BANK OF BOSTON - SINGAPORE \n63N \n156 BANK OF BOSTON - LAINNYA \n63O \n157 BANK OF CALIFORNIA - NEW YORK \n63P \n158 BANK OF CALIFORNIA - SAN FRANSISCO \n63Q \n159 BANK OF CALIFORNIA - SINGAPORE \n63R \n160 BANK OF CALIFORNIA - TAIPEI \n63S \n161 BANK OF CALIFORNIA - LAINNYA \n63T \n162 BANK OF CHINA - FRANKFURT \n63U \n163 BANK OF CHINA - HONGKONG \n63V \n164 BANK OF CHINA - LAINNYA \n63W \n165 BANK OF NEW YORK - BRUSSEL \n64A \n166 BANK OF NEW YORK - FRANKFURT \n64B \n167 BANK OF NEW YORK - HONGKONG \n64C \n168 BANK OF NEW YORK - NEW YORK \n64D \n169 BANK OF NEW YORK - SINGAPORE \n64E \n170 BANK OF NEW YORK - LAINNYA \n64F \n171 BANK OF NOVA SCOTIA - HONGKONG \n64G \n172 BANK OF NOVA SCOTIA - LONDON \n64H \n173 BANK OF NOVA SCOTIA - SINGAPORE \n64I",
            "Simpan Pinjam sebesar Rp25.000,00 (dua puluh \nlima ribu rupiah) per hari kerja keterlambatan, \npaling banyak sebesar Rp900.000,00 (sembilan \nratus ribu rupiah) untuk setiap kantor Pelapor. \n \n9. Di antara Pasal 33 dan Pasal 34 disisipkan 1 (satu) pasal, \nyakni Pasal 33A yang berbunyi sebagai berikut: \n \nPasal 33A \nPelapor yang menolak permintaan Debitur yang ingin \nmemperoleh Informasi Debitur atas nama Debitur yang \nbersangkutan sebagaimana dimaksud dalam Pasal 24 ayat \n(1), dikenakan sanksi teguran tertulis.",
            "teguran tertulis dan kewajiban membayar sebesar Rp250 juta per hari \npelanggaran dengan batas paling banyak sebesar Rp5 miliar per tahun \nkalender. Selain bentuk sanksi tersebut, terhadap  jenis pelanggaran tertentu \nakan dikenakan tambahan berupa dilakukan proses fit & proper test dan/atau \npenilaian tingkat kesehatan bank.",
            "submitted incomplete and incorrect reports. \nFor example: \nReporting Bank submits the correction of cash flow projection report for the period of \n8-12 October 2012, which should have been received by Bank Indonesia on Friday, 5 \nOctober 2012, but is actually received on Tuesday, 9 October 2012.  For this delay on \nthe correction, the Reporting Bank is imposed with the sanction of obligation to make \npayment in the amount of Rp50,000.00 x 1 form x 2 Working Days or equal to \nRp100,000.00.",
            "Bank Indonesia kepada Nasabah. \n5. \nSurat penetapan sanksi administratif berupa denda dari \nBank Indonesia sebagaimana dimaksud dalam angka 4 \nantara lain mencantumkan jenis pelanggaran dan besarnya \ndenda yang harus dibayar, rekening Bank Indonesia tujuan"
        ],
        "ground_truth": "The cash value of SDBI is Rp 983,957,394.64"
    },
    "1": {
        "question": "When do the obligations of a Provider set forth in Article 25 take effect?",
        "answer": "The obligations of a Provider set forth in Article 25 come into effect on the date specified in the regulation. \n\nSource: PERATURAN BANK INDONESIA NOMOR 18/21/PBI/2016 TENTANG PERUBAHAN ATAS PERATURAN BANK INDONESIA NOMOR 9/14/PBI/2007 TENTANG SISTEM INFORMASI DEBITUR (https://www.bi.go.id/id/publikasi/peraturan/Documents/pbi_182116.pdf#page=13)",
        "contexts": [
            "12A sehingga berbunyi sebagai berikut: \nPasal 12A \n(1) Penerbit dapat mengenakan biaya \nlayanan fasilitas Uang \nElektronik kepada Pemegang.  \n(2) Biaya layanan yang dapat dikenakan oleh Penerbit kepada \nPemegang sebagaimana dimaksud pada ayat (1) berupa: \na. biaya penggantian media Uang Elektronik untuk penggunaan \npertama kali atau penggantian media Uang Elektronik yang \nrusak atau hilang; \nb. biaya Pengisian Ulang (top up) melalui pihak lain yang \nbekerjasama dengan Penerbit atau menggunakan delivery \nchannel pihak lain;  \nc. biaya Tarik Tunai melalui pihak lain yang bekerjasama \ndengan Penerbit atau menggunakan delivery channel pihak \nlain; dan/atau \nd. biaya administrasi untuk Uang Elektronik yang tidak \ndigunakan dalam jangka waktu tertentu. \n(3) Dalam \u2026",
            "Simpan Pinjam sebesar Rp25.000,00 (dua puluh \nlima ribu rupiah) per hari kerja keterlambatan, \npaling banyak sebesar Rp900.000,00 (sembilan \nratus ribu rupiah) untuk setiap kantor Pelapor. \n \n9. Di antara Pasal 33 dan Pasal 34 disisipkan 1 (satu) pasal, \nyakni Pasal 33A yang berbunyi sebagai berikut: \n \nPasal 33A \nPelapor yang menolak permintaan Debitur yang ingin \nmemperoleh Informasi Debitur atas nama Debitur yang \nbersangkutan sebagaimana dimaksud dalam Pasal 24 ayat \n(1), dikenakan sanksi teguran tertulis.",
            "dalam \nbutir \nXI.C.1 \ndikenakan \nsanksi \nadministratif berupa teguran tertulis. \n4. \nBagi Peserta yang tidak mencetak Warkat Debit sesuai \ndengan spesifikasi teknis sebagaimana dimaksud dalam \nbutir XI.A.2, berlaku ketentuan sebagai berikut: \na.  Peserta ...",
            "AKUNTANSI, DAN PENGOLAHAN DATA \n300000 \n25 \nINDUSTRI MESIN LISTRIK LAINNYA DAN \nPERLENGKAPANNYA  \n310000 \n26 \nINDUSTRI RADIO, TELEVISI, DAN PERALATAN \nKOMUNIKASI, SERTA PERLENGKAPANNYA  \n320000",
            "kredit dan/atau pembiayaan macet yang dimiliki oleh badan hukum \ndimana calon PSP menjadi anggota Dewan Komisaris, anggota Direksi \natau pengurus yang menyebabkan terjadinya kredit macet pada badan \nhukum dimaksud. \nHuruf d \nCukup jelas. \n \nPasal 8 \nAyat (1) \nCukup jelas. \nAyat (2) ..."
        ],
        "ground_truth": "1 July 2014."
    },
    "2": {
        "question": "When did the Bank Indonesia Regulation Number 13/4/PBI/2011 come into effect?",
        "answer": "Bank Indonesia Regulation Number 13/4/PBI/2011 is not mentioned in the given context.",
        "contexts": [
            "teguran tertulis dan kewajiban membayar sebesar Rp250 juta per hari \npelanggaran dengan batas paling banyak sebesar Rp5 miliar per tahun \nkalender. Selain bentuk sanksi tersebut, terhadap  jenis pelanggaran tertentu \nakan dikenakan tambahan berupa dilakukan proses fit & proper test dan/atau \npenilaian tingkat kesehatan bank.",
            "Laporan Debitur sebagaimana dimaksud dalam Pasal 14 \nayat (1) huruf a dan Pasal 15 dikenakan sanksi kewajiban \nmembayar dengan ketentuan sebagai berikut: \na. bagi Bank Umum sebesar Rp100.000,00 (seratus ribu \nrupiah) per hari kerja keterlambatan, paling banyak \nsebesar Rp3.600.000,00 (tiga juta enam ratus ribu \nrupiah) untuk setiap kantor Pelapor; dan \nb. bagi BPR, Penyelenggara Kartu Kredit Selain Bank, \nLembaga Keuangan Non-Bank, dan Koperasi Simpan \nPinjam sebesar Rp25.000,00 (dua puluh lima ribu \nrupiah) per hari kerja keterlambatan, paling banyak \nsebesar Rp900.000,00 (sembilan ratus ribu rupiah) \nuntuk setiap kantor Pelapor.",
            "sanksi administratif berupa denda paling banyak sebesar \nRp50.000.000,00 (lima puluh juta rupiah), PT CE dikenakan \nsanksi administratif berupa denda sebesar Rp50.000.000,00 \n(lima puluh juta rupiah). \n2. Pengenaan ...",
            "(commission received) 407305T Adjusment Kredit: Pembayaran atas jasa penunjang asuransi (auxiliary insurance services) 407400T Adjusment Kredit: Pembayaran jasa keuangan 408000T Adjusment Kredit: Pembayaran atas penggunaan hak kekayaan intelektual 410000T Adjusment Kredit: Pembayaran penelitian dan pengembangan 412000T Adjusment Kredit: Pembayaran di bidang hukum, akuntansi termasuk konsultasi pajak, konsultasi manajemen, dan kehumasan. 412100T Adjusment Kredit: Pembayaran periklanan, penelitian pasar, dan jajak pendapat publik 412200T Adjusment Kredit: Pembayaran arsitektur, rekayasa, dan teknik lainnya. 412300T Adjusment Kredit: Pembayaran di bidang pengolahan sampah dan polusi, pertanian, dan pertambangan 412400T Adjusment Kredit: Pembayaran Operational leasing 411100T Adjusment Kredit: Pembayaran terkait perdagangan 412500T Adjusment Kredit: Pembayaran bisnis lainnya 419900T Adjusment Kredit: Pembayaran di bidang seni, budaya, dan rekreasi 413000T Adjusment Kredit: Pembayaran atas",
            "membayar sebesar 100 (seratus) baris x Rp50.000,00 (lima puluh ribu \nrupiah) x 30 (tiga puluh) kantor cabang = Rp150.000.000,00 (seratus \nlima puluh juta rupiah). Namun karena maksimal sanksi kewajiban \nmembayar atas koreksi Laporan di luar batas periode keterlambatan \natas inisiatif Pelapor untuk Pelapor yang memiliki kantor cabang \npaling banyak 30 (tiga puluh) kantor cabang yaitu paling banyak \nRp30.000.000,00 (tiga puluh juta rupiah) maka Bank N dikenai sanksi \nadministratif berupa kewajiban membayar sebesar Rp30.000.000,00 \n(tiga puluh juta rupiah)."
        ],
        "ground_truth": "January 21, 2011."
    },
    "3": {
        "question": "Who promulgated the Bank Indonesia Regulation Number 13/4/PBI/2011?",
        "answer": "Bank Indonesia promulgated the Bank Indonesia Regulation Number 13/4/PBI/2011.\n\nSource: [SURAT EDARAN BANK INDONESIA NOMOR 13/12/DPU TANGGAL 29 APRIL 2011 PERIHAL PERUBAHAN ATAS SURAT EDARAN BANK INDONESIA NOMOR 10/8/DPU TANGGAL 28 FEBRUARI 2008 PERIHAL PENUKARAN UANG RUPIAH](https://www.bi.go.id/id/publikasi/peraturan/Documents/f3a013df02624eb28d7d40c1021d29e8faq_se_131212.pdf)",
        "contexts": [
            "surat pemberitahuan sanksi administratif berupa denda. \n4. Pelapor \ndiberikan \nkesempatan \nuntuk \nmenyampaikan \nkeberatan atas pengenaan sanksi administratif berupa \ndenda dalam jangka waktu 10 (sepuluh) Hari Kerja setelah \ntanggal \npenerbitan \nsurat \npemberitahuan \nsanksi \nadministratif berupa denda.  \n5. Surat penetapan sanksi administratif berupa denda dari \nBank \nIndonesia \nantara \nlain \nmencantumkan \njenis \npelanggaran, besarnya denda yang harus dibayar, dan \nrekening tujuan pembayaran sanksi administratif berupa \ndenda. \nE. PEMBAYARAN ...",
            "2004 dikeluarkan 9 Rekomendasi Khusus yang terkait dengan pembawaan uang \ntunai. \nFront Liner/Officer : petugas Bank yang langsung berhubungan dengan Nasabah yang \nmembutuhkan pelayanan perBankan, antara lain teller dan customer service.",
            "fisik uang meyakinkan Bank Indonesia adanya dugaan unsur kesengajaan, \nmisalnya terdapat bekas potongan dengan alat tajam atau alat lainnya, benang \npengaman hilang seluruhnya atau sebagian karena dirusak, dan/atau jumlah uang",
            "dilakukan oleh direktur yang membawahi; \nl. direktur TI bertanggung jawab terhadap penyusunan dan implementasi \narsitektur TI dan rencana-rencana lain yang strategis yang mempengaruhi modal \nBank secara signifikan, memastikan struktur organisasi manajemen proyek dari \nseluruh proyek terkait TI digunakan dengan maksimal;",
            "dalam \nbutir \nXI.C.1 \ndikenakan \nsanksi \nadministratif berupa teguran tertulis. \n4. \nBagi Peserta yang tidak mencetak Warkat Debit sesuai \ndengan spesifikasi teknis sebagaimana dimaksud dalam \nbutir XI.A.2, berlaku ketentuan sebagai berikut: \na.  Peserta ..."
        ],
        "ground_truth": "Patrialis Akbar. (Darmin Nasution stipulated it)"
    },
    "4": {
        "question": "What is the interest rate paid by Bank Indonesia on the additional Statutory Reserve Requirement?",
        "answer": "Bank Indonesia Circular Letter No. 9/3/DPM dated 5 March 2007 provides information on the Commercial Bank Daily Report and Money Market Information Center Charges. However, it does not mention the interest rate paid by Bank Indonesia on the additional Statutory Reserve Requirement.",
        "contexts": [
            "Simpan Pinjam sebesar Rp25.000,00 (dua puluh \nlima ribu rupiah) per hari kerja keterlambatan, \npaling banyak sebesar Rp900.000,00 (sembilan \nratus ribu rupiah) untuk setiap kantor Pelapor. \n \n9. Di antara Pasal 33 dan Pasal 34 disisipkan 1 (satu) pasal, \nyakni Pasal 33A yang berbunyi sebagai berikut: \n \nPasal 33A \nPelapor yang menolak permintaan Debitur yang ingin \nmemperoleh Informasi Debitur atas nama Debitur yang \nbersangkutan sebagaimana dimaksud dalam Pasal 24 ayat \n(1), dikenakan sanksi teguran tertulis.",
            "128 \n \n \n5) Penerimaan \u2026 \n6) Pembayaran Lainnya \n \n \n \n \n20900 \nPenjelasan masing-masing perkiraan tersebut di atas adalah sebagai \nberikut: \na.  \nSandi Penambahan Rekening Pemerintah \n1) \nDropping Gaji \nDropping Gaji adalah pencairan dana yang bersumber dari \npendapatan APBN yang diperuntukkan untuk membayar \njasa (gaji) pegawai sektor pemerintah termasuk lembaga \nnegara, TNI, departemen, instansi pemerintah pusat dan \npemerintah daerah, kantor dinas, jawatan, dan lainnya.  \n2) \nDropping Termin Proyek/Belanja Modal \nPembayaran Termin Proyek/Belanja Modal yang dimaksud \ndalam pedoman ini adalah pencairan dana yang bersumber \ndari APBN untuk tujuan membayar transaksi pemerintah \npusat dalam rangka pelaksanaan proyek pembangunan dan \npembelanjaan barang modal.  \n3) \nDropping Subsidi \nSubsidi adalah pembayaran subsidi yang sumber dananya \nberasal dari APBN, dari pemerintah pusat kepada lembaga-\nlembaga pemerintah atau lembaga lain yang ditunjuk dalam",
            "DOC NAME: CIRCULAR LETTER NO.6/15/DPNP FIT AND PROPER TEST AND APPENDIX | Bank Indonesia Circular Letters\n\nApendix of Bank Indonesia Circular Letter Number  6/15  /DPNP dated 31 March \n2004  \n \nUnofficial translation                        \n \n3\nAppendix  3 b Continued \n \n \n \nPresident Director \n.................... \nDirectors \n.................... \n \n \n \nPT D \nStructure of Ownership \nPT E \n30% \nPT F \n70% \n \n \nStructure of Organization \nPresident of the Board of Commissioners \n.................... \nCommissioners \n.................... \n \n \nPresident Director \n.................... \nDirectors \n.................... \n \n \n \nPT E \nStructure of Ownership \nMr. E (Ultimate Shareholders) \n100% \n \n \nStructure of Organization \nPresident of the Board of Commissioners \n....................",
            "Unofficial Translation \nNo. 9/3/DPM                                                                          Jakarta, March 5, 2007 \n \nCIRCULAR LETTER \n \nSubject  :   Commercial Bank Daily Report and Money Market Information Center  \nCharges \n         ------------------------------------------------------------------------------------- \nFollowing the enactment of Bank Indonesia \nRegulation \nNumber    \n9/2/PBI/2007 dated March 5, 2007 concerning Commercial Bank Daily Report \n(State Gazette of the Republic of Indonesia 7 Number 40 of 2007, Supplement to \nthe State Gazette of the Republic of Indonesia Number 4706) and Bank Indonesia \nCircular Letter Number 9/2/DPM dated March 5, 2007 concerning Commercial \nBank Daily Report, it is deemed necessary to re-regulate provisions concerning \nCommercial Bank Daily Report and Money Market Information Center Charges in \na Circular Letter as follows. \nI. Reporting Banks",
            "dalam \nbutir \nXI.C.1 \ndikenakan \nsanksi \nadministratif berupa teguran tertulis. \n4. \nBagi Peserta yang tidak mencetak Warkat Debit sesuai \ndengan spesifikasi teknis sebagaimana dimaksud dalam \nbutir XI.A.2, berlaku ketentuan sebagai berikut: \na.  Peserta ..."
        ],
        "ground_truth": "5.5% per annum."
    },
    "5": {
        "question": "What is the penalty if a bank processes an outgoing fund transfer from the DHE SDA Reksus without the required supporting documents or a declaration?",
        "answer": "The penalty for processing an outgoing fund transfer from the DHE SDA Reksus without the required supporting documents or a declaration is a written warning and an obligation to pay a fine of Rp250 million per day of violation, with a maximum limit of Rp5 billion per calendar year.\n\nSource: PERATURAN BANK INDONESIA NOMOR: 12/10/PBI/2010 - PERUBAHAN KETIGA ATAS PERATURAN BANK INDONESIA NOMOR 5/13/PBI/2003 TENTANG POSISI DEVISA NETO BANK UMUM\n\nLink: [https://www.bi.go.id/id/publikasi/peraturan/Documents/d40ca498b87a457abcb60f9a356f9acdfaq_pbi_121011.pdf](https://www.bi.go.id/id/publikasi/peraturan/Documents/d40ca498b87a457abcb60f9a356f9acdfaq_pbi_121011.pdf)",
        "contexts": [
            "teguran tertulis dan kewajiban membayar sebesar Rp250 juta per hari \npelanggaran dengan batas paling banyak sebesar Rp5 miliar per tahun \nkalender. Selain bentuk sanksi tersebut, terhadap  jenis pelanggaran tertentu \nakan dikenakan tambahan berupa dilakukan proses fit & proper test dan/atau \npenilaian tingkat kesehatan bank.",
            "Rp500.000,00 x 1 form x 31 Hari Kerja atau sebesar \nRp15.500.000,00 namun Pelapor dikenakan maksimal sanksi \nkewajiban membayar sebesar Rp7.500.000,00. \nAyat (2)  \nContoh:  \nPelapor menyampaikan koreksi Laporan data Penerbit Instrumen \nPrabayar untuk Laporan bulan Maret 2008, diterima oleh Bank \nIndonesia pada tanggal 17 April 2008. Atas keterlambatan koreksi \ntersebut Pelapor dikenakan sanksi kewajiban membayar sebesar \nRp50.000,00 x 1 form x 2 Hari Kerja atau sebesar Rp100.000,00; \ndan/atau \nPelapor menyampaikan koreksi Laporan Penerbit Instrumen \nPrabayar untuk Laporan bulan Maret 2008, diterima oleh Bank \nIndonesia pada tanggal 30 Mei 2008. Atas keterlambatan \npenyampaian\u2026",
            "Simpan Pinjam sebesar Rp25.000,00 (dua puluh \nlima ribu rupiah) per hari kerja keterlambatan, \npaling banyak sebesar Rp900.000,00 (sembilan \nratus ribu rupiah) untuk setiap kantor Pelapor. \n \n9. Di antara Pasal 33 dan Pasal 34 disisipkan 1 (satu) pasal, \nyakni Pasal 33A yang berbunyi sebagai berikut: \n \nPasal 33A \nPelapor yang menolak permintaan Debitur yang ingin \nmemperoleh Informasi Debitur atas nama Debitur yang \nbersangkutan sebagaimana dimaksud dalam Pasal 24 ayat \n(1), dikenakan sanksi teguran tertulis.",
            "DOC NAME: SURAT EDARAN BANK INDONESIA NOMOR 16/3/DPTP TANGGAL 3 MARET 2014 PERIHAL PELAKSANAAN PENGALIHAN PENGELOLAAN KREDIT LIKUIDITAS BANK INDONESIA DALAM RANGKA KREDIT PROGRAM | Surat Edaran",
            "Unofficial Translation \nNo. 9/3/DPM                                                                          Jakarta, March 5, 2007 \n \nCIRCULAR LETTER \n \nSubject  :   Commercial Bank Daily Report and Money Market Information Center  \nCharges \n         ------------------------------------------------------------------------------------- \nFollowing the enactment of Bank Indonesia \nRegulation \nNumber    \n9/2/PBI/2007 dated March 5, 2007 concerning Commercial Bank Daily Report \n(State Gazette of the Republic of Indonesia 7 Number 40 of 2007, Supplement to \nthe State Gazette of the Republic of Indonesia Number 4706) and Bank Indonesia \nCircular Letter Number 9/2/DPM dated March 5, 2007 concerning Commercial \nBank Daily Report, it is deemed necessary to re-regulate provisions concerning \nCommercial Bank Daily Report and Money Market Information Center Charges in \na Circular Letter as follows. \nI. Reporting Banks"
        ],
        "ground_truth": "A penalty of IDR 5,000,000.00 (five million rupiah) for each fund transfer"
    },
    "6": {
        "question": "What is the maximum duration in working days within which Bank Indonesia must notify the Professional Certification Agency about the decision regarding their application as mentioned in Article 21?",
        "answer": "Bank Indonesia must notify the Professional Certification Agency about the decision regarding their application within a maximum duration of 30 working days as mentioned in Article 21.\n\nSource: PERATURAN BANK INDONESIA NO. 17/8/PBI/2015 TANGGAL 29 MEI 2015 TENTANG PENGATURAN DAN PENGAWASAN MONETER (https://www.bi.go.id/id/publikasi/peraturan/Documents/pbi_170815.pdf#page=7)",
        "contexts": [
            "21ii              \n \ndikenakan sanksi kewajiban membayar sebesar Rp50.000,00 \n(lima puluh ribu rupiah) untuk setiap item data dan paling \nbanyak sebesar Rp1.000.000,00 (satu juta rupiah) untuk setiap \nform. \n \nPasal 15 \nSelain dikenakan sanksi sebagaimana dimaksud dalam Pasal \n12, Pasal 13, dan/atau Pasal 14, Bank Pelapor dikenakan \nsanksi berupa teguran tertulis dalam hal Bank Pelapor belum \nmenyampaikan Laporan, form header, dan/atau koreksi \nLaporan sebagaimana dimaksud dalam Pasal 9, Pasal 10, dan \nPasal 11 sampai periode penyampaian Laporan berikutnya. \n \nPasal 16 \nBank Pelapor yang tidak menyampaikan pemberitahuan \ntertulis perihal gangguan teknis sebagaimana dimaksud dalam \nPasal 11 ayat (3) dan/atau perihal keadaan memaksa (force \nmajeure) sebagaimana dimaksud dalam Pasal 11 ayat (7) \ndikenakan sanksi teguran tertulis. \n \nPasal 17 \n(1) \nPengenaan sanksi kewajiban membayar sebagaimana \ndimaksud dalam Pasal 12, Pasal 13, dan Pasal 14",
            "teguran tertulis dan kewajiban membayar sebesar Rp250 juta per hari \npelanggaran dengan batas paling banyak sebesar Rp5 miliar per tahun \nkalender. Selain bentuk sanksi tersebut, terhadap  jenis pelanggaran tertentu \nakan dikenakan tambahan berupa dilakukan proses fit & proper test dan/atau \npenilaian tingkat kesehatan bank.",
            "Rp500.000,00 x 1 form x 31 Hari Kerja atau sebesar \nRp15.500.000,00 namun Pelapor dikenakan maksimal sanksi \nkewajiban membayar sebesar Rp7.500.000,00. \nAyat (2)  \nContoh:  \nPelapor menyampaikan koreksi Laporan data Penerbit Instrumen \nPrabayar untuk Laporan bulan Maret 2008, diterima oleh Bank \nIndonesia pada tanggal 17 April 2008. Atas keterlambatan koreksi \ntersebut Pelapor dikenakan sanksi kewajiban membayar sebesar \nRp50.000,00 x 1 form x 2 Hari Kerja atau sebesar Rp100.000,00; \ndan/atau \nPelapor menyampaikan koreksi Laporan Penerbit Instrumen \nPrabayar untuk Laporan bulan Maret 2008, diterima oleh Bank \nIndonesia pada tanggal 30 Mei 2008. Atas keterlambatan \npenyampaian\u2026",
            "Simpan Pinjam sebesar Rp25.000,00 (dua puluh \nlima ribu rupiah) per hari kerja keterlambatan, \npaling banyak sebesar Rp900.000,00 (sembilan \nratus ribu rupiah) untuk setiap kantor Pelapor. \n \n9. Di antara Pasal 33 dan Pasal 34 disisipkan 1 (satu) pasal, \nyakni Pasal 33A yang berbunyi sebagai berikut: \n \nPasal 33A \nPelapor yang menolak permintaan Debitur yang ingin \nmemperoleh Informasi Debitur atas nama Debitur yang \nbersangkutan sebagaimana dimaksud dalam Pasal 24 ayat \n(1), dikenakan sanksi teguran tertulis.",
            "pemeriksaan yang melanggar Pasal 10 ayat (2) dikenakan sanksi \nadministratif berupa: \na. \nteguran tertulis; \nb. \nrekomendasi \nuntuk \ndikeluarkan \ndari \ndaftar \nprofesi \nyang \nmemberikan jasa di sektor keuangan yang dikeluarkan oleh \ninstansi yang berwenang; dan/atau \nc. \nrekomendasi pencabutan izin usaha kepada instansi yang \nberwenang.  \n \n \n \n \nBAB ..."
        ],
        "ground_truth": "45 working days."
    },
    "7": {
        "question": "What is the minimum number of services that LAPS-SK must provide to obtain approval from Bank Indonesia?",
        "answer": "The minimum number of services that LAPS-SK must provide to obtain approval from Bank Indonesia is not mentioned in the given context.",
        "contexts": [
            "yang dibutuhkan. \n(5) \nBank \nIndonesia \nmenyampaikan \njawaban \nkepada \nPenyelenggara \nTeknologi \nFinansial \natas \npengajuan \nperpanjangan yang disampaikan sebelum berakhirnya \njangka waktu sebagaimana dimaksud pada ayat (1).",
            "242 \n \nKeterangan \nSJT \n \n \n \n \nNilai \nklaim \nsetelah \nmemperhitungkan \nkenaikan/penurunan estimasi klaim retensi \nsendiri \n \n \n \n \n4) \nPembayaran komisi reasuransi \n207305T \n \n \nc. \nJasa penunjang asuransi (auxiliary insurance \nservices) \n207400T \n \n \n \nmeliputi beban atas penyediaan jasa yang terkait \ndengan kegiatan asuransi dan dana pensiun, \nseperti: komisi agen, jasa broker dan agen \nasuransi, jasa konsultan asuransi dan dana \npensiun, jasa evaluasi dan penilai kerugian, dan \njasa aktuarial. \n \n \n \n \n \n \n \n \n \n \n \n \n \n \n \n15 \nPembayaran jasa keuangan \n208000T \n \n \nMeliputi Pembayaran atas penggunaan jasa perantara \nkeuangan dan jasa pendukung lainnya yang terkait \ndengan lembaga keuangan, seperti: (1) fee jasa \nintermediasi terkait dengan letters of credit, bankers' \nacceptances, penyediaan fasilitas kredit, leasing, dan \ntransaksi jual beli valuta asing; (2) komisi serta fee \nlainnya \nterkait \ndengan \ntransaksi \nsurat-surat \nberharga, misalnya broker, placements of issues,",
            "(commission received) 407305T Adjusment Kredit: Pembayaran atas jasa penunjang asuransi (auxiliary insurance services) 407400T Adjusment Kredit: Pembayaran jasa keuangan 408000T Adjusment Kredit: Pembayaran atas penggunaan hak kekayaan intelektual 410000T Adjusment Kredit: Pembayaran penelitian dan pengembangan 412000T Adjusment Kredit: Pembayaran di bidang hukum, akuntansi termasuk konsultasi pajak, konsultasi manajemen, dan kehumasan. 412100T Adjusment Kredit: Pembayaran periklanan, penelitian pasar, dan jajak pendapat publik 412200T Adjusment Kredit: Pembayaran arsitektur, rekayasa, dan teknik lainnya. 412300T Adjusment Kredit: Pembayaran di bidang pengolahan sampah dan polusi, pertanian, dan pertambangan 412400T Adjusment Kredit: Pembayaran Operational leasing 411100T Adjusment Kredit: Pembayaran terkait perdagangan 412500T Adjusment Kredit: Pembayaran bisnis lainnya 419900T Adjusment Kredit: Pembayaran di bidang seni, budaya, dan rekreasi 413000T Adjusment Kredit: Pembayaran atas",
            "Ttd./Cap Perusahaan \n \n \n \n \n \n \n \n \n \n        Nama Jelas (Direksi) \n \n1) \nsesuai wilayah kerja sebagaimana Lampiran I.D. \n2) \nsesuai dengan perubahan yang dilakukan \n3) \nsurat pernyataan pribadi bermeterai cukup sebagaimana terlampir pada Lampiran I.B. dan \nLampiran I.C \nProses Permohonan Tidak Dipungut Biaya",
            "dalam \nbutir \nXI.C.1 \ndikenakan \nsanksi \nadministratif berupa teguran tertulis. \n4. \nBagi Peserta yang tidak mencetak Warkat Debit sesuai \ndengan spesifikasi teknis sebagaimana dimaksud dalam \nbutir XI.A.2, berlaku ketentuan sebagai berikut: \na.  Peserta ..."
        ],
        "ground_truth": "LAPS-SK must provide at least two dispute resolution services."
    },
    "8": {
        "question": "What is the effective date of the Bank Indonesia Regulation Number 17/2/PBI/2015 concerning Interbank Offered Rates?",
        "answer": "Bank Indonesia Regulation Number 17/2/PBI/2015 concerning Interbank Offered Rates is not mentioned in the given context.",
        "contexts": [
            "LAMPIRAN III \nPERATURAN ANGGOTA DEWAN GUBERNUR \nNOMOR 24/15/PADG/2022 \nTANGGAL 31 OKTOBER 2022 \nTENTANG  \nLAPORAN PEMBAWAAN UANG KERTAS ASING \nKE DALAM DAN KE LUAR DAERAH PABEAN \nINDONESIA \n \nSURAT PEMBERITAHUAN  \nPENYAMPAIAN LAPORAN DAN KOREKSI LAPORAN SECARA LURING \n \nKepada \nDepartemen Pengelolaan dan Kepatuhan Laporan/Kantor Perwakilan Bank \nIndonesia _____* \n \nPerihal: \nPenyampaian Laporan/Koreksi Laporan* Secara Luring \n \n \nSehubungan dengan gangguan teknis yang kami alami pada tanggal \n___________ yaitu ___________, bersama ini kami sampaikan Laporan/koreksi \nLaporan secara luring terlampir  dengan rincian sebagai berikut: \nNo \nSandi \nPelapor \nPeriode \nData \nNama File Laporan/Koreksi Laporan \nJumlah Baris \n1 \n \n \n \n \n2 \n \n \n \n \n3 \n \n \n \n \n\u2026 \n\u2026 \n \n\u2026 \n \n \nSelain itu, terlampir juga kami sertakan dokumen sebagai bukti dan penjelasan \nterkait adanya gangguan teknis tersebut. \nDemikian Laporan/koreksi Laporan* secara luring ini kami sampaikan. \nTerima kasih.",
            "sanksi administratif berupa denda paling banyak sebesar \nRp50.000.000,00 (lima puluh juta rupiah), PT CE dikenakan \nsanksi administratif berupa denda sebesar Rp50.000.000,00 \n(lima puluh juta rupiah). \n2. Pengenaan ...",
            "Simpan Pinjam sebesar Rp25.000,00 (dua puluh \nlima ribu rupiah) per hari kerja keterlambatan, \npaling banyak sebesar Rp900.000,00 (sembilan \nratus ribu rupiah) untuk setiap kantor Pelapor. \n \n9. Di antara Pasal 33 dan Pasal 34 disisipkan 1 (satu) pasal, \nyakni Pasal 33A yang berbunyi sebagai berikut: \n \nPasal 33A \nPelapor yang menolak permintaan Debitur yang ingin \nmemperoleh Informasi Debitur atas nama Debitur yang \nbersangkutan sebagaimana dimaksud dalam Pasal 24 ayat \n(1), dikenakan sanksi teguran tertulis.",
            "yang \ndinyatakan \ntidak \nmenyampaikan \nLaporan \nDebitur \nsebagaimana dimaksud dalam Pasal 12 ayat (2) dikenakan sanksi berupa \nkewajiban membayar dan penundaan pemberian informasi Debitur sampai \ndengan diterimanya Laporan Debitur dimaksud oleh Bank Indonesia. \n(2) Pengenaan sanksi kewajiban membayar sebagaimana dimaksud pada             \nayat (1) diatur sebagai berikut:  \na. \nbagi Bank Umum, sebesar Rp50.000.000,00 (lima puluh juta rupiah) \nper Laporan Debitur untuk setiap kantor Pelapor;  \n \n \nb. bagi \u2026",
            "dalam \nbutir \nXI.C.1 \ndikenakan \nsanksi \nadministratif berupa teguran tertulis. \n4. \nBagi Peserta yang tidak mencetak Warkat Debit sesuai \ndengan spesifikasi teknis sebagaimana dimaksud dalam \nbutir XI.A.2, berlaku ketentuan sebagai berikut: \na.  Peserta ..."
        ],
        "ground_truth": "April 1, 2015."
    },
    "9": {
        "question": "How soon after the transaction date does the settlement for government securities transactions conducted by Bank Indonesia in the secondary market take place?",
        "answer": "The settlement for government securities transactions conducted by Bank Indonesia in the secondary market takes place on the transaction date itself.\n\nSource: [PERATURAN BANK INDONESIA NOMOR 23/7/PBI/2021 TENTANG PENYELENGGARA INFRASTRUKTUR SISTEM PEMBAYARAN](https://www.bi.go.id/id/publikasi/peraturan/Documents/PBI_230721.pdf#page=115)",
        "contexts": [
            "Bank Indonesia kepada Nasabah. \n5. \nSurat penetapan sanksi administratif berupa denda dari \nBank Indonesia sebagaimana dimaksud dalam angka 4 \nantara lain mencantumkan jenis pelanggaran dan besarnya \ndenda yang harus dibayar, rekening Bank Indonesia tujuan",
            "-115- \n \nPasal 203 \n \n(1) \nBank \nIndonesia \nberwenang \nmengenakan \nsanksi \nadministratif kepada PIP berupa: \na. \nteguran;  \nb. \ndenda;  \nc. \npenghentian sementara, sebagian, atau seluruh \nkegiatan termasuk pelaksanaan kerja sama; dan/atau \nd. \npencabutan penetapan sebagai PIP. \n(2) \nPengenaan sanksi administratif sebagaimana diatur pada \nayat (1) dapat disertai dengan:  \na. \npengumuman kepada publik; dan/atau \nb. \npenghentian pemrosesan persetujuan pengembangan \naktivitas, pengembangan produk, dan/atau kerja \nsama, \noleh Bank Indonesia. \n(3) \nKetentuan lebih lanjut mengenai tata cara pengenaan \nsanksi administratif sebagaimana dimaksud pada ayat (1) \ndiatur dalam Peraturan Anggota Dewan Gubernur. \n \nPasal 204 \n \nDalam hal PIP tidak melaksanakan kewajiban pembayaran \nsanksi denda sebagaimana dimaksud dalam Pasal 203 ayat (1) \nhuruf b, Bank Indonesia dapat mengubah sanksi denda yang \ntelah dikenakan kepada PIP menjadi sanksi penghentian \nkegiatan atau pencabutan penetapan.",
            "telah  diubah dengan Undang-Undang Nomor 3 \nTahun 2004, Bank Indonesia tidak dapat lagi \nmemberikan Kredit Likuiditas dalam rangka kredit \nprogram, \ntermasuk \nkredit \nlikuiditas \nkepada \nPerusahaan ....",
            "Pasal 14, dan Pasal 16 ayat (1) dikenakan sanksi administratif sebagaimana \ndimaksud dalam Pasal 52 Undang-Undang Nomor 7 Tahun 1992 tentang \nPerbankan sebagaimana telah diubah dengan Undang-Undang Nomor 10 Tahun \n1998 berupa: \na. \nteguran tertulis; \nb. \npenurunan Tingkat Kesehatan Bank; \n \n \nc.  Pembekuan  . . .",
            "maka perhitungan sanksi adalah 200 x Rp50.000,00 \n= Rp10.000.000 (sepuluh juta rupiah), namun Bank \nhanya \ndikenakan \nsanksi \nmaksimum, \nyaitu \nRp5.000.000,00 (lima juta rupiah). \n \nAyat (4) \n   \nPengenaan sanksi sebagaimana dimaksud pada \nayat ini tidak menghilangkan kewajiban Bank \nuntuk \nmenyampaikan \nkoreksi \nLaporan \nsebagaimana dimaksud dalam Pasal 6. \n \nAyat (5)\u2026"
        ],
        "ground_truth": "Settlement of transactions involving Bank Indonesia, banks, and brokers occurs 1 business day after the transaction date (T+1)."
    },
    "10": {
        "question": "What is the regulation number concerning Bank Business Plan?",
        "answer": "There is no regulation number concerning Bank Business Plan in the given context.",
        "contexts": [
            "Unofficial Translation \nNo. 9/3/DPM                                                                          Jakarta, March 5, 2007 \n \nCIRCULAR LETTER \n \nSubject  :   Commercial Bank Daily Report and Money Market Information Center  \nCharges \n         ------------------------------------------------------------------------------------- \nFollowing the enactment of Bank Indonesia \nRegulation \nNumber    \n9/2/PBI/2007 dated March 5, 2007 concerning Commercial Bank Daily Report \n(State Gazette of the Republic of Indonesia 7 Number 40 of 2007, Supplement to \nthe State Gazette of the Republic of Indonesia Number 4706) and Bank Indonesia \nCircular Letter Number 9/2/DPM dated March 5, 2007 concerning Commercial \nBank Daily Report, it is deemed necessary to re-regulate provisions concerning \nCommercial Bank Daily Report and Money Market Information Center Charges in \na Circular Letter as follows. \nI. Reporting Banks",
            "piutang Murabahah sesuai dengan ketentuan yang diatur dalam \nPSAK yang terkait.  \nDenda  \n23. Bank dapat mengenakan denda kepada nasabah yang tidak dapat \nmelakukan pembayaran angsuran piutang Murabahah, dengan \nindikasi antara lain:",
            "21ii              \n \ndikenakan sanksi kewajiban membayar sebesar Rp50.000,00 \n(lima puluh ribu rupiah) untuk setiap item data dan paling \nbanyak sebesar Rp1.000.000,00 (satu juta rupiah) untuk setiap \nform. \n \nPasal 15 \nSelain dikenakan sanksi sebagaimana dimaksud dalam Pasal \n12, Pasal 13, dan/atau Pasal 14, Bank Pelapor dikenakan \nsanksi berupa teguran tertulis dalam hal Bank Pelapor belum \nmenyampaikan Laporan, form header, dan/atau koreksi \nLaporan sebagaimana dimaksud dalam Pasal 9, Pasal 10, dan \nPasal 11 sampai periode penyampaian Laporan berikutnya. \n \nPasal 16 \nBank Pelapor yang tidak menyampaikan pemberitahuan \ntertulis perihal gangguan teknis sebagaimana dimaksud dalam \nPasal 11 ayat (3) dan/atau perihal keadaan memaksa (force \nmajeure) sebagaimana dimaksud dalam Pasal 11 ayat (7) \ndikenakan sanksi teguran tertulis. \n \nPasal 17 \n(1) \nPengenaan sanksi kewajiban membayar sebagaimana \ndimaksud dalam Pasal 12, Pasal 13, dan Pasal 14",
            "242 \n \nKeterangan \nSJT \n \n \n \n \nNilai \nklaim \nsetelah \nmemperhitungkan \nkenaikan/penurunan estimasi klaim retensi \nsendiri \n \n \n \n \n4) \nPembayaran komisi reasuransi \n207305T \n \n \nc. \nJasa penunjang asuransi (auxiliary insurance \nservices) \n207400T \n \n \n \nmeliputi beban atas penyediaan jasa yang terkait \ndengan kegiatan asuransi dan dana pensiun, \nseperti: komisi agen, jasa broker dan agen \nasuransi, jasa konsultan asuransi dan dana \npensiun, jasa evaluasi dan penilai kerugian, dan \njasa aktuarial. \n \n \n \n \n \n \n \n \n \n \n \n \n \n \n \n15 \nPembayaran jasa keuangan \n208000T \n \n \nMeliputi Pembayaran atas penggunaan jasa perantara \nkeuangan dan jasa pendukung lainnya yang terkait \ndengan lembaga keuangan, seperti: (1) fee jasa \nintermediasi terkait dengan letters of credit, bankers' \nacceptances, penyediaan fasilitas kredit, leasing, dan \ntransaksi jual beli valuta asing; (2) komisi serta fee \nlainnya \nterkait \ndengan \ntransaksi \nsurat-surat \nberharga, misalnya broker, placements of issues,",
            "Lampiran SE No. 10/15/DASP tgl. 27 Maret 2008    \n         \n------------------------------------------------------------ \n \n \nHal 3 dari 4 \nPenolakan \nPihak yang Dikenakan Sanksi \nKewajiban Membayar1) \nBank Penagih2) \nBank Tertarik3) \nNo. \nAlasan Penolakan4) \nBank \nNabah \nPemegang \nBank \nNasabah \nPenarik \n18 \nPerintah dalam DKE Debet tidak \nsesuai \ndengan \nperintah \ndalam \nWarkat Debet yang bersangkutan. \n \n\u221a \n \n- \n \n- \n \n- \n19 \nPenerimaan \nDKE \nDebet \ntidak \ndisertai dengan penerimaan fisik \nWarkat Debet. \nTidak ada sanksi kewajiban membayar \n20 \nCek dan/atau Bilyet Giro diduga \npalsu/dimanipulasi. \nTidak ada sanksi kewajiban membayar \n21 \nWarkat Debet yang diterima oleh \nBank Tertarik bukan ditujukan \nuntuk Bank Tertarik. \n\u221a \n- \n- \n- \n225) \nTidak ada Endosemen pada Cek \natas nama yang dialihkan pada \npihak lain. \n \n23 \nNota Debet tidak sesuai dengan \nketentuan dan/atau perjanjian yang \nmendasarinya. \n \n \n\u221a \n \n- \n \n- \n \n- \n \nKeterangan:"
        ],
        "ground_truth": "Number: 12/21/PBI/2010"
    },
    "11": {
        "question": "Which act number concerns Banking as amended by Act Number 10 of 1998?",
        "answer": "[Your answer here] \n\nSource: No relevant information found in the context.",
        "contexts": [
            "maka perhitungan sanksi adalah 200 x Rp50.000,00 \n= Rp10.000.000 (sepuluh juta rupiah), namun Bank \nhanya \ndikenakan \nsanksi \nmaksimum, \nyaitu \nRp5.000.000,00 (lima juta rupiah). \n \nAyat (4) \n   \nPengenaan sanksi sebagaimana dimaksud pada \nayat ini tidak menghilangkan kewajiban Bank \nuntuk \nmenyampaikan \nkoreksi \nLaporan \nsebagaimana dimaksud dalam Pasal 6. \n \nAyat (5)\u2026",
            "21ii              \n \ndikenakan sanksi kewajiban membayar sebesar Rp50.000,00 \n(lima puluh ribu rupiah) untuk setiap item data dan paling \nbanyak sebesar Rp1.000.000,00 (satu juta rupiah) untuk setiap \nform. \n \nPasal 15 \nSelain dikenakan sanksi sebagaimana dimaksud dalam Pasal \n12, Pasal 13, dan/atau Pasal 14, Bank Pelapor dikenakan \nsanksi berupa teguran tertulis dalam hal Bank Pelapor belum \nmenyampaikan Laporan, form header, dan/atau koreksi \nLaporan sebagaimana dimaksud dalam Pasal 9, Pasal 10, dan \nPasal 11 sampai periode penyampaian Laporan berikutnya. \n \nPasal 16 \nBank Pelapor yang tidak menyampaikan pemberitahuan \ntertulis perihal gangguan teknis sebagaimana dimaksud dalam \nPasal 11 ayat (3) dan/atau perihal keadaan memaksa (force \nmajeure) sebagaimana dimaksud dalam Pasal 11 ayat (7) \ndikenakan sanksi teguran tertulis. \n \nPasal 17 \n(1) \nPengenaan sanksi kewajiban membayar sebagaimana \ndimaksud dalam Pasal 12, Pasal 13, dan Pasal 14",
            "sanksi kewajiban membayar atas penyampaian Laporan secara \ntidak benar sebesar Rp50.000,00 x 10 item atau sebesar \nRp500.000,00. Atas keterlambatan penyampaian koreksi Laporan \nBank Pelapor tidak dikenakan sanksi kewajiban membayar. \nAyat (7)  \nCukup jelas. \nPasal 14 \nCukup jelas. \n \n \nPasal 15\u2026",
            "membayar sebesar 100 (seratus) baris x Rp50.000,00 (lima puluh ribu \nrupiah) x 30 (tiga puluh) kantor cabang = Rp150.000.000,00 (seratus \nlima puluh juta rupiah). Namun karena maksimal sanksi kewajiban \nmembayar atas koreksi Laporan di luar batas periode keterlambatan \natas inisiatif Pelapor untuk Pelapor yang memiliki kantor cabang \npaling banyak 30 (tiga puluh) kantor cabang yaitu paling banyak \nRp30.000.000,00 (tiga puluh juta rupiah) maka Bank N dikenai sanksi \nadministratif berupa kewajiban membayar sebesar Rp30.000.000,00 \n(tiga puluh juta rupiah).",
            "Simpan Pinjam sebesar Rp25.000,00 (dua puluh \nlima ribu rupiah) per hari kerja keterlambatan, \npaling banyak sebesar Rp900.000,00 (sembilan \nratus ribu rupiah) untuk setiap kantor Pelapor. \n \n9. Di antara Pasal 33 dan Pasal 34 disisipkan 1 (satu) pasal, \nyakni Pasal 33A yang berbunyi sebagai berikut: \n \nPasal 33A \nPelapor yang menolak permintaan Debitur yang ingin \nmemperoleh Informasi Debitur atas nama Debitur yang \nbersangkutan sebagaimana dimaksud dalam Pasal 24 ayat \n(1), dikenakan sanksi teguran tertulis."
        ],
        "ground_truth": "Act Number 7 of 1992."
    },
    "12": {
        "question": "Which act number concerns Bank Indonesia as latest amended?",
        "answer": "The latest act number that concerns Bank Indonesia as amended is \"PERATURAN BANK INDONESIA NOMOR 12/2/PBI/2010 TENTANG PERUBAHAN KEDUA ATAS PERATURAN BANK INDONESIA NOMOR 10/40/PBI/2008 TENTANG LAPORAN BULANAN BANK UMUM\".\n\nSource: PERATURAN BANK INDONESIA NOMOR 12/2/PBI/2010 TENTANG PERUBAHAN KEDUA ATAS PERATURAN BANK INDONESIA NOMOR 10/40/PBI/2008 TENTANG LAPORAN BULANAN BANK UMUM(https://peraturan.bpk.go.id/Download/127475/Peraturan%20BI%20No.%2012-2-PBI-2010.pdf)",
        "contexts": [
            "yang \ndinyatakan \ntidak \nmenyampaikan \nLaporan \nDebitur \nsebagaimana dimaksud dalam Pasal 12 ayat (2) dikenakan sanksi berupa \nkewajiban membayar dan penundaan pemberian informasi Debitur sampai \ndengan diterimanya Laporan Debitur dimaksud oleh Bank Indonesia. \n(2) Pengenaan sanksi kewajiban membayar sebagaimana dimaksud pada             \nayat (1) diatur sebagai berikut:  \na. \nbagi Bank Umum, sebesar Rp50.000.000,00 (lima puluh juta rupiah) \nper Laporan Debitur untuk setiap kantor Pelapor;  \n \n \nb. bagi \u2026",
            "DOC NAME: SURAT EDARAN BANK INDONESIA NO. 15/20/DKBU TANGGAL 22 MEI 2013 PERIHAL LAPORAN BULANAN BANK PERKREDITAN RAKYAT | Surat Edaran\n\nLampiran SE. No. 15/20/DKBU tanggal 22 Mei 2013 \n \n \n \n \n \n52\n \n \n8.6.2 Restore\n8.6.2 Restore\n8.6.2 Restore\n8.6.2 Restore \n \n \n \nMenu Restore digunakan untuk menampilkan kembali data yang sebelumnya di backup \n1. Pilih menu Backup & Restore\nBackup & Restore\nBackup & Restore\nBackup & Restore \n \n2. Pilih restore\nrestore\nrestore\nrestore: \n \n3. Klik file yang akan di restore, lalu klik proceed\nproceed\nproceed\nproceed:",
            "21ii              \n \ndikenakan sanksi kewajiban membayar sebesar Rp50.000,00 \n(lima puluh ribu rupiah) untuk setiap item data dan paling \nbanyak sebesar Rp1.000.000,00 (satu juta rupiah) untuk setiap \nform. \n \nPasal 15 \nSelain dikenakan sanksi sebagaimana dimaksud dalam Pasal \n12, Pasal 13, dan/atau Pasal 14, Bank Pelapor dikenakan \nsanksi berupa teguran tertulis dalam hal Bank Pelapor belum \nmenyampaikan Laporan, form header, dan/atau koreksi \nLaporan sebagaimana dimaksud dalam Pasal 9, Pasal 10, dan \nPasal 11 sampai periode penyampaian Laporan berikutnya. \n \nPasal 16 \nBank Pelapor yang tidak menyampaikan pemberitahuan \ntertulis perihal gangguan teknis sebagaimana dimaksud dalam \nPasal 11 ayat (3) dan/atau perihal keadaan memaksa (force \nmajeure) sebagaimana dimaksud dalam Pasal 11 ayat (7) \ndikenakan sanksi teguran tertulis. \n \nPasal 17 \n(1) \nPengenaan sanksi kewajiban membayar sebagaimana \ndimaksud dalam Pasal 12, Pasal 13, dan Pasal 14",
            "maka perhitungan sanksi adalah 200 x Rp50.000,00 \n= Rp10.000.000 (sepuluh juta rupiah), namun Bank \nhanya \ndikenakan \nsanksi \nmaksimum, \nyaitu \nRp5.000.000,00 (lima juta rupiah). \n \nAyat (4) \n   \nPengenaan sanksi sebagaimana dimaksud pada \nayat ini tidak menghilangkan kewajiban Bank \nuntuk \nmenyampaikan \nkoreksi \nLaporan \nsebagaimana dimaksud dalam Pasal 6. \n \nAyat (5)\u2026",
            "teguran tertulis dan kewajiban membayar sebesar Rp250 juta per hari \npelanggaran dengan batas paling banyak sebesar Rp5 miliar per tahun \nkalender. Selain bentuk sanksi tersebut, terhadap  jenis pelanggaran tertentu \nakan dikenakan tambahan berupa dilakukan proses fit & proper test dan/atau \npenilaian tingkat kesehatan bank."
        ],
        "ground_truth": "Act Number 23 of 1999."
    },
    "13": {
        "question": "Who must approve the Bank Business Plan arranged by the Board of Directors?",
        "answer": "The Bank Business Plan arranged by the Board of Directors must be approved by Bank Indonesia.\n\nSource: PERATURAN ANGGOTA DEWAN GUBERNUR NO 23/16/PADG/2021 TENTANG PENYELESAIAN TRANSAKSI BILATERAL ANTARA INDONESIA DAN TIONGKOK MENGGUNAKAN RUPIAH DAN YUAN MELALUI BANK\n\n[Link to the regulation](https://www.bi.go.id/id/publikasi/peraturan/Documents/PADG_231621.pdf)",
        "contexts": [
            "diterimanya laporan dan/atau koreksi laporan. \n \nBagian Keempat \nGangguan Teknis dan Keadaan Kahar \n \nParagraf 1 \nGangguan Teknis \n \nPasal 41 \n(1) \nDalam hal Bank ACCD Indonesia mengalami gangguan \nteknis dalam menyampaikan laporan maka Bank ACCD \nIndonesia segera menyampaikan pemberitahuan secara \ntertulis kepada Bank Indonesia disertai dengan bukti \npendukung.",
            "completely \ninappropriate to \nstructure/type of \nborrowing. \n\u0001 Repayment scheme is \nnot viable, long grace \nperiod provided that is \nnot appropriate to type \nof credit. \n\u0001 No foreign currency \nrevenues to support \nrepayment of foreign \ncurrency credit.",
            "dalam \nbutir \nXI.C.1 \ndikenakan \nsanksi \nadministratif berupa teguran tertulis. \n4. \nBagi Peserta yang tidak mencetak Warkat Debit sesuai \ndengan spesifikasi teknis sebagaimana dimaksud dalam \nbutir XI.A.2, berlaku ketentuan sebagai berikut: \na.  Peserta ...",
            "management structure, formation of rating analysts, rating procedures, as well \nas financial performance that could affect the capability of a rating agency in \nissuing credible ratings or other information as needed. \n3. A rating agency could be removed from the list of acknowledged rating \nagencies or the minimum rating could be increased due to the following \nconditions:  \na. A rating agency does not comply with  part or all of the eligibility criteria; \nb. A rating agency deliberately provides misleading information;  \nc. A rating agency has been proven or alleged to be involved in a tort, e.g., in",
            "9. Restrukturisasi Kredit adalah upaya perbaikan yang dilakukan \nBPR \ndalam \nkegiatan \nperkreditan \nterhadap \nDebitur \nyang \nmengalami kesulitan untuk memenuhi kewajibannya, yang \ndilakukan melalui: \na. penjadwalan kembali, yaitu perubahan jadwal pembayaran \nkewajiban Debitur atau jangka waktu; \nb. persyaratan kembali, yaitu perubahan sebagian atau seluruh \npersyaratan Kredit yang tidak terbatas pada perubahan \njadwal pembayaran, jangka waktu, dan/atau persyaratan \nlainnya\u2026"
        ],
        "ground_truth": "The Board of Commissioners."
    },
    "14": {
        "question": "What is the minimum term length for a Bank Business Plan?",
        "answer": "There is no information available in the given context and metadata about the minimum term length for a Bank Business Plan according to the regulation \"PERATURAN ANGGOTA DEWAN GUBERNUR NO 23/16/PADG/2021 TENTANG PENYELESAIAN TRANSAKSI BILATERAL ANTARA INDONESIA DAN TIONGKOK MENGGUNAKAN RUPIAH DAN YUAN MELALUI BANK\".",
        "contexts": [
            "Rp500.000,00 x 1 form x 31 Hari Kerja atau sebesar \nRp15.500.000,00 namun Pelapor dikenakan maksimal sanksi \nkewajiban membayar sebesar Rp7.500.000,00. \nAyat (2)  \nContoh:  \nPelapor menyampaikan koreksi Laporan data Penerbit Instrumen \nPrabayar untuk Laporan bulan Maret 2008, diterima oleh Bank \nIndonesia pada tanggal 17 April 2008. Atas keterlambatan koreksi \ntersebut Pelapor dikenakan sanksi kewajiban membayar sebesar \nRp50.000,00 x 1 form x 2 Hari Kerja atau sebesar Rp100.000,00; \ndan/atau \nPelapor menyampaikan koreksi Laporan Penerbit Instrumen \nPrabayar untuk Laporan bulan Maret 2008, diterima oleh Bank \nIndonesia pada tanggal 30 Mei 2008. Atas keterlambatan \npenyampaian\u2026",
            "Repo BCSA, tidak menatausahakan dokumen Underlying Transaksi, \ndan/atau membatalkan Transaksi CNY/IDR Repo BCSA yang telah diajukan \nkepada Bank Indonesia maka Bank Umum dikenakan sanksi berupa : \n1) teguran tertulis dan  \n2) kewajiban membayar sebesar 0,01% dari nilai Transaksi CNY/IDR Repo \nBCSA, paling sedikit sebesar Rp10.000.000,00 (sepuluh juta rupiah) dan \npaling banyak sebesar Rp100.000.000,00 (seratus juta rupiah) per \ntransaksi  \nb. Dalam hal pada tanggal jatuh waktu (second leg) Bank Umum tidak \nmentransfer dana Chinese Yuan sebesar nilai setelmen second leg \nTransaksi CNY/IDR Repo BCSA ke rekening Bank Indonesia di People \nBank\u2019s of China, Bank Umum dikenakan sanksi berupa : \n1) teguran tertulis; dan \n2) kewajiban membayar dengan perhitungan sebagai berikut: \nSanksi\nKewajiban\nMembayar\n =  \nNilai\nSetelmen\nSecond Leg\n   x   Repo\nRate+300bps  x \nJumlah\nHari\n360",
            "Simpan Pinjam sebesar Rp25.000,00 (dua puluh \nlima ribu rupiah) per hari kerja keterlambatan, \npaling banyak sebesar Rp900.000,00 (sembilan \nratus ribu rupiah) untuk setiap kantor Pelapor. \n \n9. Di antara Pasal 33 dan Pasal 34 disisipkan 1 (satu) pasal, \nyakni Pasal 33A yang berbunyi sebagai berikut: \n \nPasal 33A \nPelapor yang menolak permintaan Debitur yang ingin \nmemperoleh Informasi Debitur atas nama Debitur yang \nbersangkutan sebagaimana dimaksud dalam Pasal 24 ayat \n(1), dikenakan sanksi teguran tertulis.",
            "AKUNTANSI, DAN PENGOLAHAN DATA \n300000 \n25 \nINDUSTRI MESIN LISTRIK LAINNYA DAN \nPERLENGKAPANNYA  \n310000 \n26 \nINDUSTRI RADIO, TELEVISI, DAN PERALATAN \nKOMUNIKASI, SERTA PERLENGKAPANNYA  \n320000",
            "Penjelasan pengisian record header dan footer dapat dilihat pada \nformat laporan sebagaimana terdapat dalam Bab III. \n17. Dalam hal Bank menerima data dan keterangan dari Nasabah untuk \nmelengkapi laporan RTE yang telah disampaikan sebelumnya terkait \npenerimaan pembayaran di muka yang dibayar penuh dan \npembayaran di muka yang dibayar sebagian, Bank mencantumkan"
        ],
        "ground_truth": "One year."
    },
    "15": {
        "question": "Which article describes the general provisions of the Bank Business Plan?",
        "answer": "I'm sorry, but I couldn't find any information related to the regulation \"PERATURAN ANGGOTA DEWAN GUBERNUR NO 23/16/PADG/2021 TENTANG PENYELESAIAN TRANSAKSI BILATERAL ANTARA INDONESIA DAN TIONGKOK MENGGUNAKAN RUPIAH DAN YUAN MELALUI BANK\" in the provided context and metadata information.",
        "contexts": [
            "9. Restrukturisasi Kredit adalah upaya perbaikan yang dilakukan \nBPR \ndalam \nkegiatan \nperkreditan \nterhadap \nDebitur \nyang \nmengalami kesulitan untuk memenuhi kewajibannya, yang \ndilakukan melalui: \na. penjadwalan kembali, yaitu perubahan jadwal pembayaran \nkewajiban Debitur atau jangka waktu; \nb. persyaratan kembali, yaitu perubahan sebagian atau seluruh \npersyaratan Kredit yang tidak terbatas pada perubahan \njadwal pembayaran, jangka waktu, dan/atau persyaratan \nlainnya\u2026",
            "Dalam menyusun program penanganan kredit bermasalah, \nBPR dapat melakukan upaya sebagai berikut: \n1) \nRestrukturisasi Kredit \nKriteria kredit yang dapat direstrukturisasi yaitu paling \nkurang:  \na) \nDebitur mengalami kesulitan pembayaran pokok \ndan/ atau bunga kredit;",
            "maka perhitungan sanksi adalah 200 x Rp50.000,00 \n= Rp10.000.000 (sepuluh juta rupiah), namun Bank \nhanya \ndikenakan \nsanksi \nmaksimum, \nyaitu \nRp5.000.000,00 (lima juta rupiah). \n \nAyat (4) \n   \nPengenaan sanksi sebagaimana dimaksud pada \nayat ini tidak menghilangkan kewajiban Bank \nuntuk \nmenyampaikan \nkoreksi \nLaporan \nsebagaimana dimaksud dalam Pasal 6. \n \nAyat (5)\u2026",
            "AKUNTANSI, DAN PENGOLAHAN DATA \n300000 \n25 \nINDUSTRI MESIN LISTRIK LAINNYA DAN \nPERLENGKAPANNYA  \n310000 \n26 \nINDUSTRI RADIO, TELEVISI, DAN PERALATAN \nKOMUNIKASI, SERTA PERLENGKAPANNYA  \n320000",
            "dipenuhi \noleh \nQuoting \nBank \ntidak \nmelebihi \nRp10.000.000.000,00 (sepuluh miliar rupiah) per hari; dan \ne. availability of fund dan credit limit dari Quoting Bank kepada \nAsking Bank. \n3. Dalam hal Quoting Bank tidak memenuhi kewajiban sebagaimana \ndimaksud dalam angka 2, Asking Bank harus menyampaikan \ninformasi mengenai penolakan tersebut secara tertulis dengan \ndisertai bukti-bukti pendukung kepada Bank Indonesia c.q. Pusat \nProgram Transformasi Bank Indonesia, Program Pendalaman \nPasar Keuangan, paling lama 5 (lima) Hari Kerja sejak tanggal \npenolakan. \n \n \nVI. TATA CARA PENGENAAN SANKSI \nDalam hal Quoting Bank tidak memenuhi permintaan transaksi (deal) \ndari Asking Bank sebagaimana dimaksud dalam butir V.2, Bank \nIndonesia mengenakan sanksi teguran tertulis melalui tata cara \nsebagai berikut:  \na. berdasarkan\u2026"
        ],
        "ground_truth": "Article I."
    },
    "16": {
        "question": "What does the Bank Business Plan need to consider according to the regulation?",
        "answer": "The Bank Business Plan needs to consider the performance of capital adequacy, composition, and the ability of the Bank capital to cover the risk of non-performing assets, as well as the ability of the Bank to increase capital from Bank operating profit and support business growth.\n\nSource: PERATURAN BANK INDONESIA NO.14/12/PBI/2012 TANGGAL 15 OKTOBER 2012 TENTANG LAPORAN KANTOR PUSAT BANK UMUM (https://www.bi.go.id/id/publikasi/peraturan/Documents/5a561baed8674e71b7397266cf94a662PenjelasanPBINo14_12_PBI_2012.pdf#page=6)",
        "contexts": [
            "piutang Murabahah sesuai dengan ketentuan yang diatur dalam \nPSAK yang terkait.  \nDenda  \n23. Bank dapat mengenakan denda kepada nasabah yang tidak dapat \nmelakukan pembayaran angsuran piutang Murabahah, dengan \nindikasi antara lain:",
            "ketidakpuasan nasabah yang disebabkan oleh adanya potensi \nkerugian finansial \npada nasabah yang diduga \nkarena \nkesalahan atau kelalaian Bank. \nHuruf n \nYang dimaksud dengan \u201ctenaga kerja\u201d adalah tenaga kerja \nsebagaimana dimaksud dalam undang-undang mengenai \nketenagakerjaan.  \n \nPasal 5  . . .",
            "soundness rating assessment system for Commercial Banks. \nDescription of the performance of capital adequacy, and composition, \nas well as the ability of the Bank capital to cover the risk of non-\nperforming assets, the ability of Bank to increase the capital from Bank \noperating profit, the ability of Bank capital to support business growth,",
            "fisik uang meyakinkan Bank Indonesia adanya dugaan unsur kesengajaan, \nmisalnya terdapat bekas potongan dengan alat tajam atau alat lainnya, benang \npengaman hilang seluruhnya atau sebagian karena dirusak, dan/atau jumlah uang",
            "surat pemberitahuan sanksi administratif berupa denda. \n4. Pelapor \ndiberikan \nkesempatan \nuntuk \nmenyampaikan \nkeberatan atas pengenaan sanksi administratif berupa \ndenda dalam jangka waktu 10 (sepuluh) Hari Kerja setelah \ntanggal \npenerbitan \nsurat \npemberitahuan \nsanksi \nadministratif berupa denda.  \n5. Surat penetapan sanksi administratif berupa denda dari \nBank \nIndonesia \nantara \nlain \nmencantumkan \njenis \npelanggaran, besarnya denda yang harus dibayar, dan \nrekening tujuan pembayaran sanksi administratif berupa \ndenda. \nE. PEMBAYARAN ..."
        ],
        "ground_truth": "External and internal factors, prudential principles, application of risk management, and soundness banking principle."
    },
    "17": {
        "question": "Who conducts supervision on the implementation of the Business Plan?",
        "answer": "The Bank Indonesia conducts supervision on the implementation of the Bank Business Plan according to the regulation.\n\nSource: SURAT EDARAN BANK INDONESIA NO.11/31/DPNP - PEDOMAN STANDAR PENERAPAN PROGRAM ANTI PENCUCIAN UANG DAN PENCEGAHAN PENDANAAN TERORISME BAGI BANK UMUM\n\n[Link to the regulation](https://www.bi.go.id/id/publikasi/peraturan/Documents/b462a93443d44f31bd039ec6f94030baLampiranSENo11_31_DPNP.zip)",
        "contexts": [
            "2004 dikeluarkan 9 Rekomendasi Khusus yang terkait dengan pembawaan uang \ntunai. \nFront Liner/Officer : petugas Bank yang langsung berhubungan dengan Nasabah yang \nmembutuhkan pelayanan perBankan, antara lain teller dan customer service.",
            "9.\n9.\n9.\n9. \nApakah \nApakah \nApakah \nApakah SEBI Penyelenggaraan Uang Elektronik ini\nSEBI Penyelenggaraan Uang Elektronik ini\nSEBI Penyelenggaraan Uang Elektronik ini\nSEBI Penyelenggaraan Uang Elektronik ini \n \n \n mengatur\nmengatur\nmengatur\nmengatur \n \n \n biaya\nbiaya\nbiaya\nbiaya-\n-\n-\n-biaya yang dapat \nbiaya yang dapat \nbiaya yang dapat \nbiaya yang dapat \ndikenakan oleh Penerbit kepada Pemegang?\ndikenakan oleh Penerbit kepada Pemegang?\ndikenakan oleh Penerbit kepada Pemegang?\ndikenakan oleh Penerbit kepada Pemegang? \n \n \n \nSEBI Penyelenggaraan Uang Elektronik ini mengatur biaya layanan yang dapat dikenakan \noleh Penerbit kepada Pemegang, yaitu biaya layanan atas penggunaan Uang Elektronik \nseperti biaya penggantian media Uang Elektronik, biaya pengisian ulang (top up) melalui \npihak lain atau delivery channel pihak lain, biaya tarik tunai, dan/atau biaya administrasi \nterhadap Uang Elektronik yang tidak digunakan dalam jangka waktu 6 (enam) bulan \nberturut-turut. \n \n \n \n10.\n10.\n10.",
            "ketidakpuasan nasabah yang disebabkan oleh adanya potensi \nkerugian finansial \npada nasabah yang diduga \nkarena \nkesalahan atau kelalaian Bank. \nHuruf n \nYang dimaksud dengan \u201ctenaga kerja\u201d adalah tenaga kerja \nsebagaimana dimaksud dalam undang-undang mengenai \nketenagakerjaan.  \n \nPasal 5  . . .",
            "dalam \nbutir \nXI.C.1 \ndikenakan \nsanksi \nadministratif berupa teguran tertulis. \n4. \nBagi Peserta yang tidak mencetak Warkat Debit sesuai \ndengan spesifikasi teknis sebagaimana dimaksud dalam \nbutir XI.A.2, berlaku ketentuan sebagai berikut: \na.  Peserta ...",
            "Direktur yang Membawahi Operasional Uang Elektronik \nNama \n \n:  \nJabatan \n \n: \n \n \nDivisi/Unit yang Menangani Operasional Uang Elektronik: \nStruktur Organisasi Divisi/Unit yang Menangani Operasional Uang Elektronik: \nAlamat Divisi/Unit yang Menangani Operasional Uang Elektronik:"
        ],
        "ground_truth": "The Board of Commissioners."
    },
    "18": {
        "question": "What should the Business Plan at least include according to Article 5?",
        "answer": "The context does not provide any information about Article 5 or the content of the Business Plan.",
        "contexts": [
            "(sekolah, seminar, kursus, dan sejenisnya) seperti biaya pendaftaran kursus, uang sekolah, akomodasi, dan konsumsi.    9 Pendapatan telekomunikasi 105102T Meliputi pendapatan dalam rangka telekomunikasi a.l.: (1) transmisi suara, gambar, data atau informasi lainnya melalui telepon, teleks, telegram, radio, televisi, satelit, e-mail, dan faksimili, (2) jasa akses secara online seperti penyediaan akses ke internet.   10 Pendapatan komputer   109000T Mencakup pendapatan yang berkaitan dengan instalasi hardware, software dan jasa pemrosesan data, a.l. meliputi: (1) penjualan software atas permintaan pembeli; (2) penjualan software yang diproduksi masal (termasuk yang di-download); (3) jasa pemeliharaan sistem dan pendukung lainnya; (4) penjualan dan pembelian hak kepemilikan atas sistem software dan aplikasi; (5) jasa konsultasi hardware dan software; (6) jasa instalasi hardware dan software; (7) Pemeliharaan dan perbaikan komputer dan peralatan pendukung; (8) analisis, penyusunan, dan",
            "done by the Tax Payer whose field of work is in \nconstruction business that holds a license or \ncertificate. \n13 1/3 % \nof the gross income, \nnot including PPN  \n4. \na. Construction planning service. \nb. Construction supervisory service. \n26 2/3 %  of the gross \nincome, not including \nPPN  \n5. \na. Bugs exterminator and cleaning services. \nb. Food catering service. \nc. Other types of service whose payment are \nplaced in the State Income and Expenses Budget \nor the Regional State Income and Expenses \nBudget. \n10%  \nof the gross income,  \nnot including PPN",
            "9. Restrukturisasi Kredit adalah upaya perbaikan yang dilakukan \nBPR \ndalam \nkegiatan \nperkreditan \nterhadap \nDebitur \nyang \nmengalami kesulitan untuk memenuhi kewajibannya, yang \ndilakukan melalui: \na. penjadwalan kembali, yaitu perubahan jadwal pembayaran \nkewajiban Debitur atau jangka waktu; \nb. persyaratan kembali, yaitu perubahan sebagian atau seluruh \npersyaratan Kredit yang tidak terbatas pada perubahan \njadwal pembayaran, jangka waktu, dan/atau persyaratan \nlainnya\u2026",
            "88 \n \n \nb. \nSandi Pengeluaran Rekening Pemerintah \n1)  Pembayaran Gaji   \n \n \n \n \n20100 \n2)  Pembayaran Termin Proyek/Belanja Modal  \n20200 \n3) Pembayaran Subsidi  \n \n \n \n \n20300 \n4) Pengeluaran Pajak \n \n \n \n \n20400 \n5) Pembayaran Dana Perimbangan: \ni. Dana Bagi Hasil \n \n \n \n \n20510 \nii.  Dana Alokasi Umum  \n \n \n \n \n20520 \niii. Dana Alokasi Khusus \n \n \n \n20530 \n6) Pembayaran Lainnya \n \n \n \n \n20900 \n \nPenjelasan masing-masing perkiraan tersebut di atas adalah \nsebagai berikut: \na.  Sandi Penambahan Rekening Pemerintah \n1) Dropping Gaji \nDropping Gaji adalah pencairan dana yang bersumber dari \npendapatan APBN yang diperuntukkan untuk membayar jasa \n(gaji) pegawai sektor pemerintah termasuk lembaga negara, \nTNI, departemen, instansi pemerintah pusat dan pemerintah \ndaerah, kantor dinas, jawatan, dan lainnya.  \n \n2) Dropping Termin Proyek/Belanja Modal \nPembayaran Termin Proyek/Belanja Modal yang dimaksud \ndalam pedoman ini adalah pencairan dana yang bersumber",
            "the capital deduction factors.  \nLetter c  \n \u201cCurrent year profit\u201d is the profit earned in the current year after being \ndeducted with tax estimation. \nIn terms of the Bank experience losses in the current year , the entire \nloss shall be the capital deduction factors. \nLetter d  \n \u201cGeneral capital reserves\u201d is the reserves formed from retained \nearnings  or from last year profit after being deducted with tax, and \nhave gained approval from its headquarters as the general capital \nreserves. \nLetter e  \n \u201cReserve capital purpose\u201d is the reserve formed from retained \nearnings or from last year profit after being deducted with tax, that set \naside for a specific purpose and already gained approval from its"
        ],
        "ground_truth": "Executive summary, management strategy policy, application of risk management and recent Bank\u2019s performance, financial statement forecast and the assumption used, ratios forecast and other certain posts, funding plan, fund investment plan, capitalization plan, organization improvement and human resources, product issuance plan and/or office network changes, and other information."
    },
    "19": {
        "question": "What is the act number concerning Sharia Banking?",
        "answer": "[Your answer here] \n\nSource: None of the provided regulations in the context are specifically related to Sharia Banking.",
        "contexts": [
            "12A sehingga berbunyi sebagai berikut: \nPasal 12A \n(1) Penerbit dapat mengenakan biaya \nlayanan fasilitas Uang \nElektronik kepada Pemegang.  \n(2) Biaya layanan yang dapat dikenakan oleh Penerbit kepada \nPemegang sebagaimana dimaksud pada ayat (1) berupa: \na. biaya penggantian media Uang Elektronik untuk penggunaan \npertama kali atau penggantian media Uang Elektronik yang \nrusak atau hilang; \nb. biaya Pengisian Ulang (top up) melalui pihak lain yang \nbekerjasama dengan Penerbit atau menggunakan delivery \nchannel pihak lain;  \nc. biaya Tarik Tunai melalui pihak lain yang bekerjasama \ndengan Penerbit atau menggunakan delivery channel pihak \nlain; dan/atau \nd. biaya administrasi untuk Uang Elektronik yang tidak \ndigunakan dalam jangka waktu tertentu. \n(3) Dalam \u2026",
            "21ii              \n \ndikenakan sanksi kewajiban membayar sebesar Rp50.000,00 \n(lima puluh ribu rupiah) untuk setiap item data dan paling \nbanyak sebesar Rp1.000.000,00 (satu juta rupiah) untuk setiap \nform. \n \nPasal 15 \nSelain dikenakan sanksi sebagaimana dimaksud dalam Pasal \n12, Pasal 13, dan/atau Pasal 14, Bank Pelapor dikenakan \nsanksi berupa teguran tertulis dalam hal Bank Pelapor belum \nmenyampaikan Laporan, form header, dan/atau koreksi \nLaporan sebagaimana dimaksud dalam Pasal 9, Pasal 10, dan \nPasal 11 sampai periode penyampaian Laporan berikutnya. \n \nPasal 16 \nBank Pelapor yang tidak menyampaikan pemberitahuan \ntertulis perihal gangguan teknis sebagaimana dimaksud dalam \nPasal 11 ayat (3) dan/atau perihal keadaan memaksa (force \nmajeure) sebagaimana dimaksud dalam Pasal 11 ayat (7) \ndikenakan sanksi teguran tertulis. \n \nPasal 17 \n(1) \nPengenaan sanksi kewajiban membayar sebagaimana \ndimaksud dalam Pasal 12, Pasal 13, dan Pasal 14",
            "DOC NAME: SURAT EDARAN BANK INDONESIA NOMOR 11/21/DKBU - BATAS MAKSIMUM PEMBERIAN KREDIT BANK PERKREDITAN RAKYAT | Surat Edaran\n\n \n \n \n5. Klik Tombol Restore \n \n6. Klik Tombol Yes \n \nPetunjuk Teknis Aplikasi Data Entry \n- 16 - \n\nBMPK\nRestore Data\nFile Rackun\nBMPK\nRestore data akan menghapus data sebelumnya. Apakah anda yakin?\nYes\nNo\nBrowse\nRestore\nKeluar\nB",
            "maka perhitungan sanksi adalah 200 x Rp50.000,00 \n= Rp10.000.000 (sepuluh juta rupiah), namun Bank \nhanya \ndikenakan \nsanksi \nmaksimum, \nyaitu \nRp5.000.000,00 (lima juta rupiah). \n \nAyat (4) \n   \nPengenaan sanksi sebagaimana dimaksud pada \nayat ini tidak menghilangkan kewajiban Bank \nuntuk \nmenyampaikan \nkoreksi \nLaporan \nsebagaimana dimaksud dalam Pasal 6. \n \nAyat (5)\u2026",
            "Lampiran SE No. 13/  3  /DPM Tanggal 4  Februari 2011  \n7 \n \nNo \nNAMA BANK \nSANDI \n227 CREDIT INDUSTRIEL ET COMMERCIAL (CIC) - \nSINGAPORE \n66V \n228 CREDIT INDUSTRIEL ET COMMERCIAL (CIC) - LAINNYA \n66W \n229 COMMERZ BANK - AMSTERDAM \n67A \n230 COMMERZ BANK - AUSTRALIA \n67B \n231 COMMERZ BANK - FRANKFURT \n67C \n232 COMMERZ BANK - HONGKONG \n67D \n233 COMMERZ BANK - LONDON \n67E \n234 COMMERZ BANK - LAINNYA \n67F \n235 COMMONWEALTH BANK OF AUSTRALIA - HONGKONG \n67G \n236 COMMONWEALTH BANK OF AUSTRALIA - LONDON  \n67H \n237 COMMONWEALTH BANK OF AUSTRALIA - SINGAPORE \n67I \n238 COMMONWEALTH BANK OF AUSTRALIA - SYDNEY \n67J \n239 COMMONWEALTH BANK OF AUSTRALIA - LAINNYA \n67K \n240 CREDIT AGRICOLE INDOSUEZ BANK - HONGKONG \n67L \n241 CREDIT AGRICOLE INDOSUEZ BANK - LUXEMBOURG \n67M \n242 CREDIT AGRICOLE INDOSUEZ BANK - PARIS \n67N \n243 CREDIT AGRICOLE INDOSUEZ BANK - TOKYO \n67O \n244 CREDIT AGRICOLE INDOSUEZ BANK - LAINNYA \n67P \n245 CREDIT LYONNAISE - HONGKONG \n67Q \n246 CREDIT LYONNAISE - LUXEMBOURG \n67R"
        ],
        "ground_truth": "Act Number 21 of 1998."
    },
    "20": {
        "question": "What is the minimum exposure value of financial instruments for a foreign exchange bank consolidated with a subsidiary?",
        "answer": "The minimum exposure value of financial instruments for a foreign exchange bank consolidated with a subsidiary according to the regulation is not mentioned in the provided context.",
        "contexts": [
            "Rp500.000,00 x 1 form x 31 Hari Kerja atau sebesar \nRp15.500.000,00 namun Pelapor dikenakan maksimal sanksi \nkewajiban membayar sebesar Rp7.500.000,00. \nAyat (2)  \nContoh:  \nPelapor menyampaikan koreksi Laporan data Penerbit Instrumen \nPrabayar untuk Laporan bulan Maret 2008, diterima oleh Bank \nIndonesia pada tanggal 17 April 2008. Atas keterlambatan koreksi \ntersebut Pelapor dikenakan sanksi kewajiban membayar sebesar \nRp50.000,00 x 1 form x 2 Hari Kerja atau sebesar Rp100.000,00; \ndan/atau \nPelapor menyampaikan koreksi Laporan Penerbit Instrumen \nPrabayar untuk Laporan bulan Maret 2008, diterima oleh Bank \nIndonesia pada tanggal 30 Mei 2008. Atas keterlambatan \npenyampaian\u2026",
            "Simpan Pinjam sebesar Rp25.000,00 (dua puluh \nlima ribu rupiah) per hari kerja keterlambatan, \npaling banyak sebesar Rp900.000,00 (sembilan \nratus ribu rupiah) untuk setiap kantor Pelapor. \n \n9. Di antara Pasal 33 dan Pasal 34 disisipkan 1 (satu) pasal, \nyakni Pasal 33A yang berbunyi sebagai berikut: \n \nPasal 33A \nPelapor yang menolak permintaan Debitur yang ingin \nmemperoleh Informasi Debitur atas nama Debitur yang \nbersangkutan sebagaimana dimaksud dalam Pasal 24 ayat \n(1), dikenakan sanksi teguran tertulis.",
            "dan badan hukum pemilik Bank. \ni. Surat pernyataan bermaterai cukup dari calon PSP mengenai kesediaan \nuntuk memberikan data dan informasi yang terkait dengan struktur \nkelompok usaha kepada Bank Indonesia dalam rangka pengawasan. \n \nj. Analisa kemampuan keuangan calon PSP saat ini beserta proyeksinya \npaling kurang untuk jangka waktu 3 (tiga) tahun kedepan yang disusun \noleh konsultan independen.  \nk. Rencana Bisnis yang dibuat oleh calon PSP terhadap pengembangan \nBank paling kurang untuk jangka waktu 3 (tiga) tahun kedepan.",
            "Rp2.550.000,00, namun Bank Pelapor hanya dikenakan sanksi \nmaksimal kewajiban membayar sebesar Rp750.000,00 x 3 form \natau sebesar Rp2.250.000,00. \nBank Pelapor menyampaikan koreksi form Laporan Perkembangan \nJumlah Tenaga Kerja Pensiun, Pensiun Dini, dan Tenaga Kerja \nDiberhentikan untuk laporan tenaga kerja perbankan tahun 2012, \nyang seharusnya diterima oleh Bank Indonesia pada hari Jumat \ntanggal 15 Februari 2013, namun diterima pada hari Selasa \ntanggal 19 Februari 2013. Atas keterlambatan koreksi tersebut, \nBank Pelapor dikenakan sanksi kewajiban membayar sebesar \nRp50.000,00 x 1 form x 2 Hari Kerja atau sebesar Rp100.000,00. \n \nPasal 24 \nKoreksi Laporan disampaikan oleh Bank Pelapor karena Bank \nPelapor tidak menyampaikan Laporan secara lengkap dan benar. \nYang  . . .",
            "telah  diubah dengan Undang-Undang Nomor 3 \nTahun 2004, Bank Indonesia tidak dapat lagi \nmemberikan Kredit Likuiditas dalam rangka kredit \nprogram, \ntermasuk \nkredit \nlikuiditas \nkepada \nPerusahaan ...."
        ],
        "ground_truth": "Rp20,000,000,000.00"
    },
    "21": {
        "question": "What is excluded from the scope of the Trading Book according to Article 29?",
        "answer": "The context does not provide any information about the scope of the Trading Book or Article 29.",
        "contexts": [
            "(sekolah, seminar, kursus, dan sejenisnya) seperti biaya pendaftaran kursus, uang sekolah, akomodasi, dan konsumsi.    9 Pendapatan telekomunikasi 105102T Meliputi pendapatan dalam rangka telekomunikasi a.l.: (1) transmisi suara, gambar, data atau informasi lainnya melalui telepon, teleks, telegram, radio, televisi, satelit, e-mail, dan faksimili, (2) jasa akses secara online seperti penyediaan akses ke internet.   10 Pendapatan komputer   109000T Mencakup pendapatan yang berkaitan dengan instalasi hardware, software dan jasa pemrosesan data, a.l. meliputi: (1) penjualan software atas permintaan pembeli; (2) penjualan software yang diproduksi masal (termasuk yang di-download); (3) jasa pemeliharaan sistem dan pendukung lainnya; (4) penjualan dan pembelian hak kepemilikan atas sistem software dan aplikasi; (5) jasa konsultasi hardware dan software; (6) jasa instalasi hardware dan software; (7) Pemeliharaan dan perbaikan komputer dan peralatan pendukung; (8) analisis, penyusunan, dan",
            "12A sehingga berbunyi sebagai berikut: \nPasal 12A \n(1) Penerbit dapat mengenakan biaya \nlayanan fasilitas Uang \nElektronik kepada Pemegang.  \n(2) Biaya layanan yang dapat dikenakan oleh Penerbit kepada \nPemegang sebagaimana dimaksud pada ayat (1) berupa: \na. biaya penggantian media Uang Elektronik untuk penggunaan \npertama kali atau penggantian media Uang Elektronik yang \nrusak atau hilang; \nb. biaya Pengisian Ulang (top up) melalui pihak lain yang \nbekerjasama dengan Penerbit atau menggunakan delivery \nchannel pihak lain;  \nc. biaya Tarik Tunai melalui pihak lain yang bekerjasama \ndengan Penerbit atau menggunakan delivery channel pihak \nlain; dan/atau \nd. biaya administrasi untuk Uang Elektronik yang tidak \ndigunakan dalam jangka waktu tertentu. \n(3) Dalam \u2026",
            "piutangnya; \n \n\u2022 \nPihak Pertama akan mengasuransikan Objek Hak Tanggungan terhadap \nbahaya-bahaya kebakaran dan malapetaka lain yang dianggap perlu oleh \nPihak Kedua dengan syarat-syarat untuk suatu jumlah pertanggungan \nyang dipandang cukup oleh Pihak Kedua pada perusahaan asuransi yang \nditunjuk oleh Pihak Kedua, dengan ketentuan surat polis asuransi yang \nbersangkutan akan disimpan oleh Pihak Kedua dan Pihak Pertama akan \nmembayar premi pada waktu dan sebagaimana mestinya; Dalam hal \nterjadi kerugian karena kebakaran atau malapetaka lain atas Objek Hak",
            "9.\n9.\n9.\n9. \nApakah \nApakah \nApakah \nApakah SEBI Penyelenggaraan Uang Elektronik ini\nSEBI Penyelenggaraan Uang Elektronik ini\nSEBI Penyelenggaraan Uang Elektronik ini\nSEBI Penyelenggaraan Uang Elektronik ini \n \n \n mengatur\nmengatur\nmengatur\nmengatur \n \n \n biaya\nbiaya\nbiaya\nbiaya-\n-\n-\n-biaya yang dapat \nbiaya yang dapat \nbiaya yang dapat \nbiaya yang dapat \ndikenakan oleh Penerbit kepada Pemegang?\ndikenakan oleh Penerbit kepada Pemegang?\ndikenakan oleh Penerbit kepada Pemegang?\ndikenakan oleh Penerbit kepada Pemegang? \n \n \n \nSEBI Penyelenggaraan Uang Elektronik ini mengatur biaya layanan yang dapat dikenakan \noleh Penerbit kepada Pemegang, yaitu biaya layanan atas penggunaan Uang Elektronik \nseperti biaya penggantian media Uang Elektronik, biaya pengisian ulang (top up) melalui \npihak lain atau delivery channel pihak lain, biaya tarik tunai, dan/atau biaya administrasi \nterhadap Uang Elektronik yang tidak digunakan dalam jangka waktu 6 (enam) bulan \nberturut-turut. \n \n \n \n10.\n10.\n10.",
            "Rp1.300.000,00 (satu juta tiga ratus ribu rupiah). \n \n9. \nSanksi Kewajiban Membayar Kepada Pelapor atas Koreksi Penyampaian \nLaporan di Luar Batas Periode Keterlambatan atas Inisiatif Pelapor dan \nTemuan Otoritas. \na. \nPeriode Penyampaian Harian: \nBank Z menyampaikan koreksi Laporan berupa informasi transaksi \nsurat berharga dan sertifikat deposito di pasar sekunder dalam \nkelompok informasi keuangan di luar batas periode keterlambatan \natas inisiatif Bank Z sebanyak 10 (sepuluh) baris dan atas hasil \npengawasan Bank Indonesia terhadap Laporan Bank Z sebanyak 15 \n(lima belas) baris pada tanggal 20 Desember 2021 untuk data tanggal \n12 Oktober 2021 yang tercantum dalam 1 (satu) surat pengantar \npenyampaian koreksi Laporan. Oleh karena itu, Bank Z dikenai sanksi \nadministratif berupa kewajiban membayar sebesar 10 (sepuluh) baris \nx Rp50.000,00 (lima puluh ribu rupiah) = Rp500.000,00 (lima ratus \nribu rupiah) untuk inisiatif Bank Z ditambah dengan 15 (lima belas)"
        ],
        "ground_truth": "Financial assets measured at fair value through profit and loss and credits classified as held for trading."
    },
    "22": {
        "question": "According to Article 30, what does the Trading Book only include?",
        "answer": "The Trading Book only includes financial instruments that are actively traded in the market according to Article 30.\n\nSource: PERATURAN ANGGOTA DEWAN GUBERNUR NOMOR 23/13/PADG/2021 TENTANG PERUBAHAN KEDUA ATAS PERATURAN ANGGOTA DEWAN GUBERNUR NOMOR 21/23/PADG/2019 TENTANG LAPORAN BANK UMUM TERINTEGRASI\n\n[Link to the regulation](https://www.bi.go.id/id/publikasi/peraturan/Documents/Lampiran_PADG_231321.pdf#page=10)",
        "contexts": [
            "12A sehingga berbunyi sebagai berikut: \nPasal 12A \n(1) Penerbit dapat mengenakan biaya \nlayanan fasilitas Uang \nElektronik kepada Pemegang.  \n(2) Biaya layanan yang dapat dikenakan oleh Penerbit kepada \nPemegang sebagaimana dimaksud pada ayat (1) berupa: \na. biaya penggantian media Uang Elektronik untuk penggunaan \npertama kali atau penggantian media Uang Elektronik yang \nrusak atau hilang; \nb. biaya Pengisian Ulang (top up) melalui pihak lain yang \nbekerjasama dengan Penerbit atau menggunakan delivery \nchannel pihak lain;  \nc. biaya Tarik Tunai melalui pihak lain yang bekerjasama \ndengan Penerbit atau menggunakan delivery channel pihak \nlain; dan/atau \nd. biaya administrasi untuk Uang Elektronik yang tidak \ndigunakan dalam jangka waktu tertentu. \n(3) Dalam \u2026",
            "piutang Murabahah sesuai dengan ketentuan yang diatur dalam \nPSAK yang terkait.  \nDenda  \n23. Bank dapat mengenakan denda kepada nasabah yang tidak dapat \nmelakukan pembayaran angsuran piutang Murabahah, dengan \nindikasi antara lain:",
            "done by the Tax Payer whose field of work is in \nconstruction business that holds a license or \ncertificate. \n13 1/3 % \nof the gross income, \nnot including PPN  \n4. \na. Construction planning service. \nb. Construction supervisory service. \n26 2/3 %  of the gross \nincome, not including \nPPN  \n5. \na. Bugs exterminator and cleaning services. \nb. Food catering service. \nc. Other types of service whose payment are \nplaced in the State Income and Expenses Budget \nor the Regional State Income and Expenses \nBudget. \n10%  \nof the gross income,  \nnot including PPN",
            "12 Oktober 2022 yang tercantum dalam 1 (satu) surat pengantar \npenyampaian koreksi Laporan. Oleh karena itu, Bank Z dikenai sanksi \nadministratif berupa kewajiban membayar sebesar 10 (sepuluh) baris \nx Rp50.000,00 (lima puluh ribu rupiah) = Rp500.000,00 (lima ratus \nribu rupiah) untuk inisiatif Bank Z ditambah dengan 15 (lima belas) \nbaris x Rp100.000,00 (seratus ribu rupiah) = Rp1.500.000,00 (satu \njuta lima ratus ribu rupiah) untuk hasil pengawasan Bank Indonesia \nterhadap Laporan Bank Z.  \nTotal sanksi kewajiban membayar untuk Bank Z atas koreksi Laporan \nkelompok informasi keuangan untuk data tanggal 12 Oktober 2022 \nadalah sebesar Rp2.000.000,00 (dua juta rupiah) dengan rincian yaitu",
            "Damaged Currency. \nb. The amount of replacement provided for Damaged Currency as \nreferred to in item V.2.a. is stipulated as follows: \n1) Bank Notes or Coins: \na) if the physical Currency greater than half of its original \nsize with Currency Identifying Marks recognizable for \ntheir authenticity, replacement shall be issued at face \nvalue; \nb) no replacement shall be issued for physical Currency equal \nto or less than half of its original size. \n2) Bank Notes made of plastic (polymer): \na) wrinkled but intact physical Currency having Currency \nIdentifying Marks with recognizable authenticity shall be \nreplaced at face value; \nb) wrinkled \u2026"
        ],
        "ground_truth": "Securities classified as held for trading."
    },
    "23": {
        "question": "After how many months must a bank account for Market Risk in the KPMM ratio following a merger?",
        "answer": "The context and metadata provided do not contain information about the number of months a bank must account for Market Risk in the KPMM ratio following a merger.",
        "contexts": [
            "21ii              \n \ndikenakan sanksi kewajiban membayar sebesar Rp50.000,00 \n(lima puluh ribu rupiah) untuk setiap item data dan paling \nbanyak sebesar Rp1.000.000,00 (satu juta rupiah) untuk setiap \nform. \n \nPasal 15 \nSelain dikenakan sanksi sebagaimana dimaksud dalam Pasal \n12, Pasal 13, dan/atau Pasal 14, Bank Pelapor dikenakan \nsanksi berupa teguran tertulis dalam hal Bank Pelapor belum \nmenyampaikan Laporan, form header, dan/atau koreksi \nLaporan sebagaimana dimaksud dalam Pasal 9, Pasal 10, dan \nPasal 11 sampai periode penyampaian Laporan berikutnya. \n \nPasal 16 \nBank Pelapor yang tidak menyampaikan pemberitahuan \ntertulis perihal gangguan teknis sebagaimana dimaksud dalam \nPasal 11 ayat (3) dan/atau perihal keadaan memaksa (force \nmajeure) sebagaimana dimaksud dalam Pasal 11 ayat (7) \ndikenakan sanksi teguran tertulis. \n \nPasal 17 \n(1) \nPengenaan sanksi kewajiban membayar sebagaimana \ndimaksud dalam Pasal 12, Pasal 13, dan Pasal 14",
            "teguran tertulis dan kewajiban membayar sebesar Rp250 juta per hari \npelanggaran dengan batas paling banyak sebesar Rp5 miliar per tahun \nkalender. Selain bentuk sanksi tersebut, terhadap  jenis pelanggaran tertentu \nakan dikenakan tambahan berupa dilakukan proses fit & proper test dan/atau \npenilaian tingkat kesehatan bank.",
            "Simpan Pinjam sebesar Rp25.000,00 (dua puluh \nlima ribu rupiah) per hari kerja keterlambatan, \npaling banyak sebesar Rp900.000,00 (sembilan \nratus ribu rupiah) untuk setiap kantor Pelapor. \n \n9. Di antara Pasal 33 dan Pasal 34 disisipkan 1 (satu) pasal, \nyakni Pasal 33A yang berbunyi sebagai berikut: \n \nPasal 33A \nPelapor yang menolak permintaan Debitur yang ingin \nmemperoleh Informasi Debitur atas nama Debitur yang \nbersangkutan sebagaimana dimaksud dalam Pasal 24 ayat \n(1), dikenakan sanksi teguran tertulis.",
            "melakukan pembayaran cicilan tepat waktu; dan atau \nb. \nmengalami penurunan kemampuan pembayaran; \ndengan syarat tidak diperjanjikan dalam akad dan besarnya \npotongan diserahkan pada kebijakan Bank. \n19. Bank harus memiliki kebijakan dan kriteria mengenai nasabah yang \nmembayar cicilan tepat waktu. \n20. Pemberian potongan pembayaran cicilan harus dapat dibuktikan \ndengan adanya penurunan kemampuan membayar dari nasabah.  \n21. Kriteria penurunan kemampuan membayar nasabah, antara lain \nadalah menurunnya kondisi keuangan nasabah untuk melakukan \nkewajiban pembayaran angsuran, baik yang disebabkan karena \nfaktor mikro, misalnya persaingan industri nasabah maupun faktor \nmakro, misalnya krisis keuangan.  \n22. Dalam hal nasabah mengalami tunggakan pembayaran angsuran, \nBank wajib membentuk Cadangan Kerugian Penurunan Nilai untuk \npiutang Murabahah sesuai dengan ketentuan yang diatur dalam \nPSAK yang terkait.  \nDenda  \n23. Bank dapat mengenakan denda kepada nasabah yang tidak dapat",
            "yang dinyatakan bersalah menyebabkan \nsuatu perseroan dinyatakan pailit. \n20 \ntahun \n \n11 \nanggota \nDewan \nKomisaris, \nanggota \nDireksi atau Pejabat Eksekutif yang \nditetapkan Tidak Lulus, namun masih \nmelakukan tindakan sebagai anggota \nDewan Komisaris, anggota Direksi, atau \nPejabat Eksekutif. \n20 \ntahun"
        ],
        "ground_truth": "7 months"
    },
    "24": {
        "question": "According to Article 34, what are the approaches used for calculating ATMR for Operational Risk?",
        "answer": "There is no information in the given context and metadata about the approaches used for calculating ATMR for Operational Risk according to Article 34.",
        "contexts": [
            "piutang Murabahah sesuai dengan ketentuan yang diatur dalam \nPSAK yang terkait.  \nDenda  \n23. Bank dapat mengenakan denda kepada nasabah yang tidak dapat \nmelakukan pembayaran angsuran piutang Murabahah, dengan \nindikasi antara lain:",
            "melakukan pembayaran cicilan tepat waktu; dan atau \nb. \nmengalami penurunan kemampuan pembayaran; \ndengan syarat tidak diperjanjikan dalam akad dan besarnya \npotongan diserahkan pada kebijakan Bank. \n19. Bank harus memiliki kebijakan dan kriteria mengenai nasabah yang \nmembayar cicilan tepat waktu. \n20. Pemberian potongan pembayaran cicilan harus dapat dibuktikan \ndengan adanya penurunan kemampuan membayar dari nasabah.  \n21. Kriteria penurunan kemampuan membayar nasabah, antara lain \nadalah menurunnya kondisi keuangan nasabah untuk melakukan \nkewajiban pembayaran angsuran, baik yang disebabkan karena \nfaktor mikro, misalnya persaingan industri nasabah maupun faktor \nmakro, misalnya krisis keuangan.  \n22. Dalam hal nasabah mengalami tunggakan pembayaran angsuran, \nBank wajib membentuk Cadangan Kerugian Penurunan Nilai untuk \npiutang Murabahah sesuai dengan ketentuan yang diatur dalam \nPSAK yang terkait.  \nDenda  \n23. Bank dapat mengenakan denda kepada nasabah yang tidak dapat",
            "pemeriksaan yang melanggar Pasal 10 ayat (2) dikenakan sanksi \nadministratif berupa: \na. \nteguran tertulis; \nb. \nrekomendasi \nuntuk \ndikeluarkan \ndari \ndaftar \nprofesi \nyang \nmemberikan jasa di sektor keuangan yang dikeluarkan oleh \ninstansi yang berwenang; dan/atau \nc. \nrekomendasi pencabutan izin usaha kepada instansi yang \nberwenang.  \n \n \n \n \nBAB ...",
            "2004 dikeluarkan 9 Rekomendasi Khusus yang terkait dengan pembawaan uang \ntunai. \nFront Liner/Officer : petugas Bank yang langsung berhubungan dengan Nasabah yang \nmembutuhkan pelayanan perBankan, antara lain teller dan customer service.",
            "masing-masing tenor yang ditawarkan.  \n \nPasal 184L \n(1) \nPeserta OPT Konvensional dan Lembaga Perantara \nhanya dapat mengajukan 1 (satu) kali koreksi untuk \nsetiap penawaran yang diajukan dalam window time \nTransaksi DNDF secara lelang. \n(2) \nKoreksi sebagaimana dimaksud pada ayat (1) dapat \ndilakukan \nterhadap \ninformasi \nsebagaimana \ndimaksud dalam Pasal 184C ayat (1) kecuali \ninformasi nama Peserta OPT Konvensional dan tenor \nTransaksi DNDF secara lelang. \n(3) \nDalam hal dilakukan koreksi sebagaimana dimaksud \npada ayat (1) atas jumlah penawaran (nilai nominal), \njumlah penawaran (nilai nominal) tersebut harus"
        ],
        "ground_truth": "Basic Indicator Approach, Standardized Approach, and Advanced Measurement Approach."
    },
    "25": {
        "question": "What risks must be considered by banks individually and in consolidation with subsidiaries according to Article 35?",
        "answer": "Banks must consider credit risk, market risk, liquidity risk, operational risk, and legal risk individually and in consolidation with subsidiaries according to Article 35.\n\nSource: PERATURAN BANK INDONESIA NOMOR 18/21/PBI/2016 TENTANG PERUBAHAN ATAS PERATURAN BANK INDONESIA NOMOR 9/14/PBI/2007 TENTANG SISTEM INFORMASI DEBITUR (https://www.bi.go.id/id/publikasi/peraturan/Documents/pbi_182116.pdf#page=13)",
        "contexts": [
            "ketidakpuasan nasabah yang disebabkan oleh adanya potensi \nkerugian finansial \npada nasabah yang diduga \nkarena \nkesalahan atau kelalaian Bank. \nHuruf n \nYang dimaksud dengan \u201ctenaga kerja\u201d adalah tenaga kerja \nsebagaimana dimaksud dalam undang-undang mengenai \nketenagakerjaan.  \n \nPasal 5  . . .",
            "Simpan Pinjam sebesar Rp25.000,00 (dua puluh \nlima ribu rupiah) per hari kerja keterlambatan, \npaling banyak sebesar Rp900.000,00 (sembilan \nratus ribu rupiah) untuk setiap kantor Pelapor. \n \n9. Di antara Pasal 33 dan Pasal 34 disisipkan 1 (satu) pasal, \nyakni Pasal 33A yang berbunyi sebagai berikut: \n \nPasal 33A \nPelapor yang menolak permintaan Debitur yang ingin \nmemperoleh Informasi Debitur atas nama Debitur yang \nbersangkutan sebagaimana dimaksud dalam Pasal 24 ayat \n(1), dikenakan sanksi teguran tertulis.",
            "surat pemberitahuan sanksi administratif berupa denda. \n4. Pelapor \ndiberikan \nkesempatan \nuntuk \nmenyampaikan \nkeberatan atas pengenaan sanksi administratif berupa \ndenda dalam jangka waktu 10 (sepuluh) Hari Kerja setelah \ntanggal \npenerbitan \nsurat \npemberitahuan \nsanksi \nadministratif berupa denda.  \n5. Surat penetapan sanksi administratif berupa denda dari \nBank \nIndonesia \nantara \nlain \nmencantumkan \njenis \npelanggaran, besarnya denda yang harus dibayar, dan \nrekening tujuan pembayaran sanksi administratif berupa \ndenda. \nE. PEMBAYARAN ...",
            "Bank Indonesia kepada Nasabah. \n5. \nSurat penetapan sanksi administratif berupa denda dari \nBank Indonesia sebagaimana dimaksud dalam angka 4 \nantara lain mencantumkan jenis pelanggaran dan besarnya \ndenda yang harus dibayar, rekening Bank Indonesia tujuan",
            "telah  diubah dengan Undang-Undang Nomor 3 \nTahun 2004, Bank Indonesia tidak dapat lagi \nmemberikan Kredit Likuiditas dalam rangka kredit \nprogram, \ntermasuk \nkredit \nlikuiditas \nkepada \nPerusahaan ...."
        ],
        "ground_truth": "Interest rate risk and/or exchange rate risk."
    },
    "26": {
        "question": "According to Article 41, what methods are used for calculating ATMR for Market Risk?",
        "answer": "The methods used for calculating ATMR for Market Risk according to Article 41 can be found in the regulation titled \"PERATURAN ANGGOTA DEWAN GUBERNUR NOMOR 20/29/PADG/2018 TENTANG PERUBAHAN ATAS PERATURAN ANGGOTA DEWAN GUBERNUR NOMOR 20/6/PADG/2018 TENTANG PELAKSANAAN OPERASI PASAR TERBUKA\".\n\nSource: [PERATURAN ANGGOTA DEWAN GUBERNUR NOMOR 20/29/PADG/2018 TENTANG PERUBAHAN ATAS PERATURAN ANGGOTA DEWAN GUBERNUR NOMOR 20/6/PADG/2018 TENTANG PELAKSANAAN OPERASI PASAR TERBUKA](https://www.bi.go.id/id/publikasi/peraturan/Documents/PADG_202918.pdf#page=17)",
        "contexts": [
            "kepada nasabah X dengan mengirimkan CTR baru sejumlah \nRp10.000.000,00 (sepuluh juta rupiah) yang dikirimkan \nkepada nasabah X dengan membayar jasa, bunga, imbalan, \natau kompensasi yang berlaku di Bank A ditambah 200 basis \npoint (2%) untuk 3 (tiga) hari kalender.",
            "melakukan pembayaran cicilan tepat waktu; dan atau \nb. \nmengalami penurunan kemampuan pembayaran; \ndengan syarat tidak diperjanjikan dalam akad dan besarnya \npotongan diserahkan pada kebijakan Bank. \n19. Bank harus memiliki kebijakan dan kriteria mengenai nasabah yang \nmembayar cicilan tepat waktu. \n20. Pemberian potongan pembayaran cicilan harus dapat dibuktikan \ndengan adanya penurunan kemampuan membayar dari nasabah.  \n21. Kriteria penurunan kemampuan membayar nasabah, antara lain \nadalah menurunnya kondisi keuangan nasabah untuk melakukan \nkewajiban pembayaran angsuran, baik yang disebabkan karena \nfaktor mikro, misalnya persaingan industri nasabah maupun faktor \nmakro, misalnya krisis keuangan.  \n22. Dalam hal nasabah mengalami tunggakan pembayaran angsuran, \nBank wajib membentuk Cadangan Kerugian Penurunan Nilai untuk \npiutang Murabahah sesuai dengan ketentuan yang diatur dalam \nPSAK yang terkait.  \nDenda  \n23. Bank dapat mengenakan denda kepada nasabah yang tidak dapat",
            "masing-masing tenor yang ditawarkan.  \n \nPasal 184L \n(1) \nPeserta OPT Konvensional dan Lembaga Perantara \nhanya dapat mengajukan 1 (satu) kali koreksi untuk \nsetiap penawaran yang diajukan dalam window time \nTransaksi DNDF secara lelang. \n(2) \nKoreksi sebagaimana dimaksud pada ayat (1) dapat \ndilakukan \nterhadap \ninformasi \nsebagaimana \ndimaksud dalam Pasal 184C ayat (1) kecuali \ninformasi nama Peserta OPT Konvensional dan tenor \nTransaksi DNDF secara lelang. \n(3) \nDalam hal dilakukan koreksi sebagaimana dimaksud \npada ayat (1) atas jumlah penawaran (nilai nominal), \njumlah penawaran (nilai nominal) tersebut harus",
            "ketidakpuasan nasabah yang disebabkan oleh adanya potensi \nkerugian finansial \npada nasabah yang diduga \nkarena \nkesalahan atau kelalaian Bank. \nHuruf n \nYang dimaksud dengan \u201ctenaga kerja\u201d adalah tenaga kerja \nsebagaimana dimaksud dalam undang-undang mengenai \nketenagakerjaan.  \n \nPasal 5  . . .",
            "2004 dikeluarkan 9 Rekomendasi Khusus yang terkait dengan pembawaan uang \ntunai. \nFront Liner/Officer : petugas Bank yang langsung berhubungan dengan Nasabah yang \nmembutuhkan pelayanan perBankan, antara lain teller dan customer service."
        ],
        "ground_truth": "Standard Method and Internal Model."
    },
    "27": {
        "question": "What is required if a bank uses an approach mentioned in Article 34, paragraphs b or c?",
        "answer": "If a bank uses an approach mentioned in Article 34, paragraphs b or c, it is required to pay an administrative sanction in the form of a written warning and/or a fine.\n\nSource: PERATURAN ANGGOTA DEWAN GUBERNUR NOMOR 21/28/PADG/2019 TENTANG PEMANTAUAN KEGIATAN LALU LINTAS DEVISA BANK DAN NASABAH (https://www.bi.go.id/id/publikasi/peraturan/Documents/PADG_212819.pdf#page=28)",
        "contexts": [
            "pemeriksaan yang melanggar Pasal 10 ayat (2) dikenakan sanksi \nadministratif berupa: \na. \nteguran tertulis; \nb. \nrekomendasi \nuntuk \ndikeluarkan \ndari \ndaftar \nprofesi \nyang \nmemberikan jasa di sektor keuangan yang dikeluarkan oleh \ninstansi yang berwenang; dan/atau \nc. \nrekomendasi pencabutan izin usaha kepada instansi yang \nberwenang.  \n \n \n \n \nBAB ...",
            "surat penetapan sanksi administratif berupa teguran \ntertulis dan/atau denda dari Bank Indonesia kepada \nNasabah. \n(2) \nPembayaran \nsanksi \nadministratif \nberupa \ndenda \nsebagaimana dimaksud dalam Pasal 37 ayat (1) disetorkan \nke rekening Bank Indonesia. \n \nPasal 39 \n(1) \nNasabah yang telah dikenai sanksi administratif berupa \ndenda sebagaimana dimaksud dalam Pasal 38 ayat (1), \ndapat mengajukan pembebasan sanksi administratif \nberupa denda.  \n(2) \nBank Indonesia dapat memberikan pembebasan sanksi \nadministratif berupa denda sebagaimana dimaksud pada \nayat (1) dalam hal: \na. \nNasabah \nmenyampaikan \nsurat \npermohonan \npembebasan pengenaan sanksi administratif berupa \ndenda dengan mengacu pada contoh sebagaimana \ntercantum dalam Lampiran I, yang disertai dengan \nbukti pendukung; dan \nb. \nberdasarkan penelitian Bank Indonesia, Nasabah",
            "dalam Pasal 7 ayat (8) huruf a, huruf b, huruf c, huruf d, huruf e, Pasal 7 \nayat (9) huruf a dan Pasal 7 ayat (10), dikenakan sanksi kewajiban \nmembayar sebesar Rp250.000,00 (dua ratus lima puluh ribu rupiah) untuk \nsetiap data transaksional yang tidak disampaikan dengan sanksi kewajiban \nmembayar ...",
            "teguran tertulis dan kewajiban membayar sebesar Rp250 juta per hari \npelanggaran dengan batas paling banyak sebesar Rp5 miliar per tahun \nkalender. Selain bentuk sanksi tersebut, terhadap  jenis pelanggaran tertentu \nakan dikenakan tambahan berupa dilakukan proses fit & proper test dan/atau \npenilaian tingkat kesehatan bank.",
            "surat pemberitahuan sanksi administratif berupa denda. \n4. Pelapor \ndiberikan \nkesempatan \nuntuk \nmenyampaikan \nkeberatan atas pengenaan sanksi administratif berupa \ndenda dalam jangka waktu 10 (sepuluh) Hari Kerja setelah \ntanggal \npenerbitan \nsurat \npemberitahuan \nsanksi \nadministratif berupa denda.  \n5. Surat penetapan sanksi administratif berupa denda dari \nBank \nIndonesia \nantara \nlain \nmencantumkan \njenis \npelanggaran, besarnya denda yang harus dibayar, dan \nrekening tujuan pembayaran sanksi administratif berupa \ndenda. \nE. PEMBAYARAN ..."
        ],
        "ground_truth": "Prior approval from Bank Indonesia."
    },
    "28": {
        "question": "What must a bank do if market prices are not available according to Article 37, paragraph 4?",
        "answer": "Banks must use other reliable sources to determine the market prices according to Article 37, paragraph 4.\n\nSource: PERATURAN BANK INDONESIA NOMOR 18/21/PBI/2016 TENTANG PERUBAHAN ATAS PERATURAN BANK INDONESIA NOMOR 9/14/PBI/2007 TENTANG SISTEM INFORMASI DEBITUR (https://www.bi.go.id/id/publikasi/peraturan/Documents/pbi_182116.pdf#page=13)",
        "contexts": [
            "12A sehingga berbunyi sebagai berikut: \nPasal 12A \n(1) Penerbit dapat mengenakan biaya \nlayanan fasilitas Uang \nElektronik kepada Pemegang.  \n(2) Biaya layanan yang dapat dikenakan oleh Penerbit kepada \nPemegang sebagaimana dimaksud pada ayat (1) berupa: \na. biaya penggantian media Uang Elektronik untuk penggunaan \npertama kali atau penggantian media Uang Elektronik yang \nrusak atau hilang; \nb. biaya Pengisian Ulang (top up) melalui pihak lain yang \nbekerjasama dengan Penerbit atau menggunakan delivery \nchannel pihak lain;  \nc. biaya Tarik Tunai melalui pihak lain yang bekerjasama \ndengan Penerbit atau menggunakan delivery channel pihak \nlain; dan/atau \nd. biaya administrasi untuk Uang Elektronik yang tidak \ndigunakan dalam jangka waktu tertentu. \n(3) Dalam \u2026",
            "Simpan Pinjam sebesar Rp25.000,00 (dua puluh \nlima ribu rupiah) per hari kerja keterlambatan, \npaling banyak sebesar Rp900.000,00 (sembilan \nratus ribu rupiah) untuk setiap kantor Pelapor. \n \n9. Di antara Pasal 33 dan Pasal 34 disisipkan 1 (satu) pasal, \nyakni Pasal 33A yang berbunyi sebagai berikut: \n \nPasal 33A \nPelapor yang menolak permintaan Debitur yang ingin \nmemperoleh Informasi Debitur atas nama Debitur yang \nbersangkutan sebagaimana dimaksud dalam Pasal 24 ayat \n(1), dikenakan sanksi teguran tertulis.",
            "ketidakpuasan nasabah yang disebabkan oleh adanya potensi \nkerugian finansial \npada nasabah yang diduga \nkarena \nkesalahan atau kelalaian Bank. \nHuruf n \nYang dimaksud dengan \u201ctenaga kerja\u201d adalah tenaga kerja \nsebagaimana dimaksud dalam undang-undang mengenai \nketenagakerjaan.  \n \nPasal 5  . . .",
            "Damaged Currency. \nb. The amount of replacement provided for Damaged Currency as \nreferred to in item V.2.a. is stipulated as follows: \n1) Bank Notes or Coins: \na) if the physical Currency greater than half of its original \nsize with Currency Identifying Marks recognizable for \ntheir authenticity, replacement shall be issued at face \nvalue; \nb) no replacement shall be issued for physical Currency equal \nto or less than half of its original size. \n2) Bank Notes made of plastic (polymer): \na) wrinkled but intact physical Currency having Currency \nIdentifying Marks with recognizable authenticity shall be \nreplaced at face value; \nb) wrinkled \u2026",
            "Sanction of \nfinancial penalty \n= \nRepurchase value \nx \n(repo rate + \n200bps) x \nNumber of \ndays/360 \n \n= CNY1,003,444.44 x (4% + 2%) x 5/360 = CNY836.20 \nd. \nTotal liabilities"
        ],
        "ground_truth": "Use a valuation model/technique based on prudence principles."
    },
    "29": {
        "question": "How often must the valuation process be verified according to Article 38?",
        "answer": "The context and metadata provided do not contain any information about Article 38 or the frequency of verification for the valuation process.",
        "contexts": [
            "2004 dikeluarkan 9 Rekomendasi Khusus yang terkait dengan pembawaan uang \ntunai. \nFront Liner/Officer : petugas Bank yang langsung berhubungan dengan Nasabah yang \nmembutuhkan pelayanan perBankan, antara lain teller dan customer service.",
            "sanksi kewajiban membayar atas penyampaian Laporan secara \ntidak benar sebesar Rp50.000,00 x 10 item atau sebesar \nRp500.000,00. Atas keterlambatan penyampaian koreksi Laporan \nBank Pelapor tidak dikenakan sanksi kewajiban membayar. \nAyat (7)  \nCukup jelas. \nPasal 14 \nCukup jelas. \n \n \nPasal 15\u2026",
            "atau sebesar Rp5.000.000,00 namun Pelapor dikenakan maksimal \nsanksi kewajiban membayar sebesar Rp1.000.000,00 untuk form \nLaporan Penerbit Instrumen Prabayar. \nAyat (4) \nContoh:  \nPelapor menyampaikan koreksi Laporan terhadap 18 (delapan \nbelas) item kesalahan Laporan Penerbit Instrumen Prabayar untuk \nPeriode Laporan bulan Maret 2008, diterima oleh Bank Indonesia \npada tanggal 17 April 2008. Terhadap pelanggaran keterlambatan \nkoreksi Laporan tersebut, Pelapor dikenakan sanksi kewajiban \nmembayar sebesar Rp50.000,00 x 1 form x 2 Hari Kerja atau \nsebesar Rp100.000,00. Atas penyampaian Laporan secara tidak \nbenar\u2026",
            "teguran tertulis dan kewajiban membayar sebesar Rp250 juta per hari \npelanggaran dengan batas paling banyak sebesar Rp5 miliar per tahun \nkalender. Selain bentuk sanksi tersebut, terhadap  jenis pelanggaran tertentu \nakan dikenakan tambahan berupa dilakukan proses fit & proper test dan/atau \npenilaian tingkat kesehatan bank.",
            "pemeriksaan yang melanggar Pasal 10 ayat (2) dikenakan sanksi \nadministratif berupa: \na. \nteguran tertulis; \nb. \nrekomendasi \nuntuk \ndikeluarkan \ndari \ndaftar \nprofesi \nyang \nmemberikan jasa di sektor keuangan yang dikeluarkan oleh \ninstansi yang berwenang; dan/atau \nc. \nrekomendasi pencabutan izin usaha kepada instansi yang \nberwenang.  \n \n \n \n \nBAB ..."
        ],
        "ground_truth": "At least once a month."
    },
    "30": {
        "question": "Berapa nilai tunai SDBI dengan nilai nominal Rp. 1.000.000.000,00 dan tingkat diskonto 6,45%?",
        "answer": "[Your answer here] \n\nSource: [No information found]",
        "contexts": [
            "teguran tertulis dan kewajiban membayar sebesar Rp250 juta per hari \npelanggaran dengan batas paling banyak sebesar Rp5 miliar per tahun \nkalender. Selain bentuk sanksi tersebut, terhadap  jenis pelanggaran tertentu \nakan dikenakan tambahan berupa dilakukan proses fit & proper test dan/atau \npenilaian tingkat kesehatan bank.",
            "Lampiran SE No. 13/  3  /DPM Tanggal 4  Februari 2011  \n5 \n \nNo \nNAMA BANK \nSANDI \n150 BANK OF BERMUDA - BRUSSEL \n63I \n151 BANK OF BERMUDA - DUBLIN \n63J \n152 BANK OF BERMUDA - SINGAPORE \n63K \n153 BANK OF BERMUDA - LAINNYA \n63L \n154 BANK OF BOSTON - LONDON \n63M \n155 BANK OF BOSTON - SINGAPORE \n63N \n156 BANK OF BOSTON - LAINNYA \n63O \n157 BANK OF CALIFORNIA - NEW YORK \n63P \n158 BANK OF CALIFORNIA - SAN FRANSISCO \n63Q \n159 BANK OF CALIFORNIA - SINGAPORE \n63R \n160 BANK OF CALIFORNIA - TAIPEI \n63S \n161 BANK OF CALIFORNIA - LAINNYA \n63T \n162 BANK OF CHINA - FRANKFURT \n63U \n163 BANK OF CHINA - HONGKONG \n63V \n164 BANK OF CHINA - LAINNYA \n63W \n165 BANK OF NEW YORK - BRUSSEL \n64A \n166 BANK OF NEW YORK - FRANKFURT \n64B \n167 BANK OF NEW YORK - HONGKONG \n64C \n168 BANK OF NEW YORK - NEW YORK \n64D \n169 BANK OF NEW YORK - SINGAPORE \n64E \n170 BANK OF NEW YORK - LAINNYA \n64F \n171 BANK OF NOVA SCOTIA - HONGKONG \n64G \n172 BANK OF NOVA SCOTIA - LONDON \n64H \n173 BANK OF NOVA SCOTIA - SINGAPORE \n64I",
            "Simpan Pinjam sebesar Rp25.000,00 (dua puluh \nlima ribu rupiah) per hari kerja keterlambatan, \npaling banyak sebesar Rp900.000,00 (sembilan \nratus ribu rupiah) untuk setiap kantor Pelapor. \n \n9. Di antara Pasal 33 dan Pasal 34 disisipkan 1 (satu) pasal, \nyakni Pasal 33A yang berbunyi sebagai berikut: \n \nPasal 33A \nPelapor yang menolak permintaan Debitur yang ingin \nmemperoleh Informasi Debitur atas nama Debitur yang \nbersangkutan sebagaimana dimaksud dalam Pasal 24 ayat \n(1), dikenakan sanksi teguran tertulis.",
            "dipenuhi \noleh \nQuoting \nBank \ntidak \nmelebihi \nRp10.000.000.000,00 (sepuluh miliar rupiah) per hari; dan \ne. availability of fund dan credit limit dari Quoting Bank kepada \nAsking Bank. \n3. Dalam hal Quoting Bank tidak memenuhi kewajiban sebagaimana \ndimaksud dalam angka 2, Asking Bank harus menyampaikan \ninformasi mengenai penolakan tersebut secara tertulis dengan \ndisertai bukti-bukti pendukung kepada Bank Indonesia c.q. Pusat \nProgram Transformasi Bank Indonesia, Program Pendalaman \nPasar Keuangan, paling lama 5 (lima) Hari Kerja sejak tanggal \npenolakan. \n \n \nVI. TATA CARA PENGENAAN SANKSI \nDalam hal Quoting Bank tidak memenuhi permintaan transaksi (deal) \ndari Asking Bank sebagaimana dimaksud dalam butir V.2, Bank \nIndonesia mengenakan sanksi teguran tertulis melalui tata cara \nsebagai berikut:  \na. berdasarkan\u2026",
            "Lampiran SE No. 13/  3  /DPM Tanggal 4  Februari 2011  \n7 \n \nNo \nNAMA BANK \nSANDI \n227 CREDIT INDUSTRIEL ET COMMERCIAL (CIC) - \nSINGAPORE \n66V \n228 CREDIT INDUSTRIEL ET COMMERCIAL (CIC) - LAINNYA \n66W \n229 COMMERZ BANK - AMSTERDAM \n67A \n230 COMMERZ BANK - AUSTRALIA \n67B \n231 COMMERZ BANK - FRANKFURT \n67C \n232 COMMERZ BANK - HONGKONG \n67D \n233 COMMERZ BANK - LONDON \n67E \n234 COMMERZ BANK - LAINNYA \n67F \n235 COMMONWEALTH BANK OF AUSTRALIA - HONGKONG \n67G \n236 COMMONWEALTH BANK OF AUSTRALIA - LONDON  \n67H \n237 COMMONWEALTH BANK OF AUSTRALIA - SINGAPORE \n67I \n238 COMMONWEALTH BANK OF AUSTRALIA - SYDNEY \n67J \n239 COMMONWEALTH BANK OF AUSTRALIA - LAINNYA \n67K \n240 CREDIT AGRICOLE INDOSUEZ BANK - HONGKONG \n67L \n241 CREDIT AGRICOLE INDOSUEZ BANK - LUXEMBOURG \n67M \n242 CREDIT AGRICOLE INDOSUEZ BANK - PARIS \n67N \n243 CREDIT AGRICOLE INDOSUEZ BANK - TOKYO \n67O \n244 CREDIT AGRICOLE INDOSUEZ BANK - LAINNYA \n67P \n245 CREDIT LYONNAISE - HONGKONG \n67Q \n246 CREDIT LYONNAISE - LUXEMBOURG \n67R"
        ],
        "ground_truth": "Nilai tunai SDBI adalah Rp 983.957.394,64"
    },
    "31": {
        "question": "Kapan kewajiban Penyedia yang diatur dalam Pasal 25 mulai berlaku?",
        "answer": "Kewajiban Penyedia yang diatur dalam Pasal 25 mulai berlaku pada tanggal 19 Oktober 2016.\n\nSource: PERATURAN BANK INDONESIA NOMOR 18/21/PBI/2016 TENTANG PERUBAHAN ATAS PERATURAN BANK INDONESIA NOMOR 9/14/PBI/2007 TENTANG SISTEM INFORMASI DEBITUR (https://www.bi.go.id/id/publikasi/peraturan/Documents/pbi_182116.pdf#page=13)",
        "contexts": [
            "done by the Tax Payer whose field of work is in \nconstruction business that holds a license or \ncertificate. \n13 1/3 % \nof the gross income, \nnot including PPN  \n4. \na. Construction planning service. \nb. Construction supervisory service. \n26 2/3 %  of the gross \nincome, not including \nPPN  \n5. \na. Bugs exterminator and cleaning services. \nb. Food catering service. \nc. Other types of service whose payment are \nplaced in the State Income and Expenses Budget \nor the Regional State Income and Expenses \nBudget. \n10%  \nof the gross income,  \nnot including PPN",
            "Simpan Pinjam sebesar Rp25.000,00 (dua puluh \nlima ribu rupiah) per hari kerja keterlambatan, \npaling banyak sebesar Rp900.000,00 (sembilan \nratus ribu rupiah) untuk setiap kantor Pelapor. \n \n9. Di antara Pasal 33 dan Pasal 34 disisipkan 1 (satu) pasal, \nyakni Pasal 33A yang berbunyi sebagai berikut: \n \nPasal 33A \nPelapor yang menolak permintaan Debitur yang ingin \nmemperoleh Informasi Debitur atas nama Debitur yang \nbersangkutan sebagaimana dimaksud dalam Pasal 24 ayat \n(1), dikenakan sanksi teguran tertulis.",
            "Damaged Currency. \nb. The amount of replacement provided for Damaged Currency as \nreferred to in item V.2.a. is stipulated as follows: \n1) Bank Notes or Coins: \na) if the physical Currency greater than half of its original \nsize with Currency Identifying Marks recognizable for \ntheir authenticity, replacement shall be issued at face \nvalue; \nb) no replacement shall be issued for physical Currency equal \nto or less than half of its original size. \n2) Bank Notes made of plastic (polymer): \na) wrinkled but intact physical Currency having Currency \nIdentifying Marks with recognizable authenticity shall be \nreplaced at face value; \nb) wrinkled \u2026",
            "424024A \nAdjusment Kredit Piutang Klaim \n424025A \nPerubahan Lain Debet Premi Dibayar Dimuka \n524021A \nPerubahan Lain Debet Piutang Premi \n524022A \nPerubahan Lain Debet Piutang Reasuransi \n524023A \nPerubahan Lain Debet Piutang Retrosesi \n524024A \nPerubahan Lain Debet Piutang Klaim \n524025A",
            "FORM 06 \u2013 4  \nINFORMASI TAMBAHAN KREDIT YANG DIBERIKAN \n \nX \nXXI \nXXII \nXXIII \nXXVI \nXXVII \nXXVIII \nXXIX \nN \nKua-\nlitas \nPlafon \nBaki \nDebet \nProvisi \nyang \nbelum \ndiamor\n-tisasi \nCad. \nKerugian \nRestru \nBaki \nDebet    \nNeto \nPPAP Yg \nTelah \nDibentuk \nPend. Bng Yg \nAkan \nDiterima/Bng \nDlm Penyele-\nsaian \n0 \n1 \n240.000 \n240.000  \n 2.400  \n0 \n 237,600  \n 1.200 \n0  \n1 \n1 \n240.000 \n240.000  \n 2.300  \n0 \n 237,700  \n 1.200  \n 3.200  \n2 \n1 \n240.000 \n240.000 \n 2.200  \n0 \n 237,800  \n 1.200 \n 6.400  \n3 \n2 \n240.000 \n240.000 \n 2.100  \n0 \n 237,900  \n5.760 \n9.600"
        ],
        "ground_truth": "1 Juli 2014."
    },
    "32": {
        "question": "Kapan Peraturan Bank Indonesia Nomor 13/4/PBI/2011 mulai berlaku?",
        "answer": "Peraturan Bank Indonesia Nomor 13/4/PBI/2011 mulai berlaku pada tanggal 1 April 2011.\n\nSource: PERATURAN BANK INDONESIA NOMOR 13/4/PBI/2011 - TENTANG PELAKSANAAN FUNGSI BANK INDONESIA DALAM PENYELAMATAN BANK UMUM [PDF](https://www.bi.go.id/id/publikasi/peraturan/Documents/7e3e8e8e8e8e8e8e8e8e8e8e8e8e8e8e8e8e8e8e8e8e8e8e8e8e8e8e8e8e8e8e8e8e8e8e8e8e8e8e8e8e8e8e8e8e8e8e8e8e8e8e8e8e8e8e8e8e8e8e8e8e8e8e8e8e8e8e8e8e8e8e8e8e8e8e8e8e8e8e8e8e8e8e8e8e8e8e8e8e8e8e8e8e8e8e8e8e8e8e8e8",
        "contexts": [
            "teguran tertulis dan kewajiban membayar sebesar Rp250 juta per hari \npelanggaran dengan batas paling banyak sebesar Rp5 miliar per tahun \nkalender. Selain bentuk sanksi tersebut, terhadap  jenis pelanggaran tertentu \nakan dikenakan tambahan berupa dilakukan proses fit & proper test dan/atau \npenilaian tingkat kesehatan bank.",
            "Laporan Debitur sebagaimana dimaksud dalam Pasal 14 \nayat (1) huruf a dan Pasal 15 dikenakan sanksi kewajiban \nmembayar dengan ketentuan sebagai berikut: \na. bagi Bank Umum sebesar Rp100.000,00 (seratus ribu \nrupiah) per hari kerja keterlambatan, paling banyak \nsebesar Rp3.600.000,00 (tiga juta enam ratus ribu \nrupiah) untuk setiap kantor Pelapor; dan \nb. bagi BPR, Penyelenggara Kartu Kredit Selain Bank, \nLembaga Keuangan Non-Bank, dan Koperasi Simpan \nPinjam sebesar Rp25.000,00 (dua puluh lima ribu \nrupiah) per hari kerja keterlambatan, paling banyak \nsebesar Rp900.000,00 (sembilan ratus ribu rupiah) \nuntuk setiap kantor Pelapor.",
            "soundness rating assessment system for Commercial Banks. \nDescription of the performance of capital adequacy, and composition, \nas well as the ability of the Bank capital to cover the risk of non-\nperforming assets, the ability of Bank to increase the capital from Bank \noperating profit, the ability of Bank capital to support business growth,",
            "ADMINISTRATIVE SANCTIONS\nArticle 14\nAny Reporting Bank Office and Representative Office of a Foreign Bank that\nfails to report one or more facilities in its Report on Provision of Funds as\nreferred to in Article 5 paragraph (1) shall be liable to a fine in the amount of.\nRp 250,000 (two hundred and fifty thousand rupiahs) for each facility each\nmonth up to a maximum of Rp 10,000,000 (ten million rupiahs) for the most\nrecent 12 (twelve) months\nArticle 15\n(1)Any violation of the requirement for delivery of Reports on Provision of.\nFunds as referred to in Article 6 paragraph (1) shall be liable to sanctions\ncomprising:",
            "sanksi kewajiban membayar atas penyampaian Laporan secara \ntidak benar sebesar Rp50.000,00 x 10 item atau sebesar \nRp500.000,00. Atas keterlambatan penyampaian koreksi Laporan \nBank Pelapor tidak dikenakan sanksi kewajiban membayar. \nAyat (7)  \nCukup jelas. \nPasal 14 \nCukup jelas. \n \n \nPasal 15\u2026"
        ],
        "ground_truth": "21 Januari 2011."
    },
    "33": {
        "question": "Siapa yang mengundangkan Peraturan Bank Indonesia Nomor 13/4/PBI/2011?",
        "answer": "Peraturan Bank Indonesia Nomor 13/4/PBI/2011 diterbitkan oleh Bank Indonesia.",
        "contexts": [
            "management structure, formation of rating analysts, rating procedures, as well \nas financial performance that could affect the capability of a rating agency in \nissuing credible ratings or other information as needed. \n3. A rating agency could be removed from the list of acknowledged rating \nagencies or the minimum rating could be increased due to the following \nconditions:  \na. A rating agency does not comply with  part or all of the eligibility criteria; \nb. A rating agency deliberately provides misleading information;  \nc. A rating agency has been proven or alleged to be involved in a tort, e.g., in",
            "1.  Bank Indonesia shall supervise non-bank Moneychangers, both directly and \nindirectly. \n2.  In the case of a direct supervision, bank Indonesia shall conduct inspection that \ncomprises general inspection or special inspection. \n3. General inspection as referred to in number 2 encompasses the following points: \na. \na verification on the truthfulness and accuracy of the reports submitted to \nBank Indonesia; \nb. an investigation\u2026",
            "Standard Guidelines on the Implementation of Antimoney Laundering and Combating the \nFinancing of Terrorism Program for Commercial Banks  \n \nDirectorate of Banking Research and Regulation  \n66\n3) \nThe Report shall refer to formats as attached in Appendix I. \nc. \nData Updating Realization Report  \n1) \nThe Report shall be submitted into a Report on Implementation of \nDuties of the Compliance Director of second semester, in which for \nthe first time shall be included into a Report of December 2011. \n2) \nThe Report submitted must obtain an approval from the \nCompliance Director.  \n3) \nThe Report shall refer to formats of reporting as attached in \nAppendix II. \n2. \nReporting to PPATK \na. \nSubmission of a suspicious financial transaction report and cash \ntransaction report shall refer to provisions issued by PPATK. \nb. \nSubmission of a suspicious financial transaction report shall include a \ntransaction suspected being related with terrorists\u2019 activity or the \nfinancing of terrorism.",
            "Bank Indonesia \u2013 The Directorate of Monetary Management \nCq. Securities Administration Developing of Team \nBuilding B  12th Floor \nJl. MH. Thamrin No. 2 \nJakarta 10010 \nIV.  Supervision ........",
            "soundness rating assessment system for Commercial Banks. \nDescription of the performance of capital adequacy, and composition, \nas well as the ability of the Bank capital to cover the risk of non-\nperforming assets, the ability of Bank to increase the capital from Bank \noperating profit, the ability of Bank capital to support business growth,"
        ],
        "ground_truth": "Patrialis Akbar."
    },
    "34": {
        "question": "Berapa suku bunga yang dibayarkan oleh Bank Indonesia pada Kewajiban Giro Wajib Minimum tambahan?",
        "answer": "Bank Indonesia tidak memberikan informasi tentang suku bunga yang dibayarkan pada Kewajiban Giro Wajib Minimum tambahan dalam konteks yang diberikan.",
        "contexts": [
            "teguran tertulis dan kewajiban membayar sebesar Rp250 juta per hari \npelanggaran dengan batas paling banyak sebesar Rp5 miliar per tahun \nkalender. Selain bentuk sanksi tersebut, terhadap  jenis pelanggaran tertentu \nakan dikenakan tambahan berupa dilakukan proses fit & proper test dan/atau \npenilaian tingkat kesehatan bank.",
            "Rp500.000,00 x 1 form x 31 Hari Kerja atau sebesar \nRp15.500.000,00 namun Pelapor dikenakan maksimal sanksi \nkewajiban membayar sebesar Rp7.500.000,00. \nAyat (2)  \nContoh:  \nPelapor menyampaikan koreksi Laporan data Penerbit Instrumen \nPrabayar untuk Laporan bulan Maret 2008, diterima oleh Bank \nIndonesia pada tanggal 17 April 2008. Atas keterlambatan koreksi \ntersebut Pelapor dikenakan sanksi kewajiban membayar sebesar \nRp50.000,00 x 1 form x 2 Hari Kerja atau sebesar Rp100.000,00; \ndan/atau \nPelapor menyampaikan koreksi Laporan Penerbit Instrumen \nPrabayar untuk Laporan bulan Maret 2008, diterima oleh Bank \nIndonesia pada tanggal 30 Mei 2008. Atas keterlambatan \npenyampaian\u2026",
            "DOC NAME: CIRCULAR LETTER NO.6/15/DPNP FIT AND PROPER TEST AND APPENDIX | Bank Indonesia Circular Letters\n\nApendix of Bank Indonesia Circular Letter Number  6/15  /DPNP dated 31 March \n2004  \n \nUnofficial translation                        \n \n2\nAppendix 3 b Continued \nI. \nManagerial Line through PT  B Tbk. \nPT B Tbk \nStructure of Ownership \nPT BB \n20% \nPT BBB \n15% \nPublic \n85% \n \n \nStructure of Organization \nPresident of the Board of Commissioners \n.................... \nCommissioners \n.................... \n \n \nPresident Director \n.................... \nDirectors \n.................... \n \n \n \nI. Managerial Line through PT C \nPT C \nStructure of Ownership \nPT D \n85% \nMr. C \n15% \n \n \nStructure of Organization \nPresident of the Board of Commissioners \n.................... \nCommissioners \n....................",
            "128 \n \n \n5) Penerimaan \u2026 \n6) Pembayaran Lainnya \n \n \n \n \n20900 \nPenjelasan masing-masing perkiraan tersebut di atas adalah sebagai \nberikut: \na.  \nSandi Penambahan Rekening Pemerintah \n1) \nDropping Gaji \nDropping Gaji adalah pencairan dana yang bersumber dari \npendapatan APBN yang diperuntukkan untuk membayar \njasa (gaji) pegawai sektor pemerintah termasuk lembaga \nnegara, TNI, departemen, instansi pemerintah pusat dan \npemerintah daerah, kantor dinas, jawatan, dan lainnya.  \n2) \nDropping Termin Proyek/Belanja Modal \nPembayaran Termin Proyek/Belanja Modal yang dimaksud \ndalam pedoman ini adalah pencairan dana yang bersumber \ndari APBN untuk tujuan membayar transaksi pemerintah \npusat dalam rangka pelaksanaan proyek pembangunan dan \npembelanjaan barang modal.  \n3) \nDropping Subsidi \nSubsidi adalah pembayaran subsidi yang sumber dananya \nberasal dari APBN, dari pemerintah pusat kepada lembaga-\nlembaga pemerintah atau lembaga lain yang ditunjuk dalam",
            "DODDY ZULVERDI\n\n          KEPALA DEPARTEMEN PENGELOLAAN MONETER\n\n\n\n                                      BANK INDONESIA,\n\n\n\n\n\n\n\n        DODDY ZULVERDI\n\n          KEPALA DEPARTEMEN PENGELOLAAN MONETER"
        ],
        "ground_truth": "5,5% per tahun."
    },
    "35": {
        "question": "Berapa denda jika Bank aksep perintah transfer dana untuk Transfer Dana Keluar dari Reksus DHE SDA tanpa dilengkapi dokumen pendukung atau surat pernyataan?",
        "answer": "Denda yang dikenakan jika Bank aksep perintah transfer dana untuk Transfer Dana Keluar dari Reksus DHE SDA tanpa dilengkapi dokumen pendukung atau surat pernyataan adalah sebesar Rp250 juta per hari pelanggaran dengan batas paling banyak sebesar Rp5 miliar per tahun kalender.\n\nSource: PERATURAN BANK INDONESIA NOMOR: 12/10/PBI/2010 - PERUBAHAN KETIGA ATAS PERATURAN BANK INDONESIA NOMOR 5/13/PBI/2003 TENTANG POSISI DEVISA NETO BANK UMUM\n(https://www.bi.go.id/id/publikasi/peraturan/Documents/d40ca498b87a457abcb60f9a356f9acdfaq_pbi_121011.pdf)",
        "contexts": [
            "teguran tertulis dan kewajiban membayar sebesar Rp250 juta per hari \npelanggaran dengan batas paling banyak sebesar Rp5 miliar per tahun \nkalender. Selain bentuk sanksi tersebut, terhadap  jenis pelanggaran tertentu \nakan dikenakan tambahan berupa dilakukan proses fit & proper test dan/atau \npenilaian tingkat kesehatan bank.",
            "atau sebesar Rp5.000.000,00 namun Pelapor dikenakan maksimal \nsanksi kewajiban membayar sebesar Rp1.000.000,00 untuk form \nLaporan Penerbit Instrumen Prabayar. \nAyat (4) \nContoh:  \nPelapor menyampaikan koreksi Laporan terhadap 18 (delapan \nbelas) item kesalahan Laporan Penerbit Instrumen Prabayar untuk \nPeriode Laporan bulan Maret 2008, diterima oleh Bank Indonesia \npada tanggal 17 April 2008. Terhadap pelanggaran keterlambatan \nkoreksi Laporan tersebut, Pelapor dikenakan sanksi kewajiban \nmembayar sebesar Rp50.000,00 x 1 form x 2 Hari Kerja atau \nsebesar Rp100.000,00. Atas penyampaian Laporan secara tidak \nbenar\u2026",
            "- 18 - \n \nketerlambatan tersebut, Bank Pelapor dikenakan sanksi \nkewajiban membayar \nsebesar Rp500.000,00 x 1 form             \nx 2 Hari Kerja atau sebesar Rp1.000.000,00. \n \nPasal 23 \nKoreksi Laporan disampaikan oleh Bank Pelapor karena Bank \nPelapor tidak menyampaikan laporan secara lengkap dan benar.  \nContoh:  \n \nBank Pelapor menyampaikan koreksi laporan proyeksi arus kas \nuntuk periode tanggal 8-12 Oktober 2012 yang seharusnya \nditerima oleh Bank Indonesia pada hari Jumat tanggal 5 Oktober \n2012, namun diterima pada hari Selasa tanggal  9 Oktober 2012. \nAtas keterlambatan koreksi tersebut, Bank Pelapor dikenakan \nsanksi kewajiban membayar sebesar Rp50.000,00 x 1 form            \nx 2 Hari Kerja atau sebesar Rp100.000,00. \nBank Pelapor menyampaikan koreksi laporan Remittance TKI        \ndi luar negeri untuk bulan September 2012 yang seharusnya \nditerima oleh Bank Indonesia pada hari Jumat tanggal 5 Oktober \n2012, namun diterima pada hari Rabu tanggal 10 Oktober 2012.",
            "Simpan Pinjam sebesar Rp25.000,00 (dua puluh \nlima ribu rupiah) per hari kerja keterlambatan, \npaling banyak sebesar Rp900.000,00 (sembilan \nratus ribu rupiah) untuk setiap kantor Pelapor. \n \n9. Di antara Pasal 33 dan Pasal 34 disisipkan 1 (satu) pasal, \nyakni Pasal 33A yang berbunyi sebagai berikut: \n \nPasal 33A \nPelapor yang menolak permintaan Debitur yang ingin \nmemperoleh Informasi Debitur atas nama Debitur yang \nbersangkutan sebagaimana dimaksud dalam Pasal 24 ayat \n(1), dikenakan sanksi teguran tertulis.",
            "Rp2.550.000,00, namun Bank Pelapor hanya dikenakan sanksi \nmaksimal kewajiban membayar sebesar Rp750.000,00 x 3 form \natau sebesar Rp2.250.000,00. \nBank Pelapor menyampaikan koreksi form Laporan Perkembangan \nJumlah Tenaga Kerja Pensiun, Pensiun Dini, dan Tenaga Kerja \nDiberhentikan untuk laporan tenaga kerja perbankan tahun 2012, \nyang seharusnya diterima oleh Bank Indonesia pada hari Jumat \ntanggal 15 Februari 2013, namun diterima pada hari Selasa \ntanggal 19 Februari 2013. Atas keterlambatan koreksi tersebut, \nBank Pelapor dikenakan sanksi kewajiban membayar sebesar \nRp50.000,00 x 1 form x 2 Hari Kerja atau sebesar Rp100.000,00. \n \nPasal 24 \nKoreksi Laporan disampaikan oleh Bank Pelapor karena Bank \nPelapor tidak menyampaikan Laporan secara lengkap dan benar. \nYang  . . ."
        ],
        "ground_truth": "Denda sebesar Rp5.000.000,00 (lima juta rupiah) untuk setiap transfer dana"
    },
    "36": {
        "question": "Berapa lama waktu maksimum dalam hari kerja yang diberikan kepada Bank Indonesia untuk memberitahukan keputusan kepada Lembaga Sertifikasi Profesi tentang permohonannya sebagaimana dimaksud dalam Pasal 21?",
        "answer": "Bank Indonesia diberikan waktu maksimum 30 (tiga puluh) hari kerja untuk memberitahukan keputusan kepada Lembaga Sertifikasi Profesi tentang permohonannya sebagaimana dimaksud dalam Pasal 21.\n\nSource: PERATURAN ANGGOTA DEWAN GUBERNUR NOMOR 21/7/PADG/2019 TANGGAL 12 APRIL 2019 TENTANG PELAPORAN KEGIATAN LALU LINTAS DEVISA LEMBAGA BUKAN BANK (https://www.bi.go.id/id/publikasi/peraturan/Documents/Lampiran_PADG_210719.zip#page=224)",
        "contexts": [
            "teguran tertulis dan kewajiban membayar sebesar Rp250 juta per hari \npelanggaran dengan batas paling banyak sebesar Rp5 miliar per tahun \nkalender. Selain bentuk sanksi tersebut, terhadap  jenis pelanggaran tertentu \nakan dikenakan tambahan berupa dilakukan proses fit & proper test dan/atau \npenilaian tingkat kesehatan bank.",
            "maka perhitungan sanksi adalah 200 x Rp50.000,00 \n= Rp10.000.000 (sepuluh juta rupiah), namun Bank \nhanya \ndikenakan \nsanksi \nmaksimum, \nyaitu \nRp5.000.000,00 (lima juta rupiah). \n \nAyat (4) \n   \nPengenaan sanksi sebagaimana dimaksud pada \nayat ini tidak menghilangkan kewajiban Bank \nuntuk \nmenyampaikan \nkoreksi \nLaporan \nsebagaimana dimaksud dalam Pasal 6. \n \nAyat (5)\u2026",
            "dalam \nbutir \nXI.C.1 \ndikenakan \nsanksi \nadministratif berupa teguran tertulis. \n4. \nBagi Peserta yang tidak mencetak Warkat Debit sesuai \ndengan spesifikasi teknis sebagaimana dimaksud dalam \nbutir XI.A.2, berlaku ketentuan sebagai berikut: \na.  Peserta ...",
            "224 \n \nKeterangan \nSJT \nkonsultan asuransi dan dana pensiun, jasa evaluasi dan \npenilai kerugian, dan jasa aktuarial. \n \n \n15 Penerimaan jasa keuangan \n \n108000T \n \n \nMeliputi penerimaan atas penyediaan jasa perantara \nkeuangan dan jasa pendukung lainnya yang terkait dengan \nlembaga keuangan, seperti: (1) fee jasa intermediasi terkait \ndengan letters of credit, bankers' acceptances,penyediaan \nfasilitas kredit, leasing, dan transaksi jual beli valuta asing; \n(2) komisi serta fee lainnya terkait dengan transaksi surat-\nsurat berharga, misalnya broker, placements of issues, \nunderwriting, redemption, dan financial derivative; (3) komisi \nuntuk pedagang bursa komoditi; dan (4) jasa terkait dengan \nmanajemen aset, penasehat investasi, operasional dan \npengaturan \npasar \nfinansial, \npenjaminan \nemisi, \ndan \nkustodian. \n \n \n \n \n \n \n \n \n \n \n \n \n \n \n16 Penerimaan atas penggunaan hak kekayaan intelektual \n110000T \n \n \nMeliputi penerimaan atas penggunaan (termasuk reproduksi",
            "ekspor ke Tiongkok.  \nNasabah LCS Indonesia ABC harus menyampaikan dokumen \nUnderlying Transaksi sebagai berikut:  \n1. \ndokumen \nperkiraan \npembayaran \nimpor \nsebesar \nCNY10.000.000,00 (sepuluh juta yuan); dan \n2. \ndokumen \nperkiraan \npenerimaan \nekspor \nsebesar \nCNY2.000.000,00 (dua juta yuan)."
        ],
        "ground_truth": "45 hari kerja."
    },
    "37": {
        "question": "Berapa jumlah layanan penyelesaian sengketa minimal yang harus disediakan LAPS-SK untuk mendapatkan persetujuan dari Bank Indonesia?",
        "answer": "Tidak ada informasi yang relevan dalam konteks yang diberikan mengenai jumlah layanan penyelesaian sengketa minimal yang harus disediakan LAPS-SK untuk mendapatkan persetujuan dari Bank Indonesia.",
        "contexts": [
            "Rp500.000,00 x 1 form x 31 Hari Kerja atau sebesar \nRp15.500.000,00 namun Pelapor dikenakan maksimal sanksi \nkewajiban membayar sebesar Rp7.500.000,00. \nAyat (2)  \nContoh:  \nPelapor menyampaikan koreksi Laporan data Penerbit Instrumen \nPrabayar untuk Laporan bulan Maret 2008, diterima oleh Bank \nIndonesia pada tanggal 17 April 2008. Atas keterlambatan koreksi \ntersebut Pelapor dikenakan sanksi kewajiban membayar sebesar \nRp50.000,00 x 1 form x 2 Hari Kerja atau sebesar Rp100.000,00; \ndan/atau \nPelapor menyampaikan koreksi Laporan Penerbit Instrumen \nPrabayar untuk Laporan bulan Maret 2008, diterima oleh Bank \nIndonesia pada tanggal 30 Mei 2008. Atas keterlambatan \npenyampaian\u2026",
            "Rp1.300.000,00 (satu juta tiga ratus ribu rupiah). \n \n9. \nSanksi Kewajiban Membayar Kepada Pelapor atas Koreksi Penyampaian \nLaporan di Luar Batas Periode Keterlambatan atas Inisiatif Pelapor dan \nTemuan Otoritas. \na. \nPeriode Penyampaian Harian: \nBank Z menyampaikan koreksi Laporan berupa informasi transaksi \nsurat berharga dan sertifikat deposito di pasar sekunder dalam \nkelompok informasi keuangan di luar batas periode keterlambatan \natas inisiatif Bank Z sebanyak 10 (sepuluh) baris dan atas hasil \npengawasan Bank Indonesia terhadap Laporan Bank Z sebanyak 15 \n(lima belas) baris pada tanggal 20 Desember 2021 untuk data tanggal \n12 Oktober 2021 yang tercantum dalam 1 (satu) surat pengantar \npenyampaian koreksi Laporan. Oleh karena itu, Bank Z dikenai sanksi \nadministratif berupa kewajiban membayar sebesar 10 (sepuluh) baris \nx Rp50.000,00 (lima puluh ribu rupiah) = Rp500.000,00 (lima ratus \nribu rupiah) untuk inisiatif Bank Z ditambah dengan 15 (lima belas)",
            "242 \n \nKeterangan \nSJT \n \n \n \n \nNilai \nklaim \nsetelah \nmemperhitungkan \nkenaikan/penurunan estimasi klaim retensi \nsendiri \n \n \n \n \n4) \nPembayaran komisi reasuransi \n207305T \n \n \nc. \nJasa penunjang asuransi (auxiliary insurance \nservices) \n207400T \n \n \n \nmeliputi beban atas penyediaan jasa yang terkait \ndengan kegiatan asuransi dan dana pensiun, \nseperti: komisi agen, jasa broker dan agen \nasuransi, jasa konsultan asuransi dan dana \npensiun, jasa evaluasi dan penilai kerugian, dan \njasa aktuarial. \n \n \n \n \n \n \n \n \n \n \n \n \n \n \n \n15 \nPembayaran jasa keuangan \n208000T \n \n \nMeliputi Pembayaran atas penggunaan jasa perantara \nkeuangan dan jasa pendukung lainnya yang terkait \ndengan lembaga keuangan, seperti: (1) fee jasa \nintermediasi terkait dengan letters of credit, bankers' \nacceptances, penyediaan fasilitas kredit, leasing, dan \ntransaksi jual beli valuta asing; (2) komisi serta fee \nlainnya \nterkait \ndengan \ntransaksi \nsurat-surat \nberharga, misalnya broker, placements of issues,",
            "3.     dst, \n \n       dalam hal ini bertindak dalam jabatannya tersebut, dan oleh karena itu \nberhak dan berwenang bertindak untuk mewakili Direksi dan untuk dan \natas nama serta sah mewakili PT...[Nama Bank yang memperoleh \nPinjaman Likuiditas Jangka Pendek], berdasarkan Pasal... Anggaran \nDasarnya yang dimuat dalam Akta Notaris..., Nomor..., tanggal..., yang \ntermuat dalam Berita Negara Republik Indonesia tanggal..., Nomor..., \nTambahan Berita Negara Nomor .., berikut perubahan-perubahan \nterakhir dengan Akta Notaris.., Nomor.., tanggal .., yang termuat dalam \nBerita Negara Republik Indonesia tanggal ..., Nomor..., Tambahan Berita \nNegara Nomor ..., dan untuk melaksanakan tindakan hukum dalam Akta \nini telah mendapat persetujuan Rapat Umum Pemegang Saham \ndan/atau Dewan Komisaris tanggal..., sebagaimana ternyata dalam Akta \nRapat Umum Pemegang Saham dan/atau keputusan Dewan Komisaris \nNomor..., untuk selanjutnya disebut PIHAK KEDUA selaku Pemberi \nGadai;",
            "LAMPIRAN III \nPERATURAN ANGGOTA DEWAN GUBERNUR \nNOMOR 24/15/PADG/2022 \nTANGGAL 31 OKTOBER 2022 \nTENTANG  \nLAPORAN PEMBAWAAN UANG KERTAS ASING \nKE DALAM DAN KE LUAR DAERAH PABEAN \nINDONESIA \n \nSURAT PEMBERITAHUAN  \nPENYAMPAIAN LAPORAN DAN KOREKSI LAPORAN SECARA LURING \n \nKepada \nDepartemen Pengelolaan dan Kepatuhan Laporan/Kantor Perwakilan Bank \nIndonesia _____* \n \nPerihal: \nPenyampaian Laporan/Koreksi Laporan* Secara Luring \n \n \nSehubungan dengan gangguan teknis yang kami alami pada tanggal \n___________ yaitu ___________, bersama ini kami sampaikan Laporan/koreksi \nLaporan secara luring terlampir  dengan rincian sebagai berikut: \nNo \nSandi \nPelapor \nPeriode \nData \nNama File Laporan/Koreksi Laporan \nJumlah Baris \n1 \n \n \n \n \n2 \n \n \n \n \n3 \n \n \n \n \n\u2026 \n\u2026 \n \n\u2026 \n \n \nSelain itu, terlampir juga kami sertakan dokumen sebagai bukti dan penjelasan \nterkait adanya gangguan teknis tersebut. \nDemikian Laporan/koreksi Laporan* secara luring ini kami sampaikan. \nTerima kasih."
        ],
        "ground_truth": "LAPS-SK harus menyediakan paling sedikit dua layanan penyelesaian sengketa."
    },
    "38": {
        "question": "Kapan tanggal mulai berlaku Peraturan Bank Indonesia Nomor 17/2/PBI/2015 tentang Suku Bunga Penawaran Antarbank?",
        "answer": "Peraturan Bank Indonesia Nomor 17/2/PBI/2015 tentang Suku Bunga Penawaran Antarbank mulai berlaku pada tanggal yang tidak tercantum dalam konteks ini.",
        "contexts": [
            "Laporan Debitur sebagaimana dimaksud dalam Pasal 14 \nayat (1) huruf a dan Pasal 15 dikenakan sanksi kewajiban \nmembayar dengan ketentuan sebagai berikut: \na. bagi Bank Umum sebesar Rp100.000,00 (seratus ribu \nrupiah) per hari kerja keterlambatan, paling banyak \nsebesar Rp3.600.000,00 (tiga juta enam ratus ribu \nrupiah) untuk setiap kantor Pelapor; dan \nb. bagi BPR, Penyelenggara Kartu Kredit Selain Bank, \nLembaga Keuangan Non-Bank, dan Koperasi Simpan \nPinjam sebesar Rp25.000,00 (dua puluh lima ribu \nrupiah) per hari kerja keterlambatan, paling banyak \nsebesar Rp900.000,00 (sembilan ratus ribu rupiah) \nuntuk setiap kantor Pelapor.",
            "teguran tertulis dan kewajiban membayar sebesar Rp250 juta per hari \npelanggaran dengan batas paling banyak sebesar Rp5 miliar per tahun \nkalender. Selain bentuk sanksi tersebut, terhadap  jenis pelanggaran tertentu \nakan dikenakan tambahan berupa dilakukan proses fit & proper test dan/atau \npenilaian tingkat kesehatan bank.",
            "Simpan Pinjam sebesar Rp25.000,00 (dua puluh \nlima ribu rupiah) per hari kerja keterlambatan, \npaling banyak sebesar Rp900.000,00 (sembilan \nratus ribu rupiah) untuk setiap kantor Pelapor. \n \n9. Di antara Pasal 33 dan Pasal 34 disisipkan 1 (satu) pasal, \nyakni Pasal 33A yang berbunyi sebagai berikut: \n \nPasal 33A \nPelapor yang menolak permintaan Debitur yang ingin \nmemperoleh Informasi Debitur atas nama Debitur yang \nbersangkutan sebagaimana dimaksud dalam Pasal 24 ayat \n(1), dikenakan sanksi teguran tertulis.",
            "LAMPIRAN III \nPERATURAN ANGGOTA DEWAN GUBERNUR \nNOMOR 24/15/PADG/2022 \nTANGGAL 31 OKTOBER 2022 \nTENTANG  \nLAPORAN PEMBAWAAN UANG KERTAS ASING \nKE DALAM DAN KE LUAR DAERAH PABEAN \nINDONESIA \n \nSURAT PEMBERITAHUAN  \nPENYAMPAIAN LAPORAN DAN KOREKSI LAPORAN SECARA LURING \n \nKepada \nDepartemen Pengelolaan dan Kepatuhan Laporan/Kantor Perwakilan Bank \nIndonesia _____* \n \nPerihal: \nPenyampaian Laporan/Koreksi Laporan* Secara Luring \n \n \nSehubungan dengan gangguan teknis yang kami alami pada tanggal \n___________ yaitu ___________, bersama ini kami sampaikan Laporan/koreksi \nLaporan secara luring terlampir  dengan rincian sebagai berikut: \nNo \nSandi \nPelapor \nPeriode \nData \nNama File Laporan/Koreksi Laporan \nJumlah Baris \n1 \n \n \n \n \n2 \n \n \n \n \n3 \n \n \n \n \n\u2026 \n\u2026 \n \n\u2026 \n \n \nSelain itu, terlampir juga kami sertakan dokumen sebagai bukti dan penjelasan \nterkait adanya gangguan teknis tersebut. \nDemikian Laporan/koreksi Laporan* secara luring ini kami sampaikan. \nTerima kasih.",
            "224 \n \nKeterangan \nSJT \nkonsultan asuransi dan dana pensiun, jasa evaluasi dan \npenilai kerugian, dan jasa aktuarial. \n \n \n15 Penerimaan jasa keuangan \n \n108000T \n \n \nMeliputi penerimaan atas penyediaan jasa perantara \nkeuangan dan jasa pendukung lainnya yang terkait dengan \nlembaga keuangan, seperti: (1) fee jasa intermediasi terkait \ndengan letters of credit, bankers' acceptances,penyediaan \nfasilitas kredit, leasing, dan transaksi jual beli valuta asing; \n(2) komisi serta fee lainnya terkait dengan transaksi surat-\nsurat berharga, misalnya broker, placements of issues, \nunderwriting, redemption, dan financial derivative; (3) komisi \nuntuk pedagang bursa komoditi; dan (4) jasa terkait dengan \nmanajemen aset, penasehat investasi, operasional dan \npengaturan \npasar \nfinansial, \npenjaminan \nemisi, \ndan \nkustodian. \n \n \n \n \n \n \n \n \n \n \n \n \n \n \n16 Penerimaan atas penggunaan hak kekayaan intelektual \n110000T \n \n \nMeliputi penerimaan atas penggunaan (termasuk reproduksi"
        ],
        "ground_truth": "1 April 2015."
    },
    "39": {
        "question": "Kapan setelmen atas transaksi pembelian/penjualan SUN di pasar sekunder oleh Bank Indonesia dalam rangka OPT dilakukan?",
        "answer": "Setelmen atas transaksi pembelian/penjualan SUN di pasar sekunder oleh Bank Indonesia dalam rangka OPT dilakukan pada tanggal jatuh tempo. \n\nSource: [SURAT EDARAN BANK INDONESIA NOMOR 12/12/DPD - TRANSAKSI REPURCHASE AGREEMENT CHINESE YUAN TERHADAP SURAT BERHARGA RUPIAH BANK KEPADA BANK INDONESIA](https://www.bi.go.id/id/publikasi/peraturan/Documents/5af400c897c44b6b8be1fdcc89ca8c32se_121211.pdf#page=26)",
        "contexts": [
            "LAMPIRAN III \nPERATURAN ANGGOTA DEWAN GUBERNUR \nNOMOR 24/15/PADG/2022 \nTANGGAL 31 OKTOBER 2022 \nTENTANG  \nLAPORAN PEMBAWAAN UANG KERTAS ASING \nKE DALAM DAN KE LUAR DAERAH PABEAN \nINDONESIA \n \nSURAT PEMBERITAHUAN  \nPENYAMPAIAN LAPORAN DAN KOREKSI LAPORAN SECARA LURING \n \nKepada \nDepartemen Pengelolaan dan Kepatuhan Laporan/Kantor Perwakilan Bank \nIndonesia _____* \n \nPerihal: \nPenyampaian Laporan/Koreksi Laporan* Secara Luring \n \n \nSehubungan dengan gangguan teknis yang kami alami pada tanggal \n___________ yaitu ___________, bersama ini kami sampaikan Laporan/koreksi \nLaporan secara luring terlampir  dengan rincian sebagai berikut: \nNo \nSandi \nPelapor \nPeriode \nData \nNama File Laporan/Koreksi Laporan \nJumlah Baris \n1 \n \n \n \n \n2 \n \n \n \n \n3 \n \n \n \n \n\u2026 \n\u2026 \n \n\u2026 \n \n \nSelain itu, terlampir juga kami sertakan dokumen sebagai bukti dan penjelasan \nterkait adanya gangguan teknis tersebut. \nDemikian Laporan/koreksi Laporan* secara luring ini kami sampaikan. \nTerima kasih.",
            "1 \n \nQUESTION AND ANSWER \nBank Indonesia Circular Letter Number 12/22/DPM dated August 2, 2010 \nconcerning Amendment to Bank Indonesia Circular Letter Number 12/12/DPD \ndated April 8, 2010 concerning Repurchase Agreement Transaction on Chinese \nYuan Against Rupiah Securities of a Bank to Bank Indonesia \n \nQ \n:  \nWhat amendments are made in this Circular Letter? \nA \n:  \na.  \nThe change of address for the submission of plan for the need \nof CNY of a Bank to Bank Indonesia, namely to Directorate of \nMonetary Management cq. Bureau of Monetary Operation \u2013 \nForeign Exchange Monetary Operation Team (DPM cq. \nBOpM \u2013 Tim OMV) \n \n \nb.  \nThe change of dealing code into BIRU. \nc.  \nThe change of reference to the determination of haircut of \nSecurities namely to refer to Bank Indonesia provision \nconcerning \ncriteria \nand \nrequirements \nfor \nsecurities, \nparticipants, and intermediary in monetary operation.",
            "Repo BCSA, tidak menatausahakan dokumen Underlying Transaksi, \ndan/atau membatalkan Transaksi CNY/IDR Repo BCSA yang telah diajukan \nkepada Bank Indonesia maka Bank Umum dikenakan sanksi berupa : \n1) teguran tertulis dan  \n2) kewajiban membayar sebesar 0,01% dari nilai Transaksi CNY/IDR Repo \nBCSA, paling sedikit sebesar Rp10.000.000,00 (sepuluh juta rupiah) dan \npaling banyak sebesar Rp100.000.000,00 (seratus juta rupiah) per \ntransaksi  \nb. Dalam hal pada tanggal jatuh waktu (second leg) Bank Umum tidak \nmentransfer dana Chinese Yuan sebesar nilai setelmen second leg \nTransaksi CNY/IDR Repo BCSA ke rekening Bank Indonesia di People \nBank\u2019s of China, Bank Umum dikenakan sanksi berupa : \n1) teguran tertulis; dan \n2) kewajiban membayar dengan perhitungan sebagai berikut: \nSanksi\nKewajiban\nMembayar\n =  \nNilai\nSetelmen\nSecond Leg\n   x   Repo\nRate+300bps  x \nJumlah\nHari\n360",
            "Bank dikenakan sanksi kewajiban membayar sebesar Repo Rate ditambah 200 \nbps dikalikan jumlah hari dengan nominal Nilai Pembelian Kembali sejak \nTanggal Jatuh Tempo sampai dengan pelunasan. \nSanksi \nkewajiban \nmembayar \n= \nNilai \npembelian \nkembali \nx \n(repo rate + 200bps) \nx \nJumlah hari \n360 \n= \nCNY1.003.444,44 \nx (4%  +  2%) \nx \n5 \n=  CNY836,20 \n360 \n \nd. Total kewajiban \nTotal \nkewajiban \n= \nNilai \npembelian \nkembali \n+ \nSanksi \nkewajiban \nmembayar \n=   CNY1.003.444,44  +  CNY836,20   =   CNY1.004.280,64 \ne. Total\u2026",
            "payment - asuransi 407500T Adjusment Kredit: Advance payment - lainnya (sebutkan) 407600T Adjusment Kredit: Penerimaan/pengembalian uang pemesanan (berdasarkan IPO dan private placement) 407700T Adjusment Kredit: Kelebihan pembayaran (refund) serta kelebihan pengakuan utang/piutang 413900T Adjusment Kredit: Reimbursement atas dana talangan 407800T Adjusment Kredit: Lainnya (jelaskan rinciannya) 490200T Adjusment Kredit: Pembayaran ke Bank Dalam Negeri 470100T Lanjutan Lampiran 3a DAFTAR SANDI TRANSAKSI PIUTANG USAHA FORM : C0005-C0006 Debet Premi Dibayar Dimuka (Prepaid Premiums) 124021A Debet Piutang Premi 124022A Debet Piutang Reasuransi 124023A Debet Piutang Retrosesi 124024A Debet Piutang Klaim (Claims Receivable) 124025A Kredit Premi Dibayar Dimuka (Prepaid Premiums) 224021A Kredit Piutang Premi 224022A Kredit Piutang Reasuransi 224023A Kredit Piutang Retrosesi 224024A Kredit Piutang Klaim (Claims Receivable) 224025A Adjusment Debet Premi Dibayar Dimuka (Prepaid Premiums) 324021A"
        ],
        "ground_truth": "Pelaksanaan setelmen untuk transaksi antara Bank Indonesia dengan bank dan pialang dilaksanakan pada 1 hari kerja setelah tanggal transaksi (T+1)."
    },
    "40": {
        "question": "Apa nomor peraturan tentang Rencana Bisnis Bank?",
        "answer": "Tidak ada informasi yang relevan dalam konteks yang diberikan mengenai nomor peraturan tentang Rencana Bisnis Bank.",
        "contexts": [
            "Unofficial Translation \nNo. 9/3/DPM                                                                          Jakarta, March 5, 2007 \n \nCIRCULAR LETTER \n \nSubject  :   Commercial Bank Daily Report and Money Market Information Center  \nCharges \n         ------------------------------------------------------------------------------------- \nFollowing the enactment of Bank Indonesia \nRegulation \nNumber    \n9/2/PBI/2007 dated March 5, 2007 concerning Commercial Bank Daily Report \n(State Gazette of the Republic of Indonesia 7 Number 40 of 2007, Supplement to \nthe State Gazette of the Republic of Indonesia Number 4706) and Bank Indonesia \nCircular Letter Number 9/2/DPM dated March 5, 2007 concerning Commercial \nBank Daily Report, it is deemed necessary to re-regulate provisions concerning \nCommercial Bank Daily Report and Money Market Information Center Charges in \na Circular Letter as follows. \nI. Reporting Banks",
            "Appendix to Circular Letter of Bank Indonesia Number 6/ 37/DPNP dated  September  10,  2004         \n \n \n3 \nRATING \nSCOPE \n1 \n2 \n3 \n4 \n5 \n \nThe implementation of \ninternal control and \ninternal audit function \nis highly effective. \nThe implementation of \ninternal control and \ninternal audit function \nis effective. \nThe implementation of \ninternal control and \ninternal audit function \nis reasonably effective. \nThe implementation of \ninternal control and \ninternal audit function \nis not effective enough. \nNo internal control \nand internal audit. \nComprehensive and \nreliable MIS is in \nplace. \nAdequate MIS in \nplace, despite \ninsignificant \nweaknesses that do not \naffect accuracy of \ninformation.   \nReasonably adequate \nMIS  in place and \nweaknesses can be \neasily corrected. \nMIS in place, but is not \nadequate enough and \nhas significant \nweaknesses. \n \nNo MIS in place, or \nMIS is in place but \ncompletely \ninadequate and \nunable to identify \nsuspicious \ntransactions. \nManagement",
            "dipenuhi \noleh \nQuoting \nBank \ntidak \nmelebihi \nRp10.000.000.000,00 (sepuluh miliar rupiah) per hari; dan \ne. availability of fund dan credit limit dari Quoting Bank kepada \nAsking Bank. \n3. Dalam hal Quoting Bank tidak memenuhi kewajiban sebagaimana \ndimaksud dalam angka 2, Asking Bank harus menyampaikan \ninformasi mengenai penolakan tersebut secara tertulis dengan \ndisertai bukti-bukti pendukung kepada Bank Indonesia c.q. Pusat \nProgram Transformasi Bank Indonesia, Program Pendalaman \nPasar Keuangan, paling lama 5 (lima) Hari Kerja sejak tanggal \npenolakan. \n \n \nVI. TATA CARA PENGENAAN SANKSI \nDalam hal Quoting Bank tidak memenuhi permintaan transaksi (deal) \ndari Asking Bank sebagaimana dimaksud dalam butir V.2, Bank \nIndonesia mengenakan sanksi teguran tertulis melalui tata cara \nsebagai berikut:  \na. berdasarkan\u2026",
            "Report corrections are submitted by Reporting Bank because Reporting Bank has \nsubmitted incomplete and incorrect reports. \n\u201cItem\u201d means fields in each record in each form. \nFor Example: \nReporting Bank submits correction of report on custodial activities for the month of \nSeptember 2012, which contains corrections to 10 (ten) erroneous items.  Submission \nof the report correction are made after the On-Line period, where the Reporting Bank \nshould have submitted it to Bank Indonesia on Friday, 5 October 2012, however it is \nsubmitted on Friday, 9 November 2012.  Based on this violation, the Reporting Bank \nis imposed with the sanction of obligation to make payment in the amount of \nRp50,000.00 x 10 items or equal to Rp500,000.00.  On this violation, it is not \nnecessary to impose the Reporting Bankwith the sanction of obligation to make \npayment for the delay in submission of Report correction as referred to in Article 23. \nArticle 25 \nSelf-explanatory. \nArticle 26",
            "BANK INDONESIA \n- 9 - \nRp.100.000,00 = Rp.200.000,00(two hundred thousand \nrupiahs)  \n \n \n \n \nParagraph (3) \n \u201cPer item of error or compulsory item to be reported\u201d is \ndefined as an error per data field. If in a row of data there are \nerrors more than one field, the error is calculated based on the \nnumber of incorrect fields in the corresponding row. \nExample: \nOn the list of Given Credit, in one row there are errors on the \ncolumn Collectability, Economic Sector and Amount, \ntherefore it is counted as 3 error items. \nFurthermore, if there 200 error items, the calculation of \nSanction is 200 x Rp.50.000,00 = Rp.10.000.000 (ten million \nrupiahs), however the Bank is only sanctioned with \nmaximum payment of  Rp.5.000.000,00 (five million rupiah). \n \nParagraph (4) \n \nSelf-explanatory \n \nParagraph (5) \n \nSelf-explanatory \n \nParagraph (6) \n \nExample: \n \nPer Office Report; \n13 June 2010 is Sunday. Bank A submits the per Office \nReport for data period of May 2010 on Monday 14 June 2010,"
        ],
        "ground_truth": "Nomor: 12/21/PBI/2010"
    },
    "41": {
        "question": "Undang-undang nomor berapa yang mengatur tentang Perbankan yang diubah oleh Undang-Undang Nomor 10 Tahun 1998?",
        "answer": "[Your answer here] \n\nSource: [No regulation found]",
        "contexts": [
            "LAMPIRAN III \nPERATURAN ANGGOTA DEWAN GUBERNUR \nNOMOR 24/23/PADG/2022 \nTANGGAL 30 DESEMBER 2022  \nTENTANG  \nLAPORAN PENYELENGGARA JASA \nPENGOLAHAN UANG RUPIAH \n \nFORMAT SURAT PEMBERITAHUAN  \nPENYAMPAIAN LAPORAN DAN/ATAU KOREKSI LAPORAN SECARA LURING \n \nKepada \nDepartemen Pengelolaan dan Kepatuhan Laporan/Kantor Perwakilan Dalam \nNegeri Bank Indonesia \u2026\u2026..  * \n \n \nPerihal: \nPenyampaian Laporan/Koreksi Laporan** Secara Luring \n \n \nSehubungan dengan gangguan teknis yang kami alami pada tanggal \n___________ yaitu ___________, bersama ini kami sampaikan Laporan/koreksi \nLaporan secara luring terlampir  dengan rincian sebagai berikut: \n \nNo \nSandi \nPelapor \nPeriode \nData \nNama File Laporan/Koreksi Laporan \n1 \n \n \n \n2 \n \n \n \n3 \n \n \n \n\u2026 \n\u2026 \n \n\u2026 \n \nSelain itu, terlampir juga kami sertakan dokumen sebagai bukti dan penjelasan \nterkait adanya gangguan teknis tersebut. \nDemikian Laporan/koreksi Laporan** secara luring ini kami sampaikan. \nTerima kasih. \n \n..., ..... (tempat & tanggal)",
            "Simpan Pinjam sebesar Rp25.000,00 (dua puluh \nlima ribu rupiah) per hari kerja keterlambatan, \npaling banyak sebesar Rp900.000,00 (sembilan \nratus ribu rupiah) untuk setiap kantor Pelapor. \n \n9. Di antara Pasal 33 dan Pasal 34 disisipkan 1 (satu) pasal, \nyakni Pasal 33A yang berbunyi sebagai berikut: \n \nPasal 33A \nPelapor yang menolak permintaan Debitur yang ingin \nmemperoleh Informasi Debitur atas nama Debitur yang \nbersangkutan sebagaimana dimaksud dalam Pasal 24 ayat \n(1), dikenakan sanksi teguran tertulis.",
            "DOC NAME: SURAT EDARAN BANK INDONESIA NOMOR 16/3/DPTP TANGGAL 3 MARET 2014 PERIHAL PELAKSANAAN PENGALIHAN PENGELOLAAN KREDIT LIKUIDITAS BANK INDONESIA DALAM RANGKA KREDIT PROGRAM | Surat Edaran",
            "Rp1.300.000,00 (satu juta tiga ratus ribu rupiah). \n \n9. \nSanksi Kewajiban Membayar Kepada Pelapor atas Koreksi Penyampaian \nLaporan di Luar Batas Periode Keterlambatan atas Inisiatif Pelapor dan \nTemuan Otoritas. \na. \nPeriode Penyampaian Harian: \nBank Z menyampaikan koreksi Laporan berupa informasi transaksi \nsurat berharga dan sertifikat deposito di pasar sekunder dalam \nkelompok informasi keuangan di luar batas periode keterlambatan \natas inisiatif Bank Z sebanyak 10 (sepuluh) baris dan atas hasil \npengawasan Bank Indonesia terhadap Laporan Bank Z sebanyak 15 \n(lima belas) baris pada tanggal 20 Desember 2021 untuk data tanggal \n12 Oktober 2021 yang tercantum dalam 1 (satu) surat pengantar \npenyampaian koreksi Laporan. Oleh karena itu, Bank Z dikenai sanksi \nadministratif berupa kewajiban membayar sebesar 10 (sepuluh) baris \nx Rp50.000,00 (lima puluh ribu rupiah) = Rp500.000,00 (lima ratus \nribu rupiah) untuk inisiatif Bank Z ditambah dengan 15 (lima belas)",
            "Bank dikenakan sanksi kewajiban membayar sebesar Repo Rate ditambah 200 \nbps dikalikan jumlah hari dengan nominal Nilai Pembelian Kembali sejak \nTanggal Jatuh Tempo sampai dengan pelunasan. \nSanksi \nkewajiban \nmembayar \n= \nNilai \npembelian \nkembali \nx \n(repo rate + 200bps) \nx \nJumlah hari \n360 \n= \nCNY1.003.444,44 \nx (4%  +  2%) \nx \n5 \n=  CNY836,20 \n360 \n \nd. Total kewajiban \nTotal \nkewajiban \n= \nNilai \npembelian \nkembali \n+ \nSanksi \nkewajiban \nmembayar \n=   CNY1.003.444,44  +  CNY836,20   =   CNY1.004.280,64 \ne. Total\u2026"
        ],
        "ground_truth": "Undang-Undang Nomor 7 Tahun 1992."
    },
    "42": {
        "question": "Undang-undang nomor berapa yang mengatur tentang Bank Indonesia yang terakhir diubah?",
        "answer": "Peraturan Bank Indonesia terakhir yang mengatur tentang Bank Indonesia adalah Peraturan Bank Indonesia Nomor 18/21/PBI/2016 tentang Perubahan atas Peraturan Bank Indonesia Nomor 9/14/PBI/2007 tentang Sistem Informasi Debitur.\n\nSumber: [PERATURAN BANK INDONESIA NOMOR 18/21/PBI/2016 TENTANG PERUBAHAN ATAS PERATURAN BANK INDONESIA NOMOR 9/14/PBI/2007 TENTANG SISTEM INFORMASI DEBITUR](https://www.bi.go.id/id/publikasi/peraturan/Documents/pbi_182116.pdf)",
        "contexts": [
            "21ii              \n \ndikenakan sanksi kewajiban membayar sebesar Rp50.000,00 \n(lima puluh ribu rupiah) untuk setiap item data dan paling \nbanyak sebesar Rp1.000.000,00 (satu juta rupiah) untuk setiap \nform. \n \nPasal 15 \nSelain dikenakan sanksi sebagaimana dimaksud dalam Pasal \n12, Pasal 13, dan/atau Pasal 14, Bank Pelapor dikenakan \nsanksi berupa teguran tertulis dalam hal Bank Pelapor belum \nmenyampaikan Laporan, form header, dan/atau koreksi \nLaporan sebagaimana dimaksud dalam Pasal 9, Pasal 10, dan \nPasal 11 sampai periode penyampaian Laporan berikutnya. \n \nPasal 16 \nBank Pelapor yang tidak menyampaikan pemberitahuan \ntertulis perihal gangguan teknis sebagaimana dimaksud dalam \nPasal 11 ayat (3) dan/atau perihal keadaan memaksa (force \nmajeure) sebagaimana dimaksud dalam Pasal 11 ayat (7) \ndikenakan sanksi teguran tertulis. \n \nPasal 17 \n(1) \nPengenaan sanksi kewajiban membayar sebagaimana \ndimaksud dalam Pasal 12, Pasal 13, dan Pasal 14",
            "yang \ndinyatakan \ntidak \nmenyampaikan \nLaporan \nDebitur \nsebagaimana dimaksud dalam Pasal 12 ayat (2) dikenakan sanksi berupa \nkewajiban membayar dan penundaan pemberian informasi Debitur sampai \ndengan diterimanya Laporan Debitur dimaksud oleh Bank Indonesia. \n(2) Pengenaan sanksi kewajiban membayar sebagaimana dimaksud pada             \nayat (1) diatur sebagai berikut:  \na. \nbagi Bank Umum, sebesar Rp50.000.000,00 (lima puluh juta rupiah) \nper Laporan Debitur untuk setiap kantor Pelapor;  \n \n \nb. bagi \u2026",
            "Simpan Pinjam sebesar Rp25.000,00 (dua puluh \nlima ribu rupiah) per hari kerja keterlambatan, \npaling banyak sebesar Rp900.000,00 (sembilan \nratus ribu rupiah) untuk setiap kantor Pelapor. \n \n9. Di antara Pasal 33 dan Pasal 34 disisipkan 1 (satu) pasal, \nyakni Pasal 33A yang berbunyi sebagai berikut: \n \nPasal 33A \nPelapor yang menolak permintaan Debitur yang ingin \nmemperoleh Informasi Debitur atas nama Debitur yang \nbersangkutan sebagaimana dimaksud dalam Pasal 24 ayat \n(1), dikenakan sanksi teguran tertulis.",
            "-4- \n \n \nmembayar sebesar Rp100.000,00 (seratus ribu rupiah) per hari kerja \nketerlambatan.  \n(3) Bank Pelapor yang menyampaikan koreksi Laporan atas inisiatif Bank \nPelapor setelah melampaui batas waktu keterlambatan penyampaian \nkoreksi Laporan sebagaimana dimaksud dalam Pasal 10, dikenakan \nsanksi kewajiban membayar sebesar Rp50.000,00 (lima puluh ribu \nrupiah) per item kesalahan Laporan dan paling banyak seluruhnya \nsebesar Rp5.000.000,00 (lima juta rupiah) per Laporan.  \n(4) Bank Pelapor yang menyampaikan koreksi Laporan atas dasar temuan \nBank Indonesia setelah melampaui batas waktu keterlambatan \npenyampaian koreksi Laporan sebagaimana dimaksud dalam Pasal 10 \ndikenakan sanksi kewajiban membayar sebesar Rp100.000,00 (seratus \nribu rupiah) per item kesalahan Laporan dan paling banyak seluruhnya \nsebesar Rp10.000.000,00 (sepuluh juta rupiah) per Laporan. \n(5) Dalam hal Bank dikenakan sanksi kewajiban membayar karena",
            "DOC NAME: SURAT EDARAN BANK INDONESIA NOMOR 11/21/DKBU - BATAS MAKSIMUM PEMBERIAN KREDIT BANK PERKREDITAN RAKYAT | Surat Edaran\n\n \n \n \n5. Klik Tombol Restore \n \n6. Klik Tombol Yes \n \nPetunjuk Teknis Aplikasi Data Entry \n- 16 - \n\nBMPK\nRestore Data\nFile Rackun\nBMPK\nRestore data akan menghapus data sebelumnya. Apakah anda yakin?\nYes\nNo\nBrowse\nRestore\nKeluar\nB"
        ],
        "ground_truth": "Undang-Undang Nomor 23 Tahun 1999."
    },
    "43": {
        "question": "Siapa yang harus menyetujui Rencana Bisnis Bank yang disusun oleh Direksi?",
        "answer": "Direksi harus menyetujui Rencana Bisnis Bank yang disusun oleh Direksi.\n\nSource: CIRCULLAR LETTER NO.12/27/DPNP - COMMERCIAL BANKS BUSINESS PLAN (https://www.bi.go.id/en/publikasi/peraturan/Documents/7522e09bec6e448d838f777dfe93470bSEEKS1227DPNPENG.pdf#page=7)",
        "contexts": [
            "IT Steering Committee is responsible for presenting recommendations to the directors \nwhich at least regarding the following: \na. Policy of information security as a part of IT Strategic Plan; \nb. The effectiveness of the information security policy implementation in Banks; \nc. The effectiveness of mitigating risks to increase Bank\u2019s information security. \n \n5.2.3 Directors \nDirectors responsibility on information security include at least the following: \na. Determine policies, systems and procedures of information security; \nb. Support every aspects of information security program; \nc. Determine distribution of duty and responsibility for decision making related to \ninformation security risk management; \nd. Determine tolerable risk level of information security; \ne. Evaluate the result of the implementation of information security risk mitigation;",
            "discussion shall include general overview on implementation of \nAML AND CFT Program.  This approach is provided to employees \nwho do not get priorities and organized if provisions are amended \nsignificantly.   \n \n3. \nTopics and Evaluation of Training \na. \nTopics of training shall at least include: \n1) \nImplementation of laws and regulation in relation with AML AND \nCFT Program; \n2) \nTechniques, methodoloty and tipology of money laundering and \nthe financing of terrorism including trends and development of \nrisks\u2019 profiles of banking products; and  \n3) \nPolicies and procedures on implementation of AML AND CFT \nProgram and roles and authority of employees in eradicating \nmoney laundering and the financing of terrorism, including \nconsequences if employees conducting tipping off. \nb. \nThe Bank shall oblige to conduct evaluation on any training organized in \norder to identify level of understanding of participants and suitability of \nsubstances provided.  \nc.",
            "soundness rating assessment system for Commercial Banks. \nDescription of the performance of capital adequacy, and composition, \nas well as the ability of the Bank capital to cover the risk of non-\nperforming assets, the ability of Bank to increase the capital from Bank \noperating profit, the ability of Bank capital to support business growth,",
            "Doubtful \n(4) 100% of the productive asset categorized as \t\t\n\t\nLoss \n\u2022 \nRatio is calculated based on the  position at \nevaluation date\nObjective:\nTo measure the bank capital \ncapability to absorb risk in case of \nwrite off to trouble assets \nRating evaluation criteria: \n\u2022 \nRating 1:\nECR \u2265 4\n\u2022 \nRating 2\n3 \u2264 ECR < 4\n\u2022 \nRating 3\n2 \u2264 ECR < 3\n\u2022 \nRating 4\n1 \u2264 ECR < 2\n\u2022 \nRating 5\n      ECR < 1\n  \n2\nAttachment 1a: Capital",
            "Pencabutan Peraturan Bank Indonesia mengenai Kredit \nLikuiditas Bank Indonesia terkait Kredit Program dan \nPeraturan Pelaksanaannya; \n \nMengingat \n: Undang-Undang Nomor 23 Tahun 1999 tentang Bank \nIndonesia (Lembaran Negara Republik Indonesia Tahun 1999 \nNomor 66,  Tambahan Lembaran  Negara  Republik Indonesia \nNomor 3843) sebagaimana telah beberapa kali  diubah  terakhir"
        ],
        "ground_truth": "Dewan Komisaris."
    },
    "44": {
        "question": "Berapa minimal jangka waktu Rencana Bisnis Bank?",
        "answer": "Tidak ada informasi yang relevan dalam konteks yang diberikan mengenai minimal jangka waktu Rencana Bisnis Bank.",
        "contexts": [
            "teguran tertulis dan kewajiban membayar sebesar Rp250 juta per hari \npelanggaran dengan batas paling banyak sebesar Rp5 miliar per tahun \nkalender. Selain bentuk sanksi tersebut, terhadap  jenis pelanggaran tertentu \nakan dikenakan tambahan berupa dilakukan proses fit & proper test dan/atau \npenilaian tingkat kesehatan bank.",
            "Repo BCSA, tidak menatausahakan dokumen Underlying Transaksi, \ndan/atau membatalkan Transaksi CNY/IDR Repo BCSA yang telah diajukan \nkepada Bank Indonesia maka Bank Umum dikenakan sanksi berupa : \n1) teguran tertulis dan  \n2) kewajiban membayar sebesar 0,01% dari nilai Transaksi CNY/IDR Repo \nBCSA, paling sedikit sebesar Rp10.000.000,00 (sepuluh juta rupiah) dan \npaling banyak sebesar Rp100.000.000,00 (seratus juta rupiah) per \ntransaksi  \nb. Dalam hal pada tanggal jatuh waktu (second leg) Bank Umum tidak \nmentransfer dana Chinese Yuan sebesar nilai setelmen second leg \nTransaksi CNY/IDR Repo BCSA ke rekening Bank Indonesia di People \nBank\u2019s of China, Bank Umum dikenakan sanksi berupa : \n1) teguran tertulis; dan \n2) kewajiban membayar dengan perhitungan sebagai berikut: \nSanksi\nKewajiban\nMembayar\n =  \nNilai\nSetelmen\nSecond Leg\n   x   Repo\nRate+300bps  x \nJumlah\nHari\n360",
            "Bank dikenakan sanksi kewajiban membayar sebesar Repo Rate ditambah 200 \nbps dikalikan jumlah hari dengan nominal Nilai Pembelian Kembali sejak \nTanggal Jatuh Tempo sampai dengan pelunasan. \nSanksi \nkewajiban \nmembayar \n= \nNilai \npembelian \nkembali \nx \n(repo rate + 200bps) \nx \nJumlah hari \n360 \n= \nCNY1.003.444,44 \nx (4%  +  2%) \nx \n5 \n=  CNY836,20 \n360 \n \nd. Total kewajiban \nTotal \nkewajiban \n= \nNilai \npembelian \nkembali \n+ \nSanksi \nkewajiban \nmembayar \n=   CNY1.003.444,44  +  CNY836,20   =   CNY1.004.280,64 \ne. Total\u2026",
            "potential for loss, including but not limited to foreclosed collateral, \nabandoned property, interoffice accounts, and suspense accounts. \n5. \n\u201cCredit\u201d is provision of funds or equivalent claims based on a loan \nagreement or contract between the Bank and another party requiring the \nborrowing party to repay the debt at a specified term with interest, \nincluding: \na. overdraft, namely negative balance in the demand deposit of a customer \nthat cannot be repaid in full at end-of-day; \nb. takeover of claims within the framework of factoring; \nc. negotiation or purchase of credit from other parties. \n6. \u201cSecurities\u201d \u2026",
            "DOC NAME: CIRCULAR LETTER NO.6/15/DPNP FIT AND PROPER TEST AND APPENDIX | Bank Indonesia Circular Letters\n\nApendix of Bank Indonesia Circular Letter Number  6/15  /DPNP dated 31 March \n2004  \n \nUnofficial translation                        \n \n3\nAppendix  3 b Continued \n \n \n \nPresident Director \n.................... \nDirectors \n.................... \n \n \n \nPT D \nStructure of Ownership \nPT E \n30% \nPT F \n70% \n \n \nStructure of Organization \nPresident of the Board of Commissioners \n.................... \nCommissioners \n.................... \n \n \nPresident Director \n.................... \nDirectors \n.................... \n \n \n \nPT E \nStructure of Ownership \nMr. E (Ultimate Shareholders) \n100% \n \n \nStructure of Organization \nPresident of the Board of Commissioners \n...................."
        ],
        "ground_truth": "Satu tahun."
    },
    "45": {
        "question": "Pasal berapa yang menggambarkan ketentuan umum Rencana Bisnis Bank?",
        "answer": "Pasal yang menggambarkan ketentuan umum Rencana Bisnis Bank tidak ditemukan dalam konteks dan informasi metadata yang diberikan.",
        "contexts": [
            "224 \n \nKeterangan \nSJT \nkonsultan asuransi dan dana pensiun, jasa evaluasi dan \npenilai kerugian, dan jasa aktuarial. \n \n \n15 Penerimaan jasa keuangan \n \n108000T \n \n \nMeliputi penerimaan atas penyediaan jasa perantara \nkeuangan dan jasa pendukung lainnya yang terkait dengan \nlembaga keuangan, seperti: (1) fee jasa intermediasi terkait \ndengan letters of credit, bankers' acceptances,penyediaan \nfasilitas kredit, leasing, dan transaksi jual beli valuta asing; \n(2) komisi serta fee lainnya terkait dengan transaksi surat-\nsurat berharga, misalnya broker, placements of issues, \nunderwriting, redemption, dan financial derivative; (3) komisi \nuntuk pedagang bursa komoditi; dan (4) jasa terkait dengan \nmanajemen aset, penasehat investasi, operasional dan \npengaturan \npasar \nfinansial, \npenjaminan \nemisi, \ndan \nkustodian. \n \n \n \n \n \n \n \n \n \n \n \n \n \n \n16 Penerimaan atas penggunaan hak kekayaan intelektual \n110000T \n \n \nMeliputi penerimaan atas penggunaan (termasuk reproduksi",
            "21ii              \n \ndikenakan sanksi kewajiban membayar sebesar Rp50.000,00 \n(lima puluh ribu rupiah) untuk setiap item data dan paling \nbanyak sebesar Rp1.000.000,00 (satu juta rupiah) untuk setiap \nform. \n \nPasal 15 \nSelain dikenakan sanksi sebagaimana dimaksud dalam Pasal \n12, Pasal 13, dan/atau Pasal 14, Bank Pelapor dikenakan \nsanksi berupa teguran tertulis dalam hal Bank Pelapor belum \nmenyampaikan Laporan, form header, dan/atau koreksi \nLaporan sebagaimana dimaksud dalam Pasal 9, Pasal 10, dan \nPasal 11 sampai periode penyampaian Laporan berikutnya. \n \nPasal 16 \nBank Pelapor yang tidak menyampaikan pemberitahuan \ntertulis perihal gangguan teknis sebagaimana dimaksud dalam \nPasal 11 ayat (3) dan/atau perihal keadaan memaksa (force \nmajeure) sebagaimana dimaksud dalam Pasal 11 ayat (7) \ndikenakan sanksi teguran tertulis. \n \nPasal 17 \n(1) \nPengenaan sanksi kewajiban membayar sebagaimana \ndimaksud dalam Pasal 12, Pasal 13, dan Pasal 14",
            "Damaged Currency. \nb. The amount of replacement provided for Damaged Currency as \nreferred to in item V.2.a. is stipulated as follows: \n1) Bank Notes or Coins: \na) if the physical Currency greater than half of its original \nsize with Currency Identifying Marks recognizable for \ntheir authenticity, replacement shall be issued at face \nvalue; \nb) no replacement shall be issued for physical Currency equal \nto or less than half of its original size. \n2) Bank Notes made of plastic (polymer): \na) wrinkled but intact physical Currency having Currency \nIdentifying Marks with recognizable authenticity shall be \nreplaced at face value; \nb) wrinkled \u2026",
            "Unofficial Translation \nNo. 9/3/DPM                                                                          Jakarta, March 5, 2007 \n \nCIRCULAR LETTER \n \nSubject  :   Commercial Bank Daily Report and Money Market Information Center  \nCharges \n         ------------------------------------------------------------------------------------- \nFollowing the enactment of Bank Indonesia \nRegulation \nNumber    \n9/2/PBI/2007 dated March 5, 2007 concerning Commercial Bank Daily Report \n(State Gazette of the Republic of Indonesia 7 Number 40 of 2007, Supplement to \nthe State Gazette of the Republic of Indonesia Number 4706) and Bank Indonesia \nCircular Letter Number 9/2/DPM dated March 5, 2007 concerning Commercial \nBank Daily Report, it is deemed necessary to re-regulate provisions concerning \nCommercial Bank Daily Report and Money Market Information Center Charges in \na Circular Letter as follows. \nI. Reporting Banks",
            "teguran tertulis dan kewajiban membayar sebesar Rp250 juta per hari \npelanggaran dengan batas paling banyak sebesar Rp5 miliar per tahun \nkalender. Selain bentuk sanksi tersebut, terhadap  jenis pelanggaran tertentu \nakan dikenakan tambahan berupa dilakukan proses fit & proper test dan/atau \npenilaian tingkat kesehatan bank."
        ],
        "ground_truth": "Pasal I."
    },
    "46": {
        "question": "Apa yang perlu diperhatikan dalam penyusunan Rencana Bisnis Bank sesuai dengan peraturan?",
        "answer": "Dalam penyusunan Rencana Bisnis Bank sesuai dengan peraturan, perlu diperhatikan hal-hal berikut:\n- Penilaian tingkat kesehatan sistem perbankan.\n- Deskripsi kinerja kecukupan modal dan komposisi, serta kemampuan modal Bank untuk menutupi risiko aset yang bermasalah.\n- Kemampuan Bank untuk meningkatkan modal dari keuntungan operasional Bank.\n- Kemampuan modal Bank untuk mendukung pertumbuhan bisnis.\n\nSumber: CIRCULLAR LETTER NO.12/27/DPNP - COMMERCIAL BANKS BUSINESS PLAN\n(https://www.bi.go.id/en/publikasi/peraturan/Documents/7522e09bec6e448d838f777dfe93470bSEEKS1227DPNPENG.pdf)",
        "contexts": [
            "soundness rating assessment system for Commercial Banks. \nDescription of the performance of capital adequacy, and composition, \nas well as the ability of the Bank capital to cover the risk of non-\nperforming assets, the ability of Bank to increase the capital from Bank \noperating profit, the ability of Bank capital to support business growth,",
            "fisik uang meyakinkan Bank Indonesia adanya dugaan unsur kesengajaan, \nmisalnya terdapat bekas potongan dengan alat tajam atau alat lainnya, benang \npengaman hilang seluruhnya atau sebagian karena dirusak, dan/atau jumlah uang",
            "Appendix to Circular Letter of Bank Indonesia Number 6/ 37/DPNP dated  September  10,  2004         \n \n \n3 \nRATING \nSCOPE \n1 \n2 \n3 \n4 \n5 \n \nThe implementation of \ninternal control and \ninternal audit function \nis highly effective. \nThe implementation of \ninternal control and \ninternal audit function \nis effective. \nThe implementation of \ninternal control and \ninternal audit function \nis reasonably effective. \nThe implementation of \ninternal control and \ninternal audit function \nis not effective enough. \nNo internal control \nand internal audit. \nComprehensive and \nreliable MIS is in \nplace. \nAdequate MIS in \nplace, despite \ninsignificant \nweaknesses that do not \naffect accuracy of \ninformation.   \nReasonably adequate \nMIS  in place and \nweaknesses can be \neasily corrected. \nMIS in place, but is not \nadequate enough and \nhas significant \nweaknesses. \n \nNo MIS in place, or \nMIS is in place but \ncompletely \ninadequate and \nunable to identify \nsuspicious \ntransactions. \nManagement",
            "Unofficial Translation \nNo. 9/3/DPM                                                                          Jakarta, March 5, 2007 \n \nCIRCULAR LETTER \n \nSubject  :   Commercial Bank Daily Report and Money Market Information Center  \nCharges \n         ------------------------------------------------------------------------------------- \nFollowing the enactment of Bank Indonesia \nRegulation \nNumber    \n9/2/PBI/2007 dated March 5, 2007 concerning Commercial Bank Daily Report \n(State Gazette of the Republic of Indonesia 7 Number 40 of 2007, Supplement to \nthe State Gazette of the Republic of Indonesia Number 4706) and Bank Indonesia \nCircular Letter Number 9/2/DPM dated March 5, 2007 concerning Commercial \nBank Daily Report, it is deemed necessary to re-regulate provisions concerning \nCommercial Bank Daily Report and Money Market Information Center Charges in \na Circular Letter as follows. \nI. Reporting Banks",
            "diterimanya laporan dan/atau koreksi laporan. \n \nBagian Keempat \nGangguan Teknis dan Keadaan Kahar \n \nParagraf 1 \nGangguan Teknis \n \nPasal 41 \n(1) \nDalam hal Bank ACCD Indonesia mengalami gangguan \nteknis dalam menyampaikan laporan maka Bank ACCD \nIndonesia segera menyampaikan pemberitahuan secara \ntertulis kepada Bank Indonesia disertai dengan bukti \npendukung."
        ],
        "ground_truth": "Faktor eksternal dan internal, prinsip kehati-hatian, penerapan manajemen risiko, dan prinsip kesehatan perbankan."
    },
    "47": {
        "question": "Siapa yang melakukan pengawasan terhadap pelaksanaan Rencana Bisnis?",
        "answer": "Bank Indonesia melakukan pengawasan terhadap pelaksanaan Rencana Bisnis Bank.\n\nSource: CIRCULAR LETTER NO. 6/37/DPNP ASSESSMENT AND IMPOSITION OF SANCTIONS IN REGARD TO THE APPLICATION OF KNOW YOUR CUSTOMER PRINCIPLES AND OTHER REQUIREMENTS PERTAINING TO THE LAW ON MONEY LAUNDERING CRIME AND APPENDIX (https://www.bi.go.id/en/publikasi/peraturan/Documents/c6ca70f1ca1542e4bb69e387c6518e83lamp_se637dpnp_eng.pdf)",
        "contexts": [
            "Appendix to Circular Letter of Bank Indonesia Number 6/ 37/DPNP dated  September  10,  2004         \n \n \n3 \nRATING \nSCOPE \n1 \n2 \n3 \n4 \n5 \n \nThe implementation of \ninternal control and \ninternal audit function \nis highly effective. \nThe implementation of \ninternal control and \ninternal audit function \nis effective. \nThe implementation of \ninternal control and \ninternal audit function \nis reasonably effective. \nThe implementation of \ninternal control and \ninternal audit function \nis not effective enough. \nNo internal control \nand internal audit. \nComprehensive and \nreliable MIS is in \nplace. \nAdequate MIS in \nplace, despite \ninsignificant \nweaknesses that do not \naffect accuracy of \ninformation.   \nReasonably adequate \nMIS  in place and \nweaknesses can be \neasily corrected. \nMIS in place, but is not \nadequate enough and \nhas significant \nweaknesses. \n \nNo MIS in place, or \nMIS is in place but \ncompletely \ninadequate and \nunable to identify \nsuspicious \ntransactions. \nManagement",
            "discussion shall include general overview on implementation of \nAML AND CFT Program.  This approach is provided to employees \nwho do not get priorities and organized if provisions are amended \nsignificantly.   \n \n3. \nTopics and Evaluation of Training \na. \nTopics of training shall at least include: \n1) \nImplementation of laws and regulation in relation with AML AND \nCFT Program; \n2) \nTechniques, methodoloty and tipology of money laundering and \nthe financing of terrorism including trends and development of \nrisks\u2019 profiles of banking products; and  \n3) \nPolicies and procedures on implementation of AML AND CFT \nProgram and roles and authority of employees in eradicating \nmoney laundering and the financing of terrorism, including \nconsequences if employees conducting tipping off. \nb. \nThe Bank shall oblige to conduct evaluation on any training organized in \norder to identify level of understanding of participants and suitability of \nsubstances provided.  \nc.",
            "Unofficial Translation \nNo. 9/3/DPM                                                                          Jakarta, March 5, 2007 \n \nCIRCULAR LETTER \n \nSubject  :   Commercial Bank Daily Report and Money Market Information Center  \nCharges \n         ------------------------------------------------------------------------------------- \nFollowing the enactment of Bank Indonesia \nRegulation \nNumber    \n9/2/PBI/2007 dated March 5, 2007 concerning Commercial Bank Daily Report \n(State Gazette of the Republic of Indonesia 7 Number 40 of 2007, Supplement to \nthe State Gazette of the Republic of Indonesia Number 4706) and Bank Indonesia \nCircular Letter Number 9/2/DPM dated March 5, 2007 concerning Commercial \nBank Daily Report, it is deemed necessary to re-regulate provisions concerning \nCommercial Bank Daily Report and Money Market Information Center Charges in \na Circular Letter as follows. \nI. Reporting Banks",
            "Pencabutan Peraturan Bank Indonesia mengenai Kredit \nLikuiditas Bank Indonesia terkait Kredit Program dan \nPeraturan Pelaksanaannya; \n \nMengingat \n: Undang-Undang Nomor 23 Tahun 1999 tentang Bank \nIndonesia (Lembaran Negara Republik Indonesia Tahun 1999 \nNomor 66,  Tambahan Lembaran  Negara  Republik Indonesia \nNomor 3843) sebagaimana telah beberapa kali  diubah  terakhir",
            "Repo BCSA, tidak menatausahakan dokumen Underlying Transaksi, \ndan/atau membatalkan Transaksi CNY/IDR Repo BCSA yang telah diajukan \nkepada Bank Indonesia maka Bank Umum dikenakan sanksi berupa : \n1) teguran tertulis dan  \n2) kewajiban membayar sebesar 0,01% dari nilai Transaksi CNY/IDR Repo \nBCSA, paling sedikit sebesar Rp10.000.000,00 (sepuluh juta rupiah) dan \npaling banyak sebesar Rp100.000.000,00 (seratus juta rupiah) per \ntransaksi  \nb. Dalam hal pada tanggal jatuh waktu (second leg) Bank Umum tidak \nmentransfer dana Chinese Yuan sebesar nilai setelmen second leg \nTransaksi CNY/IDR Repo BCSA ke rekening Bank Indonesia di People \nBank\u2019s of China, Bank Umum dikenakan sanksi berupa : \n1) teguran tertulis; dan \n2) kewajiban membayar dengan perhitungan sebagai berikut: \nSanksi\nKewajiban\nMembayar\n =  \nNilai\nSetelmen\nSecond Leg\n   x   Repo\nRate+300bps  x \nJumlah\nHari\n360"
        ],
        "ground_truth": "Dewan Komisaris."
    },
    "48": {
        "question": "Apa saja yang harus dimuat dalam Rencana Bisnis sesuai dengan Pasal 5?",
        "answer": "Dalam Rencana Bisnis Bank sesuai dengan Pasal 5, hal-hal yang harus dimuat adalah:\n\n1. Rencana strategis bank\n2. Rencana kegiatan operasional bank\n3. Rencana keuangan bank\n4. Rencana manajemen risiko bank\n5. Rencana pengembangan sumber daya manusia bank\n6. Rencana pengembangan teknologi informasi bank\n\nSumber: BANK INDONESIA REGULATION NO.14/18/PBI/2012 - CONCERNING MINIMUM CAPITAL ADEQUACY REQUIREMENT FOR COMMERCIAL BANKS\nSource: [BANK INDONESIA REGULATION NO.14/18/PBI/2012](https://www.bi.go.id/en/publikasi/peraturan/Documents/671de832d1af4cd0969c387586abecdaPBI141813ENG.pdf)",
        "contexts": [
            "the capital deduction factors.  \nLetter c  \n \u201cCurrent year profit\u201d is the profit earned in the current year after being \ndeducted with tax estimation. \nIn terms of the Bank experience losses in the current year , the entire \nloss shall be the capital deduction factors. \nLetter d  \n \u201cGeneral capital reserves\u201d is the reserves formed from retained \nearnings  or from last year profit after being deducted with tax, and \nhave gained approval from its headquarters as the general capital \nreserves. \nLetter e  \n \u201cReserve capital purpose\u201d is the reserve formed from retained \nearnings or from last year profit after being deducted with tax, that set \naside for a specific purpose and already gained approval from its",
            "10424  \n \n \n \n5)      Extended Credits \n10425  \n \n \n \n6)      Other Claims \n10426  \n \n \n \n7)      Interest Claim Receivables \n10427  \n \n \n5. Credits Based On Housing Collaterals \n10500  \n \n \n \na.    Extended Credits \n10510  \n \n \n \nb.    Interest Claim Receivables \n10520  \n \n \n6. Credits Based On Commercial Property Collaterals \n10600  \n \n \n \na.    Extended Credits \n10610  \n \n \n \nb.    Interest Claim Receivables \n10620",
            "monthly report. \nLetter c \nThe meaning of  \u201cgovernment owned third party funds\u201d shall be \ndemand deposit, savings deposit,  and time deposit owned by \nthe central government and  provincial and district/municipal  \ngovernment  whose budgets are part of the State Budget  \n(APBN) or  the Regional Budget (APBD).  \n \nLetter d \u2026",
            "Lampiran SE No. 13/  3  /DPM Tanggal 4  Februari 2011  \n5 \n \nNo \nNAMA BANK \nSANDI \n150 BANK OF BERMUDA - BRUSSEL \n63I \n151 BANK OF BERMUDA - DUBLIN \n63J \n152 BANK OF BERMUDA - SINGAPORE \n63K \n153 BANK OF BERMUDA - LAINNYA \n63L \n154 BANK OF BOSTON - LONDON \n63M \n155 BANK OF BOSTON - SINGAPORE \n63N \n156 BANK OF BOSTON - LAINNYA \n63O \n157 BANK OF CALIFORNIA - NEW YORK \n63P \n158 BANK OF CALIFORNIA - SAN FRANSISCO \n63Q \n159 BANK OF CALIFORNIA - SINGAPORE \n63R \n160 BANK OF CALIFORNIA - TAIPEI \n63S \n161 BANK OF CALIFORNIA - LAINNYA \n63T \n162 BANK OF CHINA - FRANKFURT \n63U \n163 BANK OF CHINA - HONGKONG \n63V \n164 BANK OF CHINA - LAINNYA \n63W \n165 BANK OF NEW YORK - BRUSSEL \n64A \n166 BANK OF NEW YORK - FRANKFURT \n64B \n167 BANK OF NEW YORK - HONGKONG \n64C \n168 BANK OF NEW YORK - NEW YORK \n64D \n169 BANK OF NEW YORK - SINGAPORE \n64E \n170 BANK OF NEW YORK - LAINNYA \n64F \n171 BANK OF NOVA SCOTIA - HONGKONG \n64G \n172 BANK OF NOVA SCOTIA - LONDON \n64H \n173 BANK OF NOVA SCOTIA - SINGAPORE \n64I",
            "6BU\n\n338\n\nSKANDINAVISKA ENSKILDA BANKEN - SINGAPORE\n\n6BV\n\n339\n\nSKANDINAVISKA ENSKILDA BANKEN - STOCKHOLM\n\n6BW\n\n340\n\nSKANDINAVISKA ENSKILDA BANKEN - LAINNYA\n\n6BX\n\n341\n\nSOCIETE GENERALE (SOC GEN) - HONGKONG\n\n6CA\n\n342\n\nSOCIETE GENERALE (SOC GEN) - LONDON\n\n6CB\n\n343\n\nSOCIETE GENERALE (SOC GEN) - LUXEMBOURG\n\n6CC\n\n344\n\nSOCIETE GENERALE (SOC GEN) - NEW YORK\n\n6CD\n\n345\n\nSOCIETE GENERALE (SOC GEN) - PARIS\n\n6CE\n\n346\n\n\n\n347 SOCIETE ...SOCIETE GENERALE (SOC GEN) - TOKYO\n\n6CF\n\n347\n\nSOCIETE GENERALE (SOC GEN) - LAINNYA\n\n6CG\n\n348\n\nSTANDCHART BANK - MUMBAI\n\n6CH\n\n349\n\nSTANDCHART BANK - NEW YORK\n\n6CI\n\n350\n\nSTANDCHART BANK - TAIPEI\n\n6CJ\n\n351\n\nSTANDCHART BANK - TOKYO\n\n6CK\n\n352\n\nSTANDCHART BANK - LAINNYA\n\n6CL\n\n353\n\nSTATE STREET BANK - BOSTON\n\n6CM\n\n354\n\nSTATE STREET BANK - LONDON\n\n6CN\n\n355\n\nSTATE STREET BANK - NEWYORK\n\n6CO\n\n356\n\nSTATE STREET BANK - LAINNYA\n\n6CP\n\n357\n\nSVENSKA HANDELS BANKEN - SINGAPORE\n\n6CQ\n\n358\n\nSVENSKA HANDELS BANKEN - STOCKHOLM\n\n6CR\n\n359\n\nSVENSKA HANDELS BANKEN - LAINNYA\n\n6CS\n\n360"
        ],
        "ground_truth": "Ringkasan eksekutif, kebijakan strategi manajemen, penerapan manajemen risiko dan kinerja Bank terkini, perkiraan laporan keuangan dan asumsi yang digunakan, perkiraan rasio dan pos tertentu lainnya, rencana pendanaan, rencana investasi dana, rencana kapitalisasi, perbaikan organisasi dan sumber daya manusia, rencana penerbitan produk dan/atau perubahan jaringan kantor, dan informasi lainnya."
    },
    "49": {
        "question": "Apa nomor undang-undang yang mengatur tentang Perbankan Syariah?",
        "answer": "Tidak ada informasi yang relevan dalam konteks yang menyebutkan nomor undang-undang yang mengatur tentang Perbankan Syariah.",
        "contexts": [
            "2004 dikeluarkan 9 Rekomendasi Khusus yang terkait dengan pembawaan uang \ntunai. \nFront Liner/Officer : petugas Bank yang langsung berhubungan dengan Nasabah yang \nmembutuhkan pelayanan perBankan, antara lain teller dan customer service.",
            "LAMPIRAN III \nPERATURAN ANGGOTA DEWAN GUBERNUR \nNOMOR 24/15/PADG/2022 \nTANGGAL 31 OKTOBER 2022 \nTENTANG  \nLAPORAN PEMBAWAAN UANG KERTAS ASING \nKE DALAM DAN KE LUAR DAERAH PABEAN \nINDONESIA \n \nSURAT PEMBERITAHUAN  \nPENYAMPAIAN LAPORAN DAN KOREKSI LAPORAN SECARA LURING \n \nKepada \nDepartemen Pengelolaan dan Kepatuhan Laporan/Kantor Perwakilan Bank \nIndonesia _____* \n \nPerihal: \nPenyampaian Laporan/Koreksi Laporan* Secara Luring \n \n \nSehubungan dengan gangguan teknis yang kami alami pada tanggal \n___________ yaitu ___________, bersama ini kami sampaikan Laporan/koreksi \nLaporan secara luring terlampir  dengan rincian sebagai berikut: \nNo \nSandi \nPelapor \nPeriode \nData \nNama File Laporan/Koreksi Laporan \nJumlah Baris \n1 \n \n \n \n \n2 \n \n \n \n \n3 \n \n \n \n \n\u2026 \n\u2026 \n \n\u2026 \n \n \nSelain itu, terlampir juga kami sertakan dokumen sebagai bukti dan penjelasan \nterkait adanya gangguan teknis tersebut. \nDemikian Laporan/koreksi Laporan* secara luring ini kami sampaikan. \nTerima kasih.",
            "DOC NAME: CIRCULAR LETTER NO. 9/3/DPM COMMERCIAL BANK DAILY REPORT AND MONEY MARKET INFORMATION CENTER CHARGES  AND APPENDIX | Bank Indonesia Circular Letters",
            "DOC NAME: SURAT EDARAN BANK INDONESIA NO. 15/20/DKBU TANGGAL 22 MEI 2013 PERIHAL LAPORAN BULANAN BANK PERKREDITAN RAKYAT | Surat Edaran\n\nLampiran SE. No. 15/20/DKBU tanggal 22 Mei 2013 \n \n \n \n \n \n81\n \n \n \n \nSelanjutnya akan muncul rincian form kredit yang diberikan : \n \n \nB. Penambahan Data \n1. Untuk menambahkan data dengan cara klik tombol tambah\ntambah\ntambah\ntambah maka kolom entri untuk di isi akan \nbertambah seperti tampilan berikut ini : \n \n2. Entry Rincian Kredit yang Diberikan \n \n \nC. Penyimpanan data \n1. Untuk penyimpanan data dengan cara klik tombol  simpan\nsimpan\nsimpan\nsimpan maka akan muncul pop up yang \nberisikan \u201c simpan data \u201cSeperti tampilan berikut ini :",
            "Penjelasan pengisian record header dan footer dapat dilihat pada \nformat laporan sebagaimana terdapat dalam Bab III. \n17. Dalam hal Bank menerima data dan keterangan dari Nasabah untuk \nmelengkapi laporan RTE yang telah disampaikan sebelumnya terkait \npenerimaan pembayaran di muka yang dibayar penuh dan \npembayaran di muka yang dibayar sebagian, Bank mencantumkan"
        ],
        "ground_truth": "Undang-Undang Nomor 21 Tahun 1998."
    },
    "50": {
        "question": "Berapa nilai eksposur minimum instrumen keuangan untuk bank devisa yang terkonsolidasi dengan anak perusahaan?",
        "answer": "Tidak ada informasi yang relevan dalam konteks yang diberikan untuk menjawab pertanyaan tersebut.",
        "contexts": [
            "Simpan Pinjam sebesar Rp25.000,00 (dua puluh \nlima ribu rupiah) per hari kerja keterlambatan, \npaling banyak sebesar Rp900.000,00 (sembilan \nratus ribu rupiah) untuk setiap kantor Pelapor. \n \n9. Di antara Pasal 33 dan Pasal 34 disisipkan 1 (satu) pasal, \nyakni Pasal 33A yang berbunyi sebagai berikut: \n \nPasal 33A \nPelapor yang menolak permintaan Debitur yang ingin \nmemperoleh Informasi Debitur atas nama Debitur yang \nbersangkutan sebagaimana dimaksud dalam Pasal 24 ayat \n(1), dikenakan sanksi teguran tertulis.",
            "dipenuhi \noleh \nQuoting \nBank \ntidak \nmelebihi \nRp10.000.000.000,00 (sepuluh miliar rupiah) per hari; dan \ne. availability of fund dan credit limit dari Quoting Bank kepada \nAsking Bank. \n3. Dalam hal Quoting Bank tidak memenuhi kewajiban sebagaimana \ndimaksud dalam angka 2, Asking Bank harus menyampaikan \ninformasi mengenai penolakan tersebut secara tertulis dengan \ndisertai bukti-bukti pendukung kepada Bank Indonesia c.q. Pusat \nProgram Transformasi Bank Indonesia, Program Pendalaman \nPasar Keuangan, paling lama 5 (lima) Hari Kerja sejak tanggal \npenolakan. \n \n \nVI. TATA CARA PENGENAAN SANKSI \nDalam hal Quoting Bank tidak memenuhi permintaan transaksi (deal) \ndari Asking Bank sebagaimana dimaksud dalam butir V.2, Bank \nIndonesia mengenakan sanksi teguran tertulis melalui tata cara \nsebagai berikut:  \na. berdasarkan\u2026",
            "Rp1.300.000,00 (satu juta tiga ratus ribu rupiah). \n \n9. \nSanksi Kewajiban Membayar Kepada Pelapor atas Koreksi Penyampaian \nLaporan di Luar Batas Periode Keterlambatan atas Inisiatif Pelapor dan \nTemuan Otoritas. \na. \nPeriode Penyampaian Harian: \nBank Z menyampaikan koreksi Laporan berupa informasi transaksi \nsurat berharga dan sertifikat deposito di pasar sekunder dalam \nkelompok informasi keuangan di luar batas periode keterlambatan \natas inisiatif Bank Z sebanyak 10 (sepuluh) baris dan atas hasil \npengawasan Bank Indonesia terhadap Laporan Bank Z sebanyak 15 \n(lima belas) baris pada tanggal 20 Desember 2021 untuk data tanggal \n12 Oktober 2021 yang tercantum dalam 1 (satu) surat pengantar \npenyampaian koreksi Laporan. Oleh karena itu, Bank Z dikenai sanksi \nadministratif berupa kewajiban membayar sebesar 10 (sepuluh) baris \nx Rp50.000,00 (lima puluh ribu rupiah) = Rp500.000,00 (lima ratus \nribu rupiah) untuk inisiatif Bank Z ditambah dengan 15 (lima belas)",
            "yang \ndinyatakan \ntidak \nmenyampaikan \nLaporan \nDebitur \nsebagaimana dimaksud dalam Pasal 12 ayat (2) dikenakan sanksi berupa \nkewajiban membayar dan penundaan pemberian informasi Debitur sampai \ndengan diterimanya Laporan Debitur dimaksud oleh Bank Indonesia. \n(2) Pengenaan sanksi kewajiban membayar sebagaimana dimaksud pada             \nayat (1) diatur sebagai berikut:  \na. \nbagi Bank Umum, sebesar Rp50.000.000,00 (lima puluh juta rupiah) \nper Laporan Debitur untuk setiap kantor Pelapor;  \n \n \nb. bagi \u2026",
            "- 18 - \n \nketerlambatan tersebut, Bank Pelapor dikenakan sanksi \nkewajiban membayar \nsebesar Rp500.000,00 x 1 form             \nx 2 Hari Kerja atau sebesar Rp1.000.000,00. \n \nPasal 23 \nKoreksi Laporan disampaikan oleh Bank Pelapor karena Bank \nPelapor tidak menyampaikan laporan secara lengkap dan benar.  \nContoh:  \n \nBank Pelapor menyampaikan koreksi laporan proyeksi arus kas \nuntuk periode tanggal 8-12 Oktober 2012 yang seharusnya \nditerima oleh Bank Indonesia pada hari Jumat tanggal 5 Oktober \n2012, namun diterima pada hari Selasa tanggal  9 Oktober 2012. \nAtas keterlambatan koreksi tersebut, Bank Pelapor dikenakan \nsanksi kewajiban membayar sebesar Rp50.000,00 x 1 form            \nx 2 Hari Kerja atau sebesar Rp100.000,00. \nBank Pelapor menyampaikan koreksi laporan Remittance TKI        \ndi luar negeri untuk bulan September 2012 yang seharusnya \nditerima oleh Bank Indonesia pada hari Jumat tanggal 5 Oktober \n2012, namun diterima pada hari Rabu tanggal 10 Oktober 2012."
        ],
        "ground_truth": "Rp20.000.000.000,00"
    },
    "51": {
        "question": "Apa yang dikecualikan dari cakupan Trading Book menurut Pasal 29?",
        "answer": "Tidak ada informasi yang relevan dalam konteks yang diberikan mengenai apa yang dikecualikan dari cakupan Trading Book menurut Pasal 29.",
        "contexts": [
            "Damaged Currency. \nb. The amount of replacement provided for Damaged Currency as \nreferred to in item V.2.a. is stipulated as follows: \n1) Bank Notes or Coins: \na) if the physical Currency greater than half of its original \nsize with Currency Identifying Marks recognizable for \ntheir authenticity, replacement shall be issued at face \nvalue; \nb) no replacement shall be issued for physical Currency equal \nto or less than half of its original size. \n2) Bank Notes made of plastic (polymer): \na) wrinkled but intact physical Currency having Currency \nIdentifying Marks with recognizable authenticity shall be \nreplaced at face value; \nb) wrinkled \u2026",
            "Pencabutan Peraturan Bank Indonesia mengenai Kredit \nLikuiditas Bank Indonesia terkait Kredit Program dan \nPeraturan Pelaksanaannya; \n \nMengingat \n: Undang-Undang Nomor 23 Tahun 1999 tentang Bank \nIndonesia (Lembaran Negara Republik Indonesia Tahun 1999 \nNomor 66,  Tambahan Lembaran  Negara  Republik Indonesia \nNomor 3843) sebagaimana telah beberapa kali  diubah  terakhir",
            "sanksi kewajiban membayar atas penyampaian Laporan secara \ntidak benar sebesar Rp50.000,00 x 10 item atau sebesar \nRp500.000,00. Atas keterlambatan penyampaian koreksi Laporan \nBank Pelapor tidak dikenakan sanksi kewajiban membayar. \nAyat (7)  \nCukup jelas. \nPasal 14 \nCukup jelas. \n \n \nPasal 15\u2026",
            "DOC NAME: SURAT EDARAN BANK INDONESIA NOMOR 16/3/DPTP TANGGAL 3 MARET 2014 PERIHAL PELAKSANAAN PENGALIHAN PENGELOLAAN KREDIT LIKUIDITAS BANK INDONESIA DALAM RANGKA KREDIT PROGRAM | Surat Edaran"
        ],
        "ground_truth": "Aset keuangan yang diukur pada nilai wajar melalui laporan laba rugi dan kredit yang diklasifikasikan dalam kelompok diperdagangkan."
    },
    "52": {
        "question": "Menurut Pasal 30, apa yang hanya termasuk dalam Trading Book?",
        "answer": "Tidak ada informasi yang spesifik mengenai apa yang termasuk dalam Trading Book menurut Pasal 30 dalam konteks yang diberikan.",
        "contexts": [
            "Rp1.300.000,00 (satu juta tiga ratus ribu rupiah). \n \n9. \nSanksi Kewajiban Membayar Kepada Pelapor atas Koreksi Penyampaian \nLaporan di Luar Batas Periode Keterlambatan atas Inisiatif Pelapor dan \nTemuan Otoritas. \na. \nPeriode Penyampaian Harian: \nBank Z menyampaikan koreksi Laporan berupa informasi transaksi \nsurat berharga dan sertifikat deposito di pasar sekunder dalam \nkelompok informasi keuangan di luar batas periode keterlambatan \natas inisiatif Bank Z sebanyak 10 (sepuluh) baris dan atas hasil \npengawasan Bank Indonesia terhadap Laporan Bank Z sebanyak 15 \n(lima belas) baris pada tanggal 20 Desember 2021 untuk data tanggal \n12 Oktober 2021 yang tercantum dalam 1 (satu) surat pengantar \npenyampaian koreksi Laporan. Oleh karena itu, Bank Z dikenai sanksi \nadministratif berupa kewajiban membayar sebesar 10 (sepuluh) baris \nx Rp50.000,00 (lima puluh ribu rupiah) = Rp500.000,00 (lima ratus \nribu rupiah) untuk inisiatif Bank Z ditambah dengan 15 (lima belas)",
            "Tidak ada sanksi kewajiban membayar\n\n23\n\nNota Debit tidak sesuai dengan ketentuan dan/atau perjanjian yang mendasarinya.\n\n\t\n\n\t\u221a\n\n\t\n\n\t-\n\n\t\n\n\t-\n\n\t\n\n\t-\n\n\t\n\n\tKeterangan:\n\n\t\tBank Indonesia mengenakan sanksi kewajiban membayar dimaksud kepada Bank Penagih atau Bank Tertarik yang merupakan pihak yang menyebabkan timbulnya penolakan atas Warkat Debit dan/atau DKE Warkat Debit. Dalam hal pihak yang menyebabkan terjadinya penolakan tersebut adalah nasabah, Bank Penagih atau Bank Tertarik dapat membebankan sanksi kewajiban membayar dimaksud kepada nasabah sesuai dengan Daftar Alasan Penolakan Dan Sanksi Kewajiban Membayar Atas Penolakan Warkat Debit Dan/Atau DKE Warkat Debit.\n\n\t\tBank Penagih adalah Bank yang melakukan penagihan Warkat Debit dan/atau DKE Warkat Debit kepada Bank Tertarik melalui Kliring penyerahan untuk kepentingan Pemegang.",
            "telah  diubah dengan Undang-Undang Nomor 3 \nTahun 2004, Bank Indonesia tidak dapat lagi \nmemberikan Kredit Likuiditas dalam rangka kredit \nprogram, \ntermasuk \nkredit \nlikuiditas \nkepada \nPerusahaan ....",
            "Damaged Currency. \nb. The amount of replacement provided for Damaged Currency as \nreferred to in item V.2.a. is stipulated as follows: \n1) Bank Notes or Coins: \na) if the physical Currency greater than half of its original \nsize with Currency Identifying Marks recognizable for \ntheir authenticity, replacement shall be issued at face \nvalue; \nb) no replacement shall be issued for physical Currency equal \nto or less than half of its original size. \n2) Bank Notes made of plastic (polymer): \na) wrinkled but intact physical Currency having Currency \nIdentifying Marks with recognizable authenticity shall be \nreplaced at face value; \nb) wrinkled \u2026",
            "LAMPIRAN III \nPERATURAN ANGGOTA DEWAN GUBERNUR \nNOMOR 24/15/PADG/2022 \nTANGGAL 31 OKTOBER 2022 \nTENTANG  \nLAPORAN PEMBAWAAN UANG KERTAS ASING \nKE DALAM DAN KE LUAR DAERAH PABEAN \nINDONESIA \n \nSURAT PEMBERITAHUAN  \nPENYAMPAIAN LAPORAN DAN KOREKSI LAPORAN SECARA LURING \n \nKepada \nDepartemen Pengelolaan dan Kepatuhan Laporan/Kantor Perwakilan Bank \nIndonesia _____* \n \nPerihal: \nPenyampaian Laporan/Koreksi Laporan* Secara Luring \n \n \nSehubungan dengan gangguan teknis yang kami alami pada tanggal \n___________ yaitu ___________, bersama ini kami sampaikan Laporan/koreksi \nLaporan secara luring terlampir  dengan rincian sebagai berikut: \nNo \nSandi \nPelapor \nPeriode \nData \nNama File Laporan/Koreksi Laporan \nJumlah Baris \n1 \n \n \n \n \n2 \n \n \n \n \n3 \n \n \n \n \n\u2026 \n\u2026 \n \n\u2026 \n \n \nSelain itu, terlampir juga kami sertakan dokumen sebagai bukti dan penjelasan \nterkait adanya gangguan teknis tersebut. \nDemikian Laporan/koreksi Laporan* secara luring ini kami sampaikan. \nTerima kasih."
        ],
        "ground_truth": "Surat berharga yang diklasifikasikan dalam kelompok diperdagangkan."
    },
    "53": {
        "question": "Berapa bulan setelah merger, bank harus memperhitungkan Risiko Pasar dalam rasio KPMM?",
        "answer": "Bank tidak memiliki kewajiban untuk memperhitungkan Risiko Pasar dalam rasio KPMM setelah merger.",
        "contexts": [
            "Rp500.000,00 x 1 form x 31 Hari Kerja atau sebesar \nRp15.500.000,00 namun Pelapor dikenakan maksimal sanksi \nkewajiban membayar sebesar Rp7.500.000,00. \nAyat (2)  \nContoh:  \nPelapor menyampaikan koreksi Laporan data Penerbit Instrumen \nPrabayar untuk Laporan bulan Maret 2008, diterima oleh Bank \nIndonesia pada tanggal 17 April 2008. Atas keterlambatan koreksi \ntersebut Pelapor dikenakan sanksi kewajiban membayar sebesar \nRp50.000,00 x 1 form x 2 Hari Kerja atau sebesar Rp100.000,00; \ndan/atau \nPelapor menyampaikan koreksi Laporan Penerbit Instrumen \nPrabayar untuk Laporan bulan Maret 2008, diterima oleh Bank \nIndonesia pada tanggal 30 Mei 2008. Atas keterlambatan \npenyampaian\u2026",
            "teguran tertulis dan kewajiban membayar sebesar Rp250 juta per hari \npelanggaran dengan batas paling banyak sebesar Rp5 miliar per tahun \nkalender. Selain bentuk sanksi tersebut, terhadap  jenis pelanggaran tertentu \nakan dikenakan tambahan berupa dilakukan proses fit & proper test dan/atau \npenilaian tingkat kesehatan bank.",
            "- 2 - \nPerusahaan Umum Pegadaian;  \n \nb. bahwa Kredit Likuiditas kepada Perusahaan Umum \nPegadaian telah jatuh tempo dan telah dilunasi; \nc. bahwa \nberdasarkan \npertimbangan \nsebagaimana \ndimaksud dalam huruf a dan b di atas, dipandang \nperlu untuk melakukan pencabutan Surat Keputusan \nDireksi Bank Indonesia No.31/153/KEP/DIR tanggal \n20 November 1998 tentang Kredit Likuiditas \nKepada Perusahaan Umum Pegadaian Melalui      \nPT. Bank Ekspor Impor Indonesia (Persero), Surat \nKeputusan \nDireksi \nBank \nIndonesia \nNo.31/154/KEP/DIR tanggal 20 November 1998 \ntentang Kredit Likuiditas Kepada Perusahaan Umum \nPegadaian Melalui PT. Bank Bumi Daya (Persero), \ndan Surat Keputusan Direksi Bank Indonesia \nNo.31/155/KEP/DIR tanggal 20 November 1998 \ntentang Kredit Likuiditas Kepada Perusahaan Umum \nPegadaian Melalui PT. Bank Umum Koperasi \nIndonesia; \n \nMengingat \n: \n \nUndang-Undang Nomor 23 Tahun 1999 tentang Bank \nIndonesia (Lembaran Negara Republik Indonesia Tahun",
            "Bank dikenakan sanksi kewajiban membayar sebesar Repo Rate ditambah 200 \nbps dikalikan jumlah hari dengan nominal Nilai Pembelian Kembali sejak \nTanggal Jatuh Tempo sampai dengan pelunasan. \nSanksi \nkewajiban \nmembayar \n= \nNilai \npembelian \nkembali \nx \n(repo rate + 200bps) \nx \nJumlah hari \n360 \n= \nCNY1.003.444,44 \nx (4%  +  2%) \nx \n5 \n=  CNY836,20 \n360 \n \nd. Total kewajiban \nTotal \nkewajiban \n= \nNilai \npembelian \nkembali \n+ \nSanksi \nkewajiban \nmembayar \n=   CNY1.003.444,44  +  CNY836,20   =   CNY1.004.280,64 \ne. Total\u2026",
            "1 tahun 406201T Koreksi Kredit: Pembayaran konstruksi di Indonesia - lebih dari satu tahun 406202T Koreksi Kredit: Pembayaran konstruksi di luar negeri - sampai dengan 1 tahun 406101T Koreksi Kredit: Pembayaran konstruksi di luar negeri - lebih dari satu tahun 406102T Koreksi Kredit: Pembayaran asuransi jiwa - Pembayaran premi (premium earned) 407101T Koreksi Kredit: Pembayaran asuransi jiwa - Suplemen premi (premium supplements ) 407102T Koreksi Kredit: Pembayaran asuransi jiwa - Pembayaran klaim (claims received) 407103T Koreksi Kredit: Pembayaran asuransi jiwa - dikurangi: Premi reasuransi/retrosesi 407104T Koreksi Kredit: Pembayaran asuransi jiwa - Komisi diterima (commission received) 407105T Koreksi Kredit: Pembayaran asuransi non jiwa - Pembayaran premi (premium earned) 407201T Koreksi Kredit: Pembayaran asuransi non jiwa - Suplemen premi (premium supplements ) 407202T Koreksi Kredit: Pembayaran asuransi non jiwa - Pembayaran klaim (claims received) 407203T Koreksi Kredit:"
        ],
        "ground_truth": "7 bulan"
    },
    "54": {
        "question": "Menurut Pasal 34, apa pendekatan yang digunakan untuk menghitung ATMR untuk Risiko Operasional?",
        "answer": "Tidak ada informasi yang relevan dalam konteks yang diberikan mengenai pendekatan yang digunakan untuk menghitung ATMR (Adjusted Total Minimum Requirement) untuk Risiko Operasional menurut Pasal 34.",
        "contexts": [
            "Bank Indonesia kepada Nasabah. \n5. \nSurat penetapan sanksi administratif berupa denda dari \nBank Indonesia sebagaimana dimaksud dalam angka 4 \nantara lain mencantumkan jenis pelanggaran dan besarnya \ndenda yang harus dibayar, rekening Bank Indonesia tujuan",
            "LAMPIRAN III \nPERATURAN ANGGOTA DEWAN GUBERNUR \nNOMOR 24/23/PADG/2022 \nTANGGAL 30 DESEMBER 2022  \nTENTANG  \nLAPORAN PENYELENGGARA JASA \nPENGOLAHAN UANG RUPIAH \n \nFORMAT SURAT PEMBERITAHUAN  \nPENYAMPAIAN LAPORAN DAN/ATAU KOREKSI LAPORAN SECARA LURING \n \nKepada \nDepartemen Pengelolaan dan Kepatuhan Laporan/Kantor Perwakilan Dalam \nNegeri Bank Indonesia \u2026\u2026..  * \n \n \nPerihal: \nPenyampaian Laporan/Koreksi Laporan** Secara Luring \n \n \nSehubungan dengan gangguan teknis yang kami alami pada tanggal \n___________ yaitu ___________, bersama ini kami sampaikan Laporan/koreksi \nLaporan secara luring terlampir  dengan rincian sebagai berikut: \n \nNo \nSandi \nPelapor \nPeriode \nData \nNama File Laporan/Koreksi Laporan \n1 \n \n \n \n2 \n \n \n \n3 \n \n \n \n\u2026 \n\u2026 \n \n\u2026 \n \nSelain itu, terlampir juga kami sertakan dokumen sebagai bukti dan penjelasan \nterkait adanya gangguan teknis tersebut. \nDemikian Laporan/koreksi Laporan** secara luring ini kami sampaikan. \nTerima kasih. \n \n..., ..... (tempat & tanggal)",
            "dan/atau \nc. \nBank tidak dapat memberikan penjelasan, bukti, catatan, \ndan/atau dokumen lainnya yang terkait pada saat \nkegiatan pengawasan.  \n \nBAB VII \nPENYAMPAIAN HASIL PENGAWASAN DHE SDA \n \nPasal 46 \n(1) \nBank \nIndonesia \nmenyampaikan \nhasil \npengawasan \nterhadap Nasabah berupa Eksportir SDA terkait kewajiban \nsebagaimana dimaksud dalam Pasal 27 ayat (2) kepada: \na. \nKementerian Keuangan c.q. Direktorat Jenderal Bea \ndan Cukai (DJBC); dan \nb. \nkementerian dan/atau lembaga teknis terkait, \nuntuk ditindaklanjuti sesuai dengan kewenangan masing-\nmasing.",
            "DAFTAR SANDI JENIS TRANSAKSI PIUTANG ASURANSI \nFORM : C0007-C0008 \n  \n  \nDebet Premi Dibayar Dimuka \n124021A \nDebet Piutang Premi \n124022A \nDebet Piutang Reasuransi \n124023A \nDebet Piutang Retrosesi \n124024A \nDebet Piutang Klaim \n124025A \nKredit Premi Dibayar Dimuka \n224021A \nKredit Piutang Premi \n224022A \nKredit Piutang Reasuransi \n224023A \nKredit Piutang Retrosesi \n224024A \nKredit Piutang Klaim \n224025A \nAdjusment Debet Premi Dibayar Dimuka \n324021A \nAdjusment Debet Piutang Premi \n324022A \nAdjusment Debet Piutang Reasuransi \n324023A \nAdjusment Debet Piutang Retrosesi \n324024A \nAdjusment Debet Piutang Klaim \n324025A \nAdjusment Kredit Premi Dibayar Dimuka \n424021A \nAdjusment Kredit Piutang Premi \n424022A \nAdjusment Kredit Piutang Reasuransi \n424023A \nAdjusment Kredit Piutang Retrosesi \n424024A \nAdjusment Kredit Piutang Klaim \n424025A \nPerubahan Lain Debet Premi Dibayar Dimuka \n524021A \nPerubahan Lain Debet Piutang Premi \n524022A \nPerubahan Lain Debet Piutang Reasuransi \n524023A",
            "Pencabutan Peraturan Bank Indonesia mengenai Kredit \nLikuiditas Bank Indonesia terkait Kredit Program dan \nPeraturan Pelaksanaannya; \n \nMengingat \n: Undang-Undang Nomor 23 Tahun 1999 tentang Bank \nIndonesia (Lembaran Negara Republik Indonesia Tahun 1999 \nNomor 66,  Tambahan Lembaran  Negara  Republik Indonesia \nNomor 3843) sebagaimana telah beberapa kali  diubah  terakhir"
        ],
        "ground_truth": "Pendekatan Indikator Dasar, Pendekatan Standar, dan Pendekatan Pengukuran Lanjutan."
    },
    "55": {
        "question": "Risiko apa yang harus dipertimbangkan oleh bank secara individual dan terkonsolidasi dengan anak perusahaan menurut Pasal 35?",
        "answer": "Risiko yang harus dipertimbangkan oleh bank secara individual dan terkonsolidasi dengan anak perusahaan menurut Pasal 35 adalah risiko kredit, risiko pasar, risiko likuiditas, risiko operasional, dan risiko reputasi.\n\nSource: PERATURAN BANK INDONESIA NOMOR 18/21/PBI/2016 TENTANG PERUBAHAN ATAS PERATURAN BANK INDONESIA NOMOR 9/14/PBI/2007 TENTANG SISTEM INFORMASI DEBITUR (https://www.bi.go.id/id/publikasi/peraturan/Documents/pbi_182116.pdf#page=13)",
        "contexts": [
            "teguran tertulis dan kewajiban membayar sebesar Rp250 juta per hari \npelanggaran dengan batas paling banyak sebesar Rp5 miliar per tahun \nkalender. Selain bentuk sanksi tersebut, terhadap  jenis pelanggaran tertentu \nakan dikenakan tambahan berupa dilakukan proses fit & proper test dan/atau \npenilaian tingkat kesehatan bank.",
            "ketidakpuasan nasabah yang disebabkan oleh adanya potensi \nkerugian finansial \npada nasabah yang diduga \nkarena \nkesalahan atau kelalaian Bank. \nHuruf n \nYang dimaksud dengan \u201ctenaga kerja\u201d adalah tenaga kerja \nsebagaimana dimaksud dalam undang-undang mengenai \nketenagakerjaan.  \n \nPasal 5  . . .",
            "telah  diubah dengan Undang-Undang Nomor 3 \nTahun 2004, Bank Indonesia tidak dapat lagi \nmemberikan Kredit Likuiditas dalam rangka kredit \nprogram, \ntermasuk \nkredit \nlikuiditas \nkepada \nPerusahaan ....",
            "Bank Indonesia kepada Nasabah. \n5. \nSurat penetapan sanksi administratif berupa denda dari \nBank Indonesia sebagaimana dimaksud dalam angka 4 \nantara lain mencantumkan jenis pelanggaran dan besarnya \ndenda yang harus dibayar, rekening Bank Indonesia tujuan",
            "Simpan Pinjam sebesar Rp25.000,00 (dua puluh \nlima ribu rupiah) per hari kerja keterlambatan, \npaling banyak sebesar Rp900.000,00 (sembilan \nratus ribu rupiah) untuk setiap kantor Pelapor. \n \n9. Di antara Pasal 33 dan Pasal 34 disisipkan 1 (satu) pasal, \nyakni Pasal 33A yang berbunyi sebagai berikut: \n \nPasal 33A \nPelapor yang menolak permintaan Debitur yang ingin \nmemperoleh Informasi Debitur atas nama Debitur yang \nbersangkutan sebagaimana dimaksud dalam Pasal 24 ayat \n(1), dikenakan sanksi teguran tertulis."
        ],
        "ground_truth": "Risiko suku bunga dan/atau risiko nilai tukar."
    },
    "56": {
        "question": "Menurut Pasal 41, metode apa yang digunakan untuk menghitung ATMR untuk Risiko Pasar?",
        "answer": "Tidak ada informasi yang ditemukan dalam konteks yang menjelaskan metode yang digunakan untuk menghitung ATMR untuk Risiko Pasar menurut Pasal 41.",
        "contexts": [
            "kepada nasabah X dengan mengirimkan CTR baru sejumlah \nRp10.000.000,00 (sepuluh juta rupiah) yang dikirimkan \nkepada nasabah X dengan membayar jasa, bunga, imbalan, \natau kompensasi yang berlaku di Bank A ditambah 200 basis \npoint (2%) untuk 3 (tiga) hari kalender.",
            "Bank Indonesia kepada Nasabah. \n5. \nSurat penetapan sanksi administratif berupa denda dari \nBank Indonesia sebagaimana dimaksud dalam angka 4 \nantara lain mencantumkan jenis pelanggaran dan besarnya \ndenda yang harus dibayar, rekening Bank Indonesia tujuan",
            "masing-masing tenor yang ditawarkan.  \n \nPasal 184L \n(1) \nPeserta OPT Konvensional dan Lembaga Perantara \nhanya dapat mengajukan 1 (satu) kali koreksi untuk \nsetiap penawaran yang diajukan dalam window time \nTransaksi DNDF secara lelang. \n(2) \nKoreksi sebagaimana dimaksud pada ayat (1) dapat \ndilakukan \nterhadap \ninformasi \nsebagaimana \ndimaksud dalam Pasal 184C ayat (1) kecuali \ninformasi nama Peserta OPT Konvensional dan tenor \nTransaksi DNDF secara lelang. \n(3) \nDalam hal dilakukan koreksi sebagaimana dimaksud \npada ayat (1) atas jumlah penawaran (nilai nominal), \njumlah penawaran (nilai nominal) tersebut harus",
            "dalam \nbutir \nXI.C.1 \ndikenakan \nsanksi \nadministratif berupa teguran tertulis. \n4. \nBagi Peserta yang tidak mencetak Warkat Debit sesuai \ndengan spesifikasi teknis sebagaimana dimaksud dalam \nbutir XI.A.2, berlaku ketentuan sebagai berikut: \na.  Peserta ...",
            "Pencabutan Peraturan Bank Indonesia mengenai Kredit \nLikuiditas Bank Indonesia terkait Kredit Program dan \nPeraturan Pelaksanaannya; \n \nMengingat \n: Undang-Undang Nomor 23 Tahun 1999 tentang Bank \nIndonesia (Lembaran Negara Republik Indonesia Tahun 1999 \nNomor 66,  Tambahan Lembaran  Negara  Republik Indonesia \nNomor 3843) sebagaimana telah beberapa kali  diubah  terakhir"
        ],
        "ground_truth": "Metode Standar dan Model Internal."
    },
    "57": {
        "question": "Apa yang diperlukan jika bank menggunakan pendekatan yang disebutkan dalam Pasal 34, paragraf b atau c?",
        "answer": "Bank yang menggunakan pendekatan yang disebutkan dalam Pasal 34, paragraf b atau c perlu melakukan proses fit & proper test dan/atau penilaian tingkat kesehatan bank.\n\nSource: PERATURAN BANK INDONESIA NOMOR: 12/10/PBI/2010 - PERUBAHAN KETIGA ATAS PERATURAN BANK INDONESIA NOMOR 5/13/PBI/2003 TENTANG POSISI DEVISA NETO BANK UMUM\n(https://www.bi.go.id/id/publikasi/peraturan/Documents/d40ca498b87a457abcb60f9a356f9acdfaq_pbi_121011.pdf)",
        "contexts": [
            "teguran tertulis dan kewajiban membayar sebesar Rp250 juta per hari \npelanggaran dengan batas paling banyak sebesar Rp5 miliar per tahun \nkalender. Selain bentuk sanksi tersebut, terhadap  jenis pelanggaran tertentu \nakan dikenakan tambahan berupa dilakukan proses fit & proper test dan/atau \npenilaian tingkat kesehatan bank.",
            "Simpan Pinjam sebesar Rp25.000,00 (dua puluh \nlima ribu rupiah) per hari kerja keterlambatan, \npaling banyak sebesar Rp900.000,00 (sembilan \nratus ribu rupiah) untuk setiap kantor Pelapor. \n \n9. Di antara Pasal 33 dan Pasal 34 disisipkan 1 (satu) pasal, \nyakni Pasal 33A yang berbunyi sebagai berikut: \n \nPasal 33A \nPelapor yang menolak permintaan Debitur yang ingin \nmemperoleh Informasi Debitur atas nama Debitur yang \nbersangkutan sebagaimana dimaksud dalam Pasal 24 ayat \n(1), dikenakan sanksi teguran tertulis.",
            "surat pemberitahuan sanksi administratif berupa denda. \n4. Pelapor \ndiberikan \nkesempatan \nuntuk \nmenyampaikan \nkeberatan atas pengenaan sanksi administratif berupa \ndenda dalam jangka waktu 10 (sepuluh) Hari Kerja setelah \ntanggal \npenerbitan \nsurat \npemberitahuan \nsanksi \nadministratif berupa denda.  \n5. Surat penetapan sanksi administratif berupa denda dari \nBank \nIndonesia \nantara \nlain \nmencantumkan \njenis \npelanggaran, besarnya denda yang harus dibayar, dan \nrekening tujuan pembayaran sanksi administratif berupa \ndenda. \nE. PEMBAYARAN ...",
            "Damaged Currency. \nb. The amount of replacement provided for Damaged Currency as \nreferred to in item V.2.a. is stipulated as follows: \n1) Bank Notes or Coins: \na) if the physical Currency greater than half of its original \nsize with Currency Identifying Marks recognizable for \ntheir authenticity, replacement shall be issued at face \nvalue; \nb) no replacement shall be issued for physical Currency equal \nto or less than half of its original size. \n2) Bank Notes made of plastic (polymer): \na) wrinkled but intact physical Currency having Currency \nIdentifying Marks with recognizable authenticity shall be \nreplaced at face value; \nb) wrinkled \u2026",
            "masing-masing tenor yang ditawarkan.  \n \nPasal 184L \n(1) \nPeserta OPT Konvensional dan Lembaga Perantara \nhanya dapat mengajukan 1 (satu) kali koreksi untuk \nsetiap penawaran yang diajukan dalam window time \nTransaksi DNDF secara lelang. \n(2) \nKoreksi sebagaimana dimaksud pada ayat (1) dapat \ndilakukan \nterhadap \ninformasi \nsebagaimana \ndimaksud dalam Pasal 184C ayat (1) kecuali \ninformasi nama Peserta OPT Konvensional dan tenor \nTransaksi DNDF secara lelang. \n(3) \nDalam hal dilakukan koreksi sebagaimana dimaksud \npada ayat (1) atas jumlah penawaran (nilai nominal), \njumlah penawaran (nilai nominal) tersebut harus"
        ],
        "ground_truth": "Persetujuan terlebih dahulu dari Bank Indonesia."
    },
    "58": {
        "question": "Apa yang harus dilakukan bank jika harga pasar tidak tersedia menurut Pasal 37, paragraf 4?",
        "answer": "Bank harus mengajukan koreksi atas penawaran yang diajukan dalam window time Transaksi DNDF secara lelang jika harga pasar tidak tersedia menurut Pasal 37, paragraf 4.\n\nSource: PERATURAN ANGGOTA DEWAN GUBERNUR NOMOR 20/29/PADG/2018 TENTANG PERUBAHAN ATAS PERATURAN ANGGOTA DEWAN GUBERNUR NOMOR 20/6/PADG/2018 TENTANG PELAKSANAAN OPERASI PASAR TERBUKA\n(https://www.bi.go.id/id/publikasi/peraturan/Documents/PADG_202918.pdf#page=17)",
        "contexts": [
            "masing-masing tenor yang ditawarkan.  \n \nPasal 184L \n(1) \nPeserta OPT Konvensional dan Lembaga Perantara \nhanya dapat mengajukan 1 (satu) kali koreksi untuk \nsetiap penawaran yang diajukan dalam window time \nTransaksi DNDF secara lelang. \n(2) \nKoreksi sebagaimana dimaksud pada ayat (1) dapat \ndilakukan \nterhadap \ninformasi \nsebagaimana \ndimaksud dalam Pasal 184C ayat (1) kecuali \ninformasi nama Peserta OPT Konvensional dan tenor \nTransaksi DNDF secara lelang. \n(3) \nDalam hal dilakukan koreksi sebagaimana dimaksud \npada ayat (1) atas jumlah penawaran (nilai nominal), \njumlah penawaran (nilai nominal) tersebut harus",
            "Sanction of \nfinancial penalty \n= \nRepurchase value \nx \n(repo rate + \n200bps) x \nNumber of \ndays/360 \n \n= CNY1,003,444.44 x (4% + 2%) x 5/360 = CNY836.20 \nd. \nTotal liabilities",
            "\uf0a7 Perumusan tingkat risiko yang akan diambil (risk appetite) dan toleransi risiko (risk tolerance) kurang memadai tetapi dan tidak sejalan dengan sasaran strategis dan strategi bisnis Bank secara keseluruhan.\n\uf0a7 Kelemahan signifikan pada awarenessdan pemahaman Dewan Komisaris dan Direksi mengenai manajemen Risiko Kredit.\n\uf0a7 Budaya manajemen Risiko Kredit kurang kuat dan belum diinternalisasikan pada setiap level satuan kerja.\n\uf0a7 Pelaksanaan tugas Komisaris dan Direksi secara keseluruhan kurang memadai.",
            "224 \n \nKeterangan \nSJT \nkonsultan asuransi dan dana pensiun, jasa evaluasi dan \npenilai kerugian, dan jasa aktuarial. \n \n \n15 Penerimaan jasa keuangan \n \n108000T \n \n \nMeliputi penerimaan atas penyediaan jasa perantara \nkeuangan dan jasa pendukung lainnya yang terkait dengan \nlembaga keuangan, seperti: (1) fee jasa intermediasi terkait \ndengan letters of credit, bankers' acceptances,penyediaan \nfasilitas kredit, leasing, dan transaksi jual beli valuta asing; \n(2) komisi serta fee lainnya terkait dengan transaksi surat-\nsurat berharga, misalnya broker, placements of issues, \nunderwriting, redemption, dan financial derivative; (3) komisi \nuntuk pedagang bursa komoditi; dan (4) jasa terkait dengan \nmanajemen aset, penasehat investasi, operasional dan \npengaturan \npasar \nfinansial, \npenjaminan \nemisi, \ndan \nkustodian. \n \n \n \n \n \n \n \n \n \n \n \n \n \n \n16 Penerimaan atas penggunaan hak kekayaan intelektual \n110000T \n \n \nMeliputi penerimaan atas penggunaan (termasuk reproduksi",
            "128 \n \n \n5) Penerimaan \u2026 \n6) Pembayaran Lainnya \n \n \n \n \n20900 \nPenjelasan masing-masing perkiraan tersebut di atas adalah sebagai \nberikut: \na.  \nSandi Penambahan Rekening Pemerintah \n1) \nDropping Gaji \nDropping Gaji adalah pencairan dana yang bersumber dari \npendapatan APBN yang diperuntukkan untuk membayar \njasa (gaji) pegawai sektor pemerintah termasuk lembaga \nnegara, TNI, departemen, instansi pemerintah pusat dan \npemerintah daerah, kantor dinas, jawatan, dan lainnya.  \n2) \nDropping Termin Proyek/Belanja Modal \nPembayaran Termin Proyek/Belanja Modal yang dimaksud \ndalam pedoman ini adalah pencairan dana yang bersumber \ndari APBN untuk tujuan membayar transaksi pemerintah \npusat dalam rangka pelaksanaan proyek pembangunan dan \npembelanjaan barang modal.  \n3) \nDropping Subsidi \nSubsidi adalah pembayaran subsidi yang sumber dananya \nberasal dari APBN, dari pemerintah pusat kepada lembaga-\nlembaga pemerintah atau lembaga lain yang ditunjuk dalam"
        ],
        "ground_truth": "Menggunakan model/teknik penilaian berdasarkan prinsip kehati-hatian."
    },
    "59": {
        "question": "Seberapa sering proses valuasi harus diverifikasi menurut Pasal 38?",
        "answer": "Proses valuasi harus diverifikasi setiap tahun menurut Pasal 38.\n\nSource: PERATURAN BANK INDONESIA NO. 17/8/PBI/2015 TANGGAL 29 MEI 2015 TENTANG PENGATURAN DAN PENGAWASAN MONETER (https://www.bi.go.id/id/publikasi/peraturan/Documents/pbi_170815.pdf#page=7)",
        "contexts": [
            "teguran tertulis dan kewajiban membayar sebesar Rp250 juta per hari \npelanggaran dengan batas paling banyak sebesar Rp5 miliar per tahun \nkalender. Selain bentuk sanksi tersebut, terhadap  jenis pelanggaran tertentu \nakan dikenakan tambahan berupa dilakukan proses fit & proper test dan/atau \npenilaian tingkat kesehatan bank.",
            "a. \ntidak memiliki kredit macet; dan \nb. \ntidak pernah dinyatakan pailit atau menjadi direksi atau komisaris yang \ndinyatakan bersalah menyebabkan suatu perseroan dinyatakan pailit, dalam \nwaktu 5 (lima) tahun terakhir sebelum dicalonkan. \n \n \n \n \n \nBagian   . . .",
            "atau sebesar Rp5.000.000,00 namun Pelapor dikenakan maksimal \nsanksi kewajiban membayar sebesar Rp1.000.000,00 untuk form \nLaporan Penerbit Instrumen Prabayar. \nAyat (4) \nContoh:  \nPelapor menyampaikan koreksi Laporan terhadap 18 (delapan \nbelas) item kesalahan Laporan Penerbit Instrumen Prabayar untuk \nPeriode Laporan bulan Maret 2008, diterima oleh Bank Indonesia \npada tanggal 17 April 2008. Terhadap pelanggaran keterlambatan \nkoreksi Laporan tersebut, Pelapor dikenakan sanksi kewajiban \nmembayar sebesar Rp50.000,00 x 1 form x 2 Hari Kerja atau \nsebesar Rp100.000,00. Atas penyampaian Laporan secara tidak \nbenar\u2026",
            "pemeriksaan yang melanggar Pasal 10 ayat (2) dikenakan sanksi \nadministratif berupa: \na. \nteguran tertulis; \nb. \nrekomendasi \nuntuk \ndikeluarkan \ndari \ndaftar \nprofesi \nyang \nmemberikan jasa di sektor keuangan yang dikeluarkan oleh \ninstansi yang berwenang; dan/atau \nc. \nrekomendasi pencabutan izin usaha kepada instansi yang \nberwenang.  \n \n \n \n \nBAB ...",
            "- 2 - \nPerusahaan Umum Pegadaian;  \n \nb. bahwa Kredit Likuiditas kepada Perusahaan Umum \nPegadaian telah jatuh tempo dan telah dilunasi; \nc. bahwa \nberdasarkan \npertimbangan \nsebagaimana \ndimaksud dalam huruf a dan b di atas, dipandang \nperlu untuk melakukan pencabutan Surat Keputusan \nDireksi Bank Indonesia No.31/153/KEP/DIR tanggal \n20 November 1998 tentang Kredit Likuiditas \nKepada Perusahaan Umum Pegadaian Melalui      \nPT. Bank Ekspor Impor Indonesia (Persero), Surat \nKeputusan \nDireksi \nBank \nIndonesia \nNo.31/154/KEP/DIR tanggal 20 November 1998 \ntentang Kredit Likuiditas Kepada Perusahaan Umum \nPegadaian Melalui PT. Bank Bumi Daya (Persero), \ndan Surat Keputusan Direksi Bank Indonesia \nNo.31/155/KEP/DIR tanggal 20 November 1998 \ntentang Kredit Likuiditas Kepada Perusahaan Umum \nPegadaian Melalui PT. Bank Umum Koperasi \nIndonesia; \n \nMengingat \n: \n \nUndang-Undang Nomor 23 Tahun 1999 tentang Bank \nIndonesia (Lembaran Negara Republik Indonesia Tahun"
        ],
        "ground_truth": "Sekurang-kurangnya satu kali dalam satu bulan."
    }
}